reading from file aufgabeEins-7-0.pcap, link-type IEEE802_11 (802.11)
0.003039 IP 10.1.1.5.654 > 10.1.1.255.654:  aodv rreq 24  hops 2 id 0x00000001
	dst 10.1.1.8 seq 0 src 10.1.1.1 seq 1
0.003089 ARP, Request who-has 10.1.1.5 (ff:ff:ff:ff:ff:ff) tell 10.1.1.8, length 32
0.004931 IP 10.1.1.6.654 > 10.1.1.255.654:  aodv rreq 24  hops 4 id 0x00000001
	dst 10.1.1.8 seq 0 src 10.1.1.1 seq 1
0.024864 IP 10.1.1.5.654 > 10.1.1.255.654:  aodv rrep 20  prefix 0 hops 0
	dst 10.1.1.5 dseq 0 src 10.1.1.5 2000 ms
0.058000 IP 10.1.1.8.654 > 10.1.1.255.654:  aodv rrep 20  prefix 0 hops 0
	dst 10.1.1.8 dseq 0 src 10.1.1.8 2000 ms
0.065864 IP 10.1.1.7.654 > 10.1.1.255.654:  aodv rrep 20  prefix 0 hops 0
	dst 10.1.1.7 dseq 0 src 10.1.1.7 2000 ms
0.075864 IP 10.1.1.6.654 > 10.1.1.255.654:  aodv rrep 20  prefix 0 hops 0
	dst 10.1.1.6 dseq 0 src 10.1.1.6 2000 ms
1.003039 ARP, Request who-has 10.1.1.5 (ff:ff:ff:ff:ff:ff) tell 10.1.1.8, length 32
1.005382 ARP, Reply 10.1.1.5 is-at 00:00:00:00:00:05, length 32
1.005392 Acknowledgment RA:00:00:00:00:00:05 
1.005746 IP 10.1.1.8.654 > 10.1.1.5.654:  aodv rrep 20  prefix 0 hops 0
	dst 10.1.1.8 dseq 0 src 10.1.1.1 11199 ms
1.006222 IP 10.1.1.8.654 > 10.1.1.5.654:  aodv rrep 20  prefix 0 hops 0
	dst 10.1.1.8 dseq 0 src 10.1.1.1 11199 ms
1.007401 Acknowledgment RA:00:00:00:00:00:08 
1.008295 ARP, Request who-has 10.1.1.2 (ff:ff:ff:ff:ff:ff) tell 10.1.1.5, length 32
1.010108 Acknowledgment RA:00:00:00:00:00:02 
1.011498 IP 10.1.1.5.654 > 10.1.1.2.654:  aodv rrep 20  prefix 0 hops 1
	dst 10.1.1.8 dseq 0 src 10.1.1.1 11199 ms
1.017832 ARP, Reply 10.1.1.5 is-at 00:00:00:00:00:05, length 32
1.019406 ARP, Reply 10.1.1.5 is-at 00:00:00:00:00:05, length 32
1.020885 Acknowledgment RA:00:00:00:00:00:02 
1.021799 ARP, Request who-has 10.1.1.8 (ff:ff:ff:ff:ff:ff) tell 10.1.1.5, length 32
1.021849 ARP, Reply 10.1.1.8 is-at 00:00:00:00:00:08, length 32
1.022868 Acknowledgment RA:00:00:00:00:00:08 
1.024812 IP 10.1.1.1.49153 > 10.1.1.8.9: Flags [S], seq 0, win 65535, length 0
1.024822 Acknowledgment RA:00:00:00:00:00:05 
1.026061 IP 10.1.1.5.654 > 10.1.1.255.654:  aodv rrep 20  prefix 0 hops 0
	dst 10.1.1.5 dseq 0 src 10.1.1.5 2000 ms
1.026151 IP 10.1.1.8.9 > 10.1.1.1.49153: Flags [S.], seq 0, ack 1, win 65535, length 0
1.026962 Acknowledgment RA:00:00:00:00:00:08 
1.027812 IP 10.1.1.8.9 > 10.1.1.1.49153: Flags [S.], seq 0, ack 1, win 65535, length 0
1.031719 Acknowledgment RA:00:00:00:00:00:02 
1.032385 IP 10.1.1.1.49153 > 10.1.1.8.9: Flags [.], ack 1, win 65535, length 0
1.032395 Acknowledgment RA:00:00:00:00:00:05 
1.057900 IP 10.1.1.8.654 > 10.1.1.255.654:  aodv rrep 20  prefix 0 hops 0
	dst 10.1.1.8 dseq 0 src 10.1.1.8 2000 ms
1.072754 IP 10.1.1.1.49153 > 10.1.1.8.9: Flags [.], seq 1:1461, ack 1, win 65535, length 1460
1.072764 Acknowledgment RA:00:00:00:00:00:05 
1.073118 IP 10.1.1.8.9 > 10.1.1.1.49153: Flags [.], ack 1461, win 65535, length 0
1.074233 Acknowledgment RA:00:00:00:00:00:08 
1.075163 IP 10.1.1.8.9 > 10.1.1.1.49153: Flags [.], ack 1461, win 65535, length 0
1.076571 IP 10.1.1.7.654 > 10.1.1.255.654:  aodv rrep 20  prefix 0 hops 0
	dst 10.1.1.7 dseq 0 src 10.1.1.7 2000 ms
1.077645 IP 10.1.1.6.654 > 10.1.1.255.654:  aodv rrep 20  prefix 0 hops 0
	dst 10.1.1.6 dseq 0 src 10.1.1.6 2000 ms
1.126789 Acknowledgment RA:00:00:00:00:00:02 
1.148058 Acknowledgment RA:00:00:00:00:00:02 
1.160708 IP 10.1.1.1.49153 > 10.1.1.8.9: Flags [.], seq 1461:2921, ack 1, win 65535, length 1460
1.160718 Acknowledgment RA:00:00:00:00:00:05 
1.180359 IP 10.1.1.1.49153 > 10.1.1.8.9: Flags [.], seq 2921:4381, ack 1, win 65535, length 1460
1.180369 Acknowledgment RA:00:00:00:00:00:05 
1.180723 IP 10.1.1.8.9 > 10.1.1.1.49153: Flags [.], ack 4381, win 65535, length 0
1.181534 Acknowledgment RA:00:00:00:00:00:08 
1.182564 IP 10.1.1.8.9 > 10.1.1.1.49153: Flags [.], ack 4381, win 65535, length 0
1.200620 Acknowledgment RA:00:00:00:00:00:02 
1.221904 Acknowledgment RA:00:00:00:00:00:02 
1.234534 IP 10.1.1.1.49153 > 10.1.1.8.9: Flags [.], seq 4381:5841, ack 1, win 65535, length 1460
1.234544 Acknowledgment RA:00:00:00:00:00:05 
1.254534 Acknowledgment RA:00:00:00:00:00:02 
1.267504 IP 10.1.1.1.49153 > 10.1.1.8.9: Flags [.], seq 5841:7301, ack 1, win 65535, length 1460
1.267514 Acknowledgment RA:00:00:00:00:00:05 
1.267868 IP 10.1.1.8.9 > 10.1.1.1.49153: Flags [.], ack 7301, win 65535, length 0
1.268794 IP 10.1.1.8.9 > 10.1.1.1.49153: Flags [.], ack 7301, win 65535, length 0
1.269909 Acknowledgment RA:00:00:00:00:00:08 
1.282639 IP 10.1.1.1.49153 > 10.1.1.8.9: Flags [.], seq 7301:8761, ack 1, win 65535, length 1460
1.282649 Acknowledgment RA:00:00:00:00:00:05 
1.283884 IP 10.1.1.8.9 > 10.1.1.1.49153: Flags [.], ack 7301, win 65535, length 0
1.307658 Acknowledgment RA:00:00:00:00:00:02 
1.320328 IP 10.1.1.1.49153 > 10.1.1.8.9: Flags [.], seq 8761:10221, ack 1, win 65535, length 1460
1.320338 Acknowledgment RA:00:00:00:00:00:05 
1.320692 IP 10.1.1.8.9 > 10.1.1.1.49153: Flags [.], ack 10221, win 65535, length 0
1.321738 IP 10.1.1.8.9 > 10.1.1.1.49153: Flags [.], ack 10221, win 65535, length 0
1.322853 Acknowledgment RA:00:00:00:00:00:08 
1.328099 IP 10.1.1.8.9 > 10.1.1.1.49153: Flags [.], ack 10221, win 65535, length 0
1.341538 Acknowledgment RA:00:00:00:00:00:02 
1.359394 Acknowledgment RA:00:00:00:00:00:02 
1.371944 IP 10.1.1.1.49153 > 10.1.1.8.9: Flags [.], seq 10221:11681, ack 1, win 65535, length 1460
1.371954 Acknowledgment RA:00:00:00:00:00:05 
1.387983 Acknowledgment RA:00:00:00:00:00:02 
1.401797 Acknowledgment RA:00:00:00:00:00:02 
1.414347 IP 10.1.1.1.49153 > 10.1.1.8.9: Flags [.], seq 11681:13141, ack 1, win 65535, length 1460
1.414357 Acknowledgment RA:00:00:00:00:00:05 
1.414711 IP 10.1.1.8.9 > 10.1.1.1.49153: Flags [.], ack 13141, win 65535, length 0
1.415797 IP 10.1.1.8.9 > 10.1.1.1.49153: Flags [.], ack 13141, win 65535, length 0
1.416912 Acknowledgment RA:00:00:00:00:00:08 
1.439862 IP 10.1.1.1.49153 > 10.1.1.8.9: Flags [.], seq 13141:14601, ack 1, win 65535, length 1460
1.439872 Acknowledgment RA:00:00:00:00:00:05 
1.452807 IP 10.1.1.1.49153 > 10.1.1.8.9: Flags [.], seq 14601:16061, ack 1, win 65535, length 1460
1.452817 Acknowledgment RA:00:00:00:00:00:05 
1.453171 IP 10.1.1.8.9 > 10.1.1.1.49153: Flags [.], ack 16061, win 65535, length 0
1.454277 IP 10.1.1.8.9 > 10.1.1.1.49153: Flags [.], ack 16061, win 65535, length 0
1.455392 Acknowledgment RA:00:00:00:00:00:08 
1.466802 IP 10.1.1.8.9 > 10.1.1.1.49153: Flags [.], ack 13141, win 65535, length 0
1.468187 IP 10.1.1.8.9 > 10.1.1.1.49153: Flags [.], ack 16061, win 65535, length 0
1.482366 Acknowledgment RA:00:00:00:00:00:02 
1.494896 IP 10.1.1.1.49153 > 10.1.1.8.9: Flags [.], seq 16061:17521, ack 1, win 65535, length 1460
1.494906 Acknowledgment RA:00:00:00:00:00:05 
1.513288 Acknowledgment RA:00:00:00:00:00:02 
1.525818 IP 10.1.1.1.49153 > 10.1.1.8.9: Flags [.], seq 17521:18981, ack 1, win 65535, length 1460
1.525828 Acknowledgment RA:00:00:00:00:00:05 
1.526182 IP 10.1.1.8.9 > 10.1.1.1.49153: Flags [.], ack 18981, win 65535, length 0
1.527297 Acknowledgment RA:00:00:00:00:00:08 
1.540659 Acknowledgment RA:00:00:00:00:00:02 
1.553604 Acknowledgment RA:00:00:00:00:00:02 
1.566529 Acknowledgment RA:00:00:00:00:00:02 
1.580483 Acknowledgment RA:00:00:00:00:00:02 
1.593328 Acknowledgment RA:00:00:00:00:00:02 
1.594238 IP 10.1.1.8.9 > 10.1.1.1.49153: Flags [.], ack 18981, win 65535, length 0
1.611206 Acknowledgment RA:00:00:00:00:00:02 
1.624051 Acknowledgment RA:00:00:00:00:00:02 
1.636681 IP 10.1.1.1.49153 > 10.1.1.8.9: Flags [.], seq 18981:20441, ack 1, win 65535, length 1460
1.636691 Acknowledgment RA:00:00:00:00:00:05 
1.649686 IP 10.1.1.1.49153 > 10.1.1.8.9: Flags [.], seq 20441:21901, ack 1, win 65535, length 1460
1.649696 Acknowledgment RA:00:00:00:00:00:05 
1.650050 IP 10.1.1.8.9 > 10.1.1.1.49153: Flags [.], ack 21901, win 65535, length 0
1.651165 Acknowledgment RA:00:00:00:00:00:08 
1.664191 IP 10.1.1.1.49153 > 10.1.1.8.9: Flags [.], seq 21901:23361, ack 1, win 65535, length 1460
1.664201 Acknowledgment RA:00:00:00:00:00:05 
1.677530 Acknowledgment RA:00:00:00:00:00:02 
1.690100 IP 10.1.1.1.49153 > 10.1.1.8.9: Flags [.], seq 23361:24821, ack 1, win 65535, length 1460
1.690110 Acknowledgment RA:00:00:00:00:00:05 
1.690464 IP 10.1.1.8.9 > 10.1.1.1.49153: Flags [.], ack 24821, win 65535, length 0
1.691579 Acknowledgment RA:00:00:00:00:00:08 
1.705629 IP 10.1.1.1.49153 > 10.1.1.8.9: Flags [.], seq 24821:26281, ack 1, win 65535, length 1460
1.705639 Acknowledgment RA:00:00:00:00:00:05 
1.718574 IP 10.1.1.1.49153 > 10.1.1.8.9: Flags [.], seq 26281:27741, ack 1, win 65535, length 1460
1.718584 Acknowledgment RA:00:00:00:00:00:05 
1.718938 IP 10.1.1.8.9 > 10.1.1.1.49153: Flags [.], ack 27741, win 65535, length 0
1.720053 Acknowledgment RA:00:00:00:00:00:08 
1.732643 IP 10.1.1.1.49153 > 10.1.1.8.9: Flags [.], seq 27741:29201, ack 1, win 65535, length 1460
1.732653 Acknowledgment RA:00:00:00:00:00:05 
1.734946 IP 10.1.1.8.9 > 10.1.1.1.49153: Flags [.], ack 21901, win 65535, length 0
1.749660 Acknowledgment RA:00:00:00:00:00:02 
1.763513 Acknowledgment RA:00:00:00:00:00:02 
1.777407 Acknowledgment RA:00:00:00:00:00:02 
1.790017 IP 10.1.1.1.49153 > 10.1.1.8.9: Flags [.], seq 29201:30661, ack 1, win 65535, length 1460
1.790027 Acknowledgment RA:00:00:00:00:00:05 
1.790381 IP 10.1.1.8.9 > 10.1.1.1.49153: Flags [.], ack 30661, win 65535, length 0
1.791496 Acknowledgment RA:00:00:00:00:00:08 
1.792386 IP 10.1.1.8.9 > 10.1.1.1.49153: Flags [.], ack 24821, win 65535, length 0
1.812273 Acknowledgment RA:00:00:00:00:00:02 
1.813303 IP 10.1.1.8.9 > 10.1.1.1.49153: Flags [.], ack 27741, win 65535, length 0
1.829439 Acknowledgment RA:00:00:00:00:00:02 
1.844881 IP 10.1.1.1.49153 > 10.1.1.8.9: Flags [.], seq 30661:32121, ack 1, win 65535, length 1460
1.844891 Acknowledgment RA:00:00:00:00:00:05 
1.857726 IP 10.1.1.1.49153 > 10.1.1.8.9: Flags [.], seq 32121:33581, ack 1, win 65535, length 1460
1.857736 Acknowledgment RA:00:00:00:00:00:05 
1.858090 IP 10.1.1.8.9 > 10.1.1.1.49153: Flags [.], ack 33581, win 65535, length 0
1.858674 IP 10.1.1.8.9 > 10.1.1.1.49153: Flags [.], ack 33581, win 65535, length 0
1.860764 IP 10.1.1.8.9 > 10.1.1.1.49153: Flags [.], ack 33581, win 65535, length 0
1.862354 IP 10.1.1.8.9 > 10.1.1.1.49153: Flags [.], ack 33581, win 65535, length 0
1.868584 IP 10.1.1.8.9 > 10.1.1.1.49153: Flags [.], ack 33581, win 65535, length 0
1.870434 IP 10.1.1.8.9 > 10.1.1.1.49153: Flags [.], ack 33581, win 65535, length 0
1.892148 IP 10.1.1.1.49153 > 10.1.1.8.9: Flags [.], seq 33581:35041, ack 1, win 65535, length 1460
1.892158 Acknowledgment RA:00:00:00:00:00:05 
1.893613 IP 10.1.1.8.9 > 10.1.1.1.49153: Flags [.], ack 30661, win 65535, length 0
1.906758 IP 10.1.1.1.49153 > 10.1.1.8.9: Flags [.], seq 35041:36501, ack 1, win 65535, length 1460
1.906768 Acknowledgment RA:00:00:00:00:00:05 
1.919763 IP 10.1.1.1.49153 > 10.1.1.8.9: Flags [.], seq 36501:37961, ack 1, win 65535, length 1460
1.919773 Acknowledgment RA:00:00:00:00:00:05 
1.932607 IP 10.1.1.1.49153 > 10.1.1.8.9: Flags [.], seq 37961:39421, ack 1, win 65535, length 1460
1.932617 Acknowledgment RA:00:00:00:00:00:05 
1.943091 IP 10.1.1.8.9 > 10.1.1.1.49153: Flags [.], ack 33581, win 65535, length 0
1.944501 IP 10.1.1.8.9 > 10.1.1.1.49153: Flags [.], ack 36501, win 65535, length 0
1.946011 IP 10.1.1.8.9 > 10.1.1.1.49153: Flags [.], ack 36501, win 65535, length 0
1.947741 IP 10.1.1.8.9 > 10.1.1.1.49153: Flags [.], ack 36501, win 65535, length 0
1.950783 Acknowledgment RA:00:00:00:00:00:02 
1.952771 IP 10.1.1.8.9 > 10.1.1.1.49153: Flags [.], ack 36501, win 65535, length 0
1.953886 Acknowledgment RA:00:00:00:00:00:08 
1.954076 IP 10.1.1.8.9 > 10.1.1.1.49153: Flags [.], ack 39421, win 65535, length 0
1.955191 Acknowledgment RA:00:00:00:00:00:08 
1.978142 IP 10.1.1.1.49153 > 10.1.1.8.9: Flags [.], seq 39421:40881, ack 1, win 65535, length 1460
1.978152 Acknowledgment RA:00:00:00:00:00:05 
1.979387 IP 10.1.1.8.9 > 10.1.1.1.49153: Flags [.], ack 36501, win 65535, length 0
1.992606 Acknowledgment RA:00:00:00:00:00:02 
2.005611 Acknowledgment RA:00:00:00:00:00:02 
2.006541 IP 10.1.1.8.9 > 10.1.1.1.49153: Flags [.], ack 39421, win 65535, length 0
2.027690 Acknowledgment RA:00:00:00:00:00:02 
2.040280 IP 10.1.1.1.49153 > 10.1.1.8.9: Flags [.], seq 40881:42341, ack 1, win 65535, length 1460
2.040290 Acknowledgment RA:00:00:00:00:00:05 
2.040644 IP 10.1.1.8.654 > 10.1.1.255.654:  aodv rreq 24  hops 0 id 0x00000001
	dst 10.1.1.1 seq 1 src 10.1.1.8 seq 1
2.042295 ARP, Request who-has 10.1.1.8 (ff:ff:ff:ff:ff:ff) tell 10.1.1.7, length 32
2.043149 ARP, Request who-has 10.1.1.5 (ff:ff:ff:ff:ff:ff) tell 10.1.1.7, length 32
2.043239 ARP, Reply 10.1.1.8 is-at 00:00:00:00:00:08, length 32
2.043361 Acknowledgment RA:00:00:00:00:00:08 
2.043517 IP 10.1.1.7.654 > 10.1.1.8.654:  aodv rrep 20  prefix 0 hops 3
	dst 10.1.1.1 dseq 1 src 10.1.1.8 3321 ms
2.043527 Acknowledgment RA:00:00:00:00:00:07 
2.043615 ARP, Request who-has 10.1.1.7 (ff:ff:ff:ff:ff:ff) tell 10.1.1.8, length 32
2.045353 ARP, Reply 10.1.1.7 is-at 00:00:00:00:00:07, length 32
2.045363 Acknowledgment RA:00:00:00:00:00:07 
2.045717 IP 10.1.1.8.9 > 10.1.1.1.49153: Flags [.], ack 42341, win 65535, length 0
2.046832 Acknowledgment RA:00:00:00:00:00:08 
2.055138 ARP, Request who-has 10.1.1.8 (ff:ff:ff:ff:ff:ff) tell 10.1.1.6, length 32
2.055188 ARP, Reply 10.1.1.8 is-at 00:00:00:00:00:08, length 32
2.056574 ARP, Reply 10.1.1.8 is-at 00:00:00:00:00:08, length 32
2.057593 Acknowledgment RA:00:00:00:00:00:08 
2.057783 IP 10.1.1.8.654 > 10.1.1.255.654:  aodv rrep 20  prefix 0 hops 0
	dst 10.1.1.8 dseq 1 src 10.1.1.8 2000 ms
2.059462 ARP, Request who-has 10.1.1.7 (ff:ff:ff:ff:ff:ff) tell 10.1.1.6, length 32
2.059586 ARP, Reply 10.1.1.7 is-at 00:00:00:00:00:07, length 32
2.061884 IP 10.1.1.6.654 > 10.1.1.8.654:  aodv rrep 20  prefix 0 hops 4
	dst 10.1.1.1 dseq 1 src 10.1.1.8 3242 ms
2.061894 Acknowledgment RA:00:00:00:00:00:06 
2.062383 Acknowledgment RA:00:00:00:00:00:06 
2.064274 IP 10.1.1.7.654 > 10.1.1.255.654:  aodv rrep 20  prefix 0 hops 0
	dst 10.1.1.7 dseq 0 src 10.1.1.7 2000 ms
2.083586 IP 10.1.1.1.49153 > 10.1.1.8.9: Flags [.], seq 42341:43801, ack 1, win 65535, length 1460
2.083596 Acknowledgment RA:00:00:00:00:00:05 
2.084975 IP 10.1.1.6.654 > 10.1.1.255.654:  aodv rrep 20  prefix 0 hops 0
	dst 10.1.1.6 dseq 0 src 10.1.1.6 2000 ms
2.097865 IP 10.1.1.5.654 > 10.1.1.255.654:  aodv rrep 20  prefix 0 hops 0
	dst 10.1.1.5 dseq 0 src 10.1.1.5 2000 ms
2.110415 IP 10.1.1.1.49153 > 10.1.1.8.9: Flags [.], seq 43801:45261, ack 1, win 65535, length 1460
2.110425 Acknowledgment RA:00:00:00:00:00:05 
2.110779 IP 10.1.1.8.9 > 10.1.1.1.49153: Flags [.], ack 45261, win 65535, length 0
2.110890 Acknowledgment RA:00:00:00:00:00:08 
2.113455 IP 10.1.1.5.654 > 10.1.1.8.654:  aodv rrep 20  prefix 0 hops 2
	dst 10.1.1.1 dseq 1 src 10.1.1.8 3400 ms
2.113465 Acknowledgment RA:00:00:00:00:00:05 
2.114744 IP 10.1.1.5.654 > 10.1.1.2.654:  aodv rrep 20  prefix 0 hops 1
	dst 10.1.1.8 dseq 1 src 10.1.1.1 5519 ms
2.116477 ARP, Reply 10.1.1.5 is-at 00:00:00:00:00:05, length 32
2.116791 Acknowledgment RA:00:00:00:00:00:05 
2.116927 IP 10.1.1.7.654 > 10.1.1.5.654:  aodv rrep 20  prefix 0 hops 1
	dst 10.1.1.8 dseq 1 src 10.1.1.1 5519 ms
2.118741 IP 10.1.1.7.654 > 10.1.1.5.654:  aodv rrep 20  prefix 0 hops 1
	dst 10.1.1.8 dseq 1 src 10.1.1.1 5519 ms
2.120495 IP 10.1.1.7.654 > 10.1.1.5.654:  aodv rrep 20  prefix 0 hops 1
	dst 10.1.1.8 dseq 1 src 10.1.1.1 5519 ms
2.123029 IP 10.1.1.7.654 > 10.1.1.5.654:  aodv rrep 20  prefix 0 hops 1
	dst 10.1.1.8 dseq 1 src 10.1.1.1 5519 ms
2.127123 IP 10.1.1.7.654 > 10.1.1.5.654:  aodv rrep 20  prefix 0 hops 1
	dst 10.1.1.8 dseq 1 src 10.1.1.1 5519 ms
2.130697 IP 10.1.1.7.654 > 10.1.1.5.654:  aodv rrep 20  prefix 0 hops 1
	dst 10.1.1.8 dseq 1 src 10.1.1.1 5519 ms
2.131012 Acknowledgment RA:00:00:00:00:00:07 
2.131882 IP 10.1.1.8.9 > 10.1.1.1.49153: Flags [.], ack 42341, win 65535, length 0
2.132196 Acknowledgment RA:00:00:00:00:00:07 
2.133290 IP 10.1.1.7.654 > 10.1.1.5.654:  aodv rrep 20  prefix 0 hops 2
	dst 10.1.1.8 dseq 1 src 10.1.1.1 5519 ms
2.133605 Acknowledgment RA:00:00:00:00:00:07 
2.144797 IP 10.1.1.5.654 > 10.1.1.2.654:  aodv rrep 20  prefix 0 hops 2
	dst 10.1.1.8 dseq 1 src 10.1.1.1 5519 ms
2.146202 IP 10.1.1.8.9 > 10.1.1.1.49153: Flags [.], ack 42341, win 65535, length 0
2.147731 IP 10.1.1.5.654 > 10.1.1.2.654:  aodv rrep 20  prefix 0 hops 3
	dst 10.1.1.8 dseq 1 src 10.1.1.1 5519 ms
2.161450 Acknowledgment RA:00:00:00:00:00:02 
2.173980 IP 10.1.1.1.49153 > 10.1.1.8.9: Flags [.], seq 45261:46721, ack 1, win 65535, length 1460
2.173990 Acknowledgment RA:00:00:00:00:00:05 
2.187199 Acknowledgment RA:00:00:00:00:00:02 
2.199809 IP 10.1.1.1.49153 > 10.1.1.8.9: Flags [.], seq 46721:48181, ack 1, win 65535, length 1460
2.199819 Acknowledgment RA:00:00:00:00:00:05 
2.200173 IP 10.1.1.8.9 > 10.1.1.1.49153: Flags [.], ack 48181, win 65535, length 0
2.200805 IP 10.1.1.8.9 > 10.1.1.1.49153: Flags [.], ack 48181, win 65535, length 0
2.202715 IP 10.1.1.8.9 > 10.1.1.1.49153: Flags [.], ack 48181, win 65535, length 0
2.206365 IP 10.1.1.8.9 > 10.1.1.1.49153: Flags [.], ack 48181, win 65535, length 0
2.209597 IP 10.1.1.8.9 > 10.1.1.1.49153: Flags [.], ack 48181, win 65535, length 0
2.213088 Acknowledgment RA:00:00:00:00:00:02 
2.221832 IP 10.1.1.8.9 > 10.1.1.1.49153: Flags [.], ack 48181, win 65535, length 0
2.228991 Acknowledgment RA:00:00:00:00:00:02 
2.241541 IP 10.1.1.1.49153 > 10.1.1.8.9: Flags [.], seq 48181:49641, ack 1, win 65535, length 1460
2.241551 Acknowledgment RA:00:00:00:00:00:05 
2.254526 IP 10.1.1.1.49153 > 10.1.1.8.9: Flags [.], seq 49641:51101, ack 1, win 65535, length 1460
2.254536 Acknowledgment RA:00:00:00:00:00:05 
2.255810 IP 10.1.1.8.9 > 10.1.1.1.49153: Flags [.], ack 48181, win 65535, length 0
2.257020 IP 10.1.1.8.9 > 10.1.1.1.49153: Flags [.], ack 51101, win 65535, length 0
2.257632 IP 10.1.1.8.9 > 10.1.1.1.49153: Flags [.], ack 51101, win 65535, length 0
2.259722 IP 10.1.1.8.9 > 10.1.1.1.49153: Flags [.], ack 51101, win 65535, length 0
2.262312 IP 10.1.1.8.9 > 10.1.1.1.49153: Flags [.], ack 51101, win 65535, length 0
2.265124 IP 10.1.1.8.9 > 10.1.1.1.49153: Flags [.], ack 51101, win 65535, length 0
2.267745 Acknowledgment RA:00:00:00:00:00:02 
2.280275 IP 10.1.1.1.49153 > 10.1.1.8.9: Flags [.], seq 51101:52561, ack 1, win 65535, length 1460
2.280285 Acknowledgment RA:00:00:00:00:00:05 
2.281119 IP 10.1.1.8.9 > 10.1.1.1.49153: Flags [.], ack 51101, win 65535, length 0
2.293674 Acknowledgment RA:00:00:00:00:00:02 
2.306204 IP 10.1.1.1.49153 > 10.1.1.8.9: Flags [.], seq 52561:54021, ack 1, win 65535, length 1460
2.306214 Acknowledgment RA:00:00:00:00:00:05 
2.306688 IP 10.1.1.8.9 > 10.1.1.1.49153: Flags [.], ack 51101, win 65535, length 0
2.307803 Acknowledgment RA:00:00:00:00:00:08 
2.308113 IP 10.1.1.8.654 > 10.1.1.255.654:  aodv rreq 24  hops 0 id 0x00000002
	dst 10.1.1.1 seq 1 src 10.1.1.8 seq 2
2.310555 IP 10.1.1.7.654 > 10.1.1.8.654:  aodv rrep 20  prefix 0 hops 3
	dst 10.1.1.1 dseq 1 src 10.1.1.8 3054 ms
2.310565 Acknowledgment RA:00:00:00:00:00:07 
2.311294 IP 10.1.1.7.654 > 10.1.1.5.654:  aodv rrep 20  prefix 0 hops 1
	dst 10.1.1.8 dseq 2 src 10.1.1.1 5519 ms
2.311609 Acknowledgment RA:00:00:00:00:00:07 
2.311679 IP 10.1.1.8.9 > 10.1.1.1.49153: Flags [.], ack 54021, win 65535, length 0
2.312793 Acknowledgment RA:00:00:00:00:00:08 
2.313743 IP 10.1.1.8.9 > 10.1.1.1.49153: Flags [.], ack 54021, win 65535, length 0
2.314058 Acknowledgment RA:00:00:00:00:00:07 
2.320649 IP 10.1.1.8.9 > 10.1.1.1.49153: Flags [.], ack 51101, win 65535, length 0
2.321978 IP 10.1.1.5.654 > 10.1.1.8.654:  aodv rrep 20  prefix 0 hops 2
	dst 10.1.1.1 dseq 1 src 10.1.1.8 3133 ms
2.321988 Acknowledgment RA:00:00:00:00:00:05 
2.323551 IP 10.1.1.6.654 > 10.1.1.8.654:  aodv rrep 20  prefix 0 hops 4
	dst 10.1.1.1 dseq 1 src 10.1.1.8 2974 ms
2.323561 Acknowledgment RA:00:00:00:00:00:06 
2.336936 Acknowledgment RA:00:00:00:00:00:02 
2.337870 IP 10.1.1.5.654 > 10.1.1.2.654:  aodv rrep 20  prefix 0 hops 1
	dst 10.1.1.8 dseq 2 src 10.1.1.1 5519 ms
2.339119 IP 10.1.1.5.654 > 10.1.1.2.654:  aodv rrep 20  prefix 0 hops 2
	dst 10.1.1.8 dseq 2 src 10.1.1.1 5519 ms
2.340368 IP 10.1.1.6.654 > 10.1.1.7.654:  aodv rrep 20  prefix 0 hops 1
	dst 10.1.1.8 dseq 2 src 10.1.1.1 5519 ms
2.340682 Acknowledgment RA:00:00:00:00:00:06 
2.341596 IP 10.1.1.7.654 > 10.1.1.5.654:  aodv rrep 20  prefix 0 hops 2
	dst 10.1.1.8 dseq 2 src 10.1.1.1 5519 ms
2.341911 Acknowledgment RA:00:00:00:00:00:07 
2.354070 IP 10.1.1.8.9 > 10.1.1.1.49153: Flags [.], ack 54021, win 65535, length 0
2.366995 IP 10.1.1.1.49153 > 10.1.1.8.9: Flags [.], seq 54021:55481, ack 1, win 65535, length 1460
2.367005 Acknowledgment RA:00:00:00:00:00:05 
2.368384 IP 10.1.1.5.654 > 10.1.1.2.654:  aodv rrep 20  prefix 0 hops 3
	dst 10.1.1.8 dseq 2 src 10.1.1.1 5519 ms
2.381863 Acknowledgment RA:00:00:00:00:00:02 
2.394393 IP 10.1.1.1.49153 > 10.1.1.8.9: Flags [.], seq 55481:56941, ack 1, win 65535, length 1460
2.394403 Acknowledgment RA:00:00:00:00:00:05 
2.394757 IP 10.1.1.8.9 > 10.1.1.1.49153: Flags [.], ack 56941, win 65535, length 0
2.395872 Acknowledgment RA:00:00:00:00:00:08 
2.408208 IP 10.1.1.8.9 > 10.1.1.1.49153: Flags [.], ack 56941, win 65535, length 0
2.421927 Acknowledgment RA:00:00:00:00:00:02 
2.434457 IP 10.1.1.1.49153 > 10.1.1.8.9: Flags [.], seq 56941:58401, ack 1, win 65535, length 1460
2.434467 Acknowledgment RA:00:00:00:00:00:05 
2.447916 Acknowledgment RA:00:00:00:00:00:02 
2.460446 IP 10.1.1.1.49153 > 10.1.1.8.9: Flags [.], seq 58401:59861, ack 1, win 65535, length 1460
2.460456 Acknowledgment RA:00:00:00:00:00:05 
2.460810 IP 10.1.1.8.9 > 10.1.1.1.49153: Flags [.], ack 59861, win 65535, length 0
2.461925 Acknowledgment RA:00:00:00:00:00:08 
2.463159 IP 10.1.1.8.9 > 10.1.1.1.49153: Flags [.], ack 59861, win 65535, length 0
2.494386 Acknowledgment RA:00:00:00:00:00:02 
2.510660 IP 10.1.1.1.49153 > 10.1.1.8.9: Flags [.], seq 59861:61321, ack 1, win 65535, length 1460
2.510670 Acknowledgment RA:00:00:00:00:00:05 
2.525157 Acknowledgment RA:00:00:00:00:00:02 
2.552631 IP 10.1.1.1.49153 > 10.1.1.8.9: Flags [.], seq 61321:62781, ack 1, win 65535, length 1460
2.552641 Acknowledgment RA:00:00:00:00:00:05 
2.552995 IP 10.1.1.8.9 > 10.1.1.1.49153: Flags [.], ack 62781, win 65535, length 0
2.554110 Acknowledgment RA:00:00:00:00:00:08 
2.555216 IP 10.1.1.8.9 > 10.1.1.1.49153: Flags [.], ack 62781, win 65535, length 0
2.572875 Acknowledgment RA:00:00:00:00:00:02 
2.585405 IP 10.1.1.1.49153 > 10.1.1.8.9: Flags [.], seq 62781:64241, ack 1, win 65535, length 1460
2.585415 Acknowledgment RA:00:00:00:00:00:05 
2.600764 Acknowledgment RA:00:00:00:00:00:02 
2.613294 IP 10.1.1.1.49153 > 10.1.1.8.9: Flags [.], seq 64241:65701, ack 1, win 65535, length 1460
2.613304 Acknowledgment RA:00:00:00:00:00:05 
2.613658 IP 10.1.1.8.9 > 10.1.1.1.49153: Flags [.], ack 65701, win 65535, length 0
2.614773 Acknowledgment RA:00:00:00:00:00:08 
2.628402 IP 10.1.1.8.9 > 10.1.1.1.49153: Flags [.], ack 65701, win 65535, length 0
2.641641 Acknowledgment RA:00:00:00:00:00:02 
2.654191 IP 10.1.1.1.49153 > 10.1.1.8.9: Flags [.], seq 65701:67161, ack 1, win 65535, length 1460
2.654201 Acknowledgment RA:00:00:00:00:00:05 
2.667590 Acknowledgment RA:00:00:00:00:00:02 
2.680180 IP 10.1.1.1.49153 > 10.1.1.8.9: Flags [.], seq 67161:68621, ack 1, win 65535, length 1460
2.680190 Acknowledgment RA:00:00:00:00:00:05 
2.680544 IP 10.1.1.8.9 > 10.1.1.1.49153: Flags [.], ack 68621, win 65535, length 0
2.681659 Acknowledgment RA:00:00:00:00:00:08 
2.694015 IP 10.1.1.8.9 > 10.1.1.1.49153: Flags [.], ack 68621, win 65535, length 0
2.707794 Acknowledgment RA:00:00:00:00:00:02 
2.720324 IP 10.1.1.1.49153 > 10.1.1.8.9: Flags [.], seq 68621:70081, ack 1, win 65535, length 1460
2.720334 Acknowledgment RA:00:00:00:00:00:05 
2.733683 Acknowledgment RA:00:00:00:00:00:02 
2.746528 Acknowledgment RA:00:00:00:00:00:02 
2.759078 IP 10.1.1.1.49153 > 10.1.1.8.9: Flags [.], seq 70081:71541, ack 1, win 65535, length 1460
2.759088 Acknowledgment RA:00:00:00:00:00:05 
2.759442 IP 10.1.1.8.9 > 10.1.1.1.49153: Flags [.], ack 71541, win 65535, length 0
2.760090 IP 10.1.1.8.9 > 10.1.1.1.49153: Flags [.], ack 71541, win 65535, length 0
2.761880 IP 10.1.1.8.9 > 10.1.1.1.49153: Flags [.], ack 71541, win 65535, length 0
2.764550 IP 10.1.1.8.9 > 10.1.1.1.49153: Flags [.], ack 71541, win 65535, length 0
2.769300 IP 10.1.1.8.9 > 10.1.1.1.49153: Flags [.], ack 71541, win 65535, length 0
2.772357 Acknowledgment RA:00:00:00:00:00:02 
2.777107 IP 10.1.1.8.9 > 10.1.1.1.49153: Flags [.], ack 71541, win 65535, length 0
2.785262 Acknowledgment RA:00:00:00:00:00:02 
2.797852 IP 10.1.1.1.49153 > 10.1.1.8.9: Flags [.], seq 71541:73001, ack 1, win 65535, length 1460
2.797862 Acknowledgment RA:00:00:00:00:00:05 
2.810837 IP 10.1.1.1.49153 > 10.1.1.8.9: Flags [.], seq 73001:74461, ack 1, win 65535, length 1460
2.810847 Acknowledgment RA:00:00:00:00:00:05 
2.822561 IP 10.1.1.8.9 > 10.1.1.1.49153: Flags [.], ack 71541, win 65535, length 0
2.824016 Acknowledgment RA:00:00:00:00:00:02 
2.824326 IP 10.1.1.8.9 > 10.1.1.1.49153: Flags [.], ack 74461, win 65535, length 0
2.837436 IP 10.1.1.8.9 > 10.1.1.1.49153: Flags [.], ack 74461, win 65535, length 0
2.838966 IP 10.1.1.8.9 > 10.1.1.1.49153: Flags [.], ack 74461, win 65535, length 0
2.842416 IP 10.1.1.8.9 > 10.1.1.1.49153: Flags [.], ack 74461, win 65535, length 0
2.846686 IP 10.1.1.8.9 > 10.1.1.1.49153: Flags [.], ack 74461, win 65535, length 0
2.849985 Acknowledgment RA:00:00:00:00:00:02 
2.857235 IP 10.1.1.8.9 > 10.1.1.1.49153: Flags [.], ack 74461, win 65535, length 0
2.862870 Acknowledgment RA:00:00:00:00:00:02 
2.876811 Acknowledgment RA:00:00:00:00:00:02 
2.889461 IP 10.1.1.1.49153 > 10.1.1.8.9: Flags [.], seq 74461:75921, ack 1, win 65535, length 1460
2.889471 Acknowledgment RA:00:00:00:00:00:05 
2.890585 IP 10.1.1.8.9 > 10.1.1.1.49153: Flags [.], ack 74461, win 65535, length 0
2.915350 IP 10.1.1.1.49153 > 10.1.1.8.9: Flags [.], seq 75921:77381, ack 1, win 65535, length 1460
2.915360 Acknowledgment RA:00:00:00:00:00:05 
2.915714 IP 10.1.1.8.654 > 10.1.1.255.654:  aodv rreq 24  hops 0 id 0x00000003
	dst 10.1.1.1 seq 1 src 10.1.1.8 seq 3
2.916975 IP 10.1.1.7.654 > 10.1.1.8.654:  aodv rrep 20  prefix 0 hops 3
	dst 10.1.1.1 dseq 1 src 10.1.1.8 2446 ms
2.916985 Acknowledgment RA:00:00:00:00:00:07 
2.917519 IP 10.1.1.8.9 > 10.1.1.1.49153: Flags [.], ack 77381, win 65535, length 0
2.918633 Acknowledgment RA:00:00:00:00:00:08 
2.919098 IP 10.1.1.7.654 > 10.1.1.5.654:  aodv rrep 20  prefix 0 hops 1
	dst 10.1.1.8 dseq 3 src 10.1.1.1 5519 ms
2.919413 Acknowledgment RA:00:00:00:00:00:07 
2.919906 IP 10.1.1.8.9 > 10.1.1.1.49153: Flags [.], ack 77381, win 65535, length 0
2.921476 IP 10.1.1.8.9 > 10.1.1.1.49153: Flags [.], ack 77381, win 65535, length 0
2.921791 Acknowledgment RA:00:00:00:00:00:07 
2.941439 Acknowledgment RA:00:00:00:00:00:02 
2.954753 IP 10.1.1.1.49153 > 10.1.1.8.9: Flags [.], seq 77381:78841, ack 1, win 65535, length 1460
2.954763 Acknowledgment RA:00:00:00:00:00:05 
2.967952 Acknowledgment RA:00:00:00:00:00:02 
2.969006 IP 10.1.1.6.654 > 10.1.1.8.654:  aodv rrep 20  prefix 0 hops 4
	dst 10.1.1.1 dseq 1 src 10.1.1.8 2367 ms
2.969016 Acknowledgment RA:00:00:00:00:00:06 
2.994307 IP 10.1.1.1.49153 > 10.1.1.8.9: Flags [.], seq 78841:80301, ack 1, win 65535, length 1460
2.994317 Acknowledgment RA:00:00:00:00:00:05 
2.994671 IP 10.1.1.8.9 > 10.1.1.1.49153: Flags [.], ack 80301, win 65535, length 0
2.995785 Acknowledgment RA:00:00:00:00:00:08 
2.996138 IP 10.1.1.8.9 > 10.1.1.1.49153: Flags [.], ack 80301, win 65535, length 0
2.996453 Acknowledgment RA:00:00:00:00:00:07 
3.020422 IP 10.1.1.1.49153 > 10.1.1.8.9: Flags [.], seq 80301:81761, ack 1, win 65535, length 1460
3.020432 Acknowledgment RA:00:00:00:00:00:05 
3.020961 Acknowledgment RA:00:00:00:00:00:06 
3.021326 IP 10.1.1.7.654 > 10.1.1.5.654:  aodv rrep 20  prefix 0 hops 2
	dst 10.1.1.8 dseq 3 src 10.1.1.1 5519 ms
3.021640 Acknowledgment RA:00:00:00:00:00:07 
3.035559 Acknowledgment RA:00:00:00:00:00:02 
3.048404 Acknowledgment RA:00:00:00:00:00:02 
3.049358 IP 10.1.1.5.654 > 10.1.1.8.654:  aodv rrep 20  prefix 0 hops 2
	dst 10.1.1.1 dseq 1 src 10.1.1.8 2959 ms
3.049368 Acknowledgment RA:00:00:00:00:00:05 
3.054608 IP 10.1.1.5.654 > 10.1.1.2.654:  aodv rrep 20  prefix 0 hops 1
	dst 10.1.1.8 dseq 3 src 10.1.1.1 5519 ms
3.055977 IP 10.1.1.5.654 > 10.1.1.2.654:  aodv rrep 20  prefix 0 hops 2
	dst 10.1.1.8 dseq 3 src 10.1.1.1 5519 ms
3.056441 IP 10.1.1.8.654 > 10.1.1.255.654:  aodv rrep 20  prefix 0 hops 0
	dst 10.1.1.8 dseq 3 src 10.1.1.8 2000 ms
3.063454 IP 10.1.1.7.654 > 10.1.1.255.654:  aodv rrep 20  prefix 0 hops 0
	dst 10.1.1.7 dseq 0 src 10.1.1.7 2000 ms
3.072075 IP 10.1.1.8.9 > 10.1.1.1.49153: Flags [.], ack 77381, win 65535, length 0
3.084920 IP 10.1.1.1.49153 > 10.1.1.8.9: Flags [.], seq 81761:83221, ack 1, win 65535, length 1460
3.084930 Acknowledgment RA:00:00:00:00:00:05 
3.085284 IP 10.1.1.8.9 > 10.1.1.1.49153: Flags [.], ack 83221, win 65535, length 0
3.086399 Acknowledgment RA:00:00:00:00:00:08 
3.087353 IP 10.1.1.6.654 > 10.1.1.255.654:  aodv rrep 20  prefix 0 hops 0
	dst 10.1.1.6 dseq 0 src 10.1.1.6 2000 ms
3.099943 IP 10.1.1.1.49153 > 10.1.1.8.9: Flags [.], seq 83221:84681, ack 1, win 65535, length 1460
3.099953 Acknowledgment RA:00:00:00:00:00:05 
3.101148 IP 10.1.1.8.9 > 10.1.1.1.49153: Flags [.], ack 80301, win 65535, length 0
3.115422 IP 10.1.1.5.654 > 10.1.1.2.654:  aodv rrep 20  prefix 0 hops 3
	dst 10.1.1.8 dseq 3 src 10.1.1.1 5519 ms
3.117855 IP 10.1.1.5.654 > 10.1.1.255.654:  aodv rrep 20  prefix 0 hops 0
	dst 10.1.1.5 dseq 0 src 10.1.1.5 2000 ms
3.147500 Acknowledgment RA:00:00:00:00:00:02 
3.163346 IP 10.1.1.1.49153 > 10.1.1.8.9: Flags [.], seq 84681:86141, ack 1, win 65535, length 1460
3.163356 Acknowledgment RA:00:00:00:00:00:05 
3.163710 IP 10.1.1.8.9 > 10.1.1.1.49153: Flags [.], ack 86141, win 65535, length 0
3.164825 Acknowledgment RA:00:00:00:00:00:08 
3.189141 IP 10.1.1.1.49153 > 10.1.1.8.9: Flags [.], seq 86141:87601, ack 1, win 65535, length 1460
3.189151 Acknowledgment RA:00:00:00:00:00:05 
3.190306 IP 10.1.1.8.9 > 10.1.1.1.49153: Flags [.], ack 83221, win 65535, length 0
3.203191 IP 10.1.1.1.49153 > 10.1.1.8.9: Flags [.], seq 87601:89061, ack 1, win 65535, length 1460
3.203201 Acknowledgment RA:00:00:00:00:00:05 
3.203555 IP 10.1.1.8.9 > 10.1.1.1.49153: Flags [.], ack 89061, win 65535, length 0
3.204670 Acknowledgment RA:00:00:00:00:00:08 
3.217326 IP 10.1.1.8.9 > 10.1.1.1.49153: Flags [.], ack 86141, win 65535, length 0
3.218651 IP 10.1.1.8.9 > 10.1.1.1.49153: Flags [.], ack 89061, win 65535, length 0
3.232250 Acknowledgment RA:00:00:00:00:00:02 
3.244780 IP 10.1.1.1.49153 > 10.1.1.8.9: Flags [.], seq 89061:90521, ack 1, win 65535, length 1460
3.244790 Acknowledgment RA:00:00:00:00:00:05 
3.262687 Acknowledgment RA:00:00:00:00:00:02 
3.275217 IP 10.1.1.1.49153 > 10.1.1.8.9: Flags [.], seq 90521:91981, ack 1, win 65535, length 1460
3.275227 Acknowledgment RA:00:00:00:00:00:05 
3.275581 IP 10.1.1.8.9 > 10.1.1.1.49153: Flags [.], ack 91981, win 65535, length 0
3.276696 Acknowledgment RA:00:00:00:00:00:08 
3.277807 IP 10.1.1.8.9 > 10.1.1.1.49153: Flags [.], ack 91981, win 65535, length 0
3.295471 IP 10.1.1.8.9 > 10.1.1.1.49153: Flags [.], ack 91981, win 65535, length 0
3.311796 Acknowledgment RA:00:00:00:00:00:02 
3.324346 IP 10.1.1.1.49153 > 10.1.1.8.9: Flags [.], seq 91981:93441, ack 1, win 65535, length 1460
3.324356 Acknowledgment RA:00:00:00:00:00:05 
3.344748 Acknowledgment RA:00:00:00:00:00:02 
3.357278 IP 10.1.1.1.49153 > 10.1.1.8.9: Flags [.], seq 93441:94901, ack 1, win 65535, length 1460
3.357288 Acknowledgment RA:00:00:00:00:00:05 
3.357642 IP 10.1.1.8.9 > 10.1.1.1.49153: Flags [.], ack 94901, win 65535, length 0
3.358757 Acknowledgment RA:00:00:00:00:00:08 
3.360951 IP 10.1.1.8.9 > 10.1.1.1.49153: Flags [.], ack 94901, win 65535, length 0
3.374170 Acknowledgment RA:00:00:00:00:00:02 
3.386700 IP 10.1.1.1.49153 > 10.1.1.8.9: Flags [.], seq 94901:96361, ack 1, win 65535, length 1460
3.386710 Acknowledgment RA:00:00:00:00:00:05 
3.399899 Acknowledgment RA:00:00:00:00:00:02 
3.412449 IP 10.1.1.1.49153 > 10.1.1.8.9: Flags [.], seq 96361:97821, ack 1, win 65535, length 1460
3.412459 Acknowledgment RA:00:00:00:00:00:05 
3.412813 IP 10.1.1.8.9 > 10.1.1.1.49153: Flags [.], ack 97821, win 65535, length 0
3.413928 Acknowledgment RA:00:00:00:00:00:08 
3.426270 IP 10.1.1.8.9 > 10.1.1.1.49153: Flags [.], ack 97821, win 65535, length 0
3.440069 Acknowledgment RA:00:00:00:00:00:02 
3.454648 Acknowledgment RA:00:00:00:00:00:02 
3.468968 IP 10.1.1.1.49153 > 10.1.1.8.9: Flags [.], seq 97821:99281, ack 1, win 65535, length 1460
3.468978 Acknowledgment RA:00:00:00:00:00:05 
3.485288 IP 10.1.1.1.49153 > 10.1.1.8.9: Flags [.], seq 99281:100741, ack 1, win 65535, length 1460
3.485298 Acknowledgment RA:00:00:00:00:00:05 
3.485652 IP 10.1.1.8.9 > 10.1.1.1.49153: Flags [.], ack 100741, win 65535, length 0
3.486767 Acknowledgment RA:00:00:00:00:00:08 
3.516452 Acknowledgment RA:00:00:00:00:00:02 
3.517342 IP 10.1.1.8.9 > 10.1.1.1.49153: Flags [.], ack 100741, win 65535, length 0
3.518532 IP 10.1.1.8.9 > 10.1.1.1.49153: Flags [.], ack 100741, win 65535, length 0
3.533555 IP 10.1.1.1.49153 > 10.1.1.8.9: Flags [.], seq 100741:102201, ack 1, win 65535, length 1460
3.533565 Acknowledgment RA:00:00:00:00:00:05 
3.549062 Acknowledgment RA:00:00:00:00:00:02 
3.561632 IP 10.1.1.1.49153 > 10.1.1.8.9: Flags [.], seq 100741:102201, ack 1, win 65535, length 1460
3.561642 Acknowledgment RA:00:00:00:00:00:05 
3.574677 IP 10.1.1.1.49153 > 10.1.1.8.9: Flags [.], seq 102201:103661, ack 1, win 65535, length 1460
3.574687 Acknowledgment RA:00:00:00:00:00:05 
3.575041 IP 10.1.1.8.9 > 10.1.1.1.49153: Flags [.], ack 103661, win 65535, length 0
3.576156 Acknowledgment RA:00:00:00:00:00:08 
3.588512 IP 10.1.1.8.9 > 10.1.1.1.49153: Flags [.], ack 103661, win 65535, length 0
3.601871 Acknowledgment RA:00:00:00:00:00:02 
3.614401 IP 10.1.1.1.49153 > 10.1.1.8.9: Flags [.], seq 103661:105121, ack 1, win 65535, length 1460
3.614411 Acknowledgment RA:00:00:00:00:00:05 
3.627860 Acknowledgment RA:00:00:00:00:00:02 
3.640390 IP 10.1.1.1.49153 > 10.1.1.8.9: Flags [.], seq 105121:106581, ack 1, win 65535, length 1460
3.640400 Acknowledgment RA:00:00:00:00:00:05 
3.640754 IP 10.1.1.8.9 > 10.1.1.1.49153: Flags [.], ack 106581, win 65535, length 0
3.641869 Acknowledgment RA:00:00:00:00:00:08 
3.654425 IP 10.1.1.8.9 > 10.1.1.1.49153: Flags [.], ack 106581, win 65535, length 0
3.667684 Acknowledgment RA:00:00:00:00:00:02 
3.680374 IP 10.1.1.1.49153 > 10.1.1.8.9: Flags [.], seq 106581:108041, ack 1, win 65535, length 1460
3.680384 Acknowledgment RA:00:00:00:00:00:05 
3.693573 Acknowledgment RA:00:00:00:00:00:02 
3.706458 Acknowledgment RA:00:00:00:00:00:02 
3.719008 IP 10.1.1.1.49153 > 10.1.1.8.9: Flags [.], seq 108041:109501, ack 1, win 65535, length 1460
3.719018 Acknowledgment RA:00:00:00:00:00:05 
3.719372 IP 10.1.1.8.9 > 10.1.1.1.49153: Flags [.], ack 109501, win 65535, length 0
3.720558 IP 10.1.1.8.9 > 10.1.1.1.49153: Flags [.], ack 109501, win 65535, length 0
3.721673 Acknowledgment RA:00:00:00:00:00:08 
3.744423 IP 10.1.1.1.49153 > 10.1.1.8.9: Flags [.], seq 109501:110961, ack 1, win 65535, length 1460
3.744433 Acknowledgment RA:00:00:00:00:00:05 
3.745668 IP 10.1.1.8.9 > 10.1.1.1.49153: Flags [.], ack 109501, win 65535, length 0
3.759067 Acknowledgment RA:00:00:00:00:00:02 
3.778892 Acknowledgment RA:00:00:00:00:00:02 
3.791642 IP 10.1.1.1.49153 > 10.1.1.8.9: Flags [.], seq 110961:112421, ack 1, win 65535, length 1460
3.791652 Acknowledgment RA:00:00:00:00:00:05 
3.792006 IP 10.1.1.8.9 > 10.1.1.1.49153: Flags [.], ack 112421, win 65535, length 0
3.793121 Acknowledgment RA:00:00:00:00:00:08 
3.817257 IP 10.1.1.1.49153 > 10.1.1.8.9: Flags [.], seq 112421:113881, ack 1, win 65535, length 1460
3.817267 Acknowledgment RA:00:00:00:00:00:05 
3.818442 IP 10.1.1.8.9 > 10.1.1.1.49153: Flags [.], ack 112421, win 65535, length 0
3.832121 Acknowledgment RA:00:00:00:00:00:02 
3.844651 IP 10.1.1.1.49153 > 10.1.1.8.9: Flags [.], seq 113881:115341, ack 1, win 65535, length 1460
3.844661 Acknowledgment RA:00:00:00:00:00:05 
3.845015 IP 10.1.1.8.9 > 10.1.1.1.49153: Flags [.], ack 115341, win 65535, length 0
3.846130 Acknowledgment RA:00:00:00:00:00:08 
3.865942 IP 10.1.1.8.9 > 10.1.1.1.49153: Flags [.], ack 115341, win 65535, length 0
3.892722 Acknowledgment RA:00:00:00:00:00:02 
3.905252 IP 10.1.1.1.49153 > 10.1.1.8.9: Flags [.], seq 115341:116801, ack 1, win 65535, length 1460
3.905262 Acknowledgment RA:00:00:00:00:00:05 
3.918451 Acknowledgment RA:00:00:00:00:00:02 
3.931295 Acknowledgment RA:00:00:00:00:00:02 
3.944160 Acknowledgment RA:00:00:00:00:00:02 
3.957105 Acknowledgment RA:00:00:00:00:00:02 
3.969735 IP 10.1.1.1.49153 > 10.1.1.8.9: Flags [.], seq 116801:118261, ack 1, win 65535, length 1460
3.969745 Acknowledgment RA:00:00:00:00:00:05 
3.970099 IP 10.1.1.8.9 > 10.1.1.1.49153: Flags [.], ack 118261, win 65535, length 0
3.971214 Acknowledgment RA:00:00:00:00:00:08 
3.995430 IP 10.1.1.1.49153 > 10.1.1.8.9: Flags [.], seq 118261:119721, ack 1, win 65535, length 1460
3.995440 Acknowledgment RA:00:00:00:00:00:05 
4.008555 IP 10.1.1.1.49153 > 10.1.1.8.9: Flags [.], seq 119721:121181, ack 1, win 65535, length 1460
4.008565 Acknowledgment RA:00:00:00:00:00:05 
4.008919 IP 10.1.1.8.9 > 10.1.1.1.49153: Flags [.], ack 121181, win 65535, length 0
4.010034 Acknowledgment RA:00:00:00:00:00:08 
4.034330 IP 10.1.1.1.49153 > 10.1.1.8.9: Flags [.], seq 121181:122641, ack 1, win 65535, length 1460
4.034340 Acknowledgment RA:00:00:00:00:00:05 
4.035555 IP 10.1.1.8.9 > 10.1.1.1.49153: Flags [.], ack 118261, win 65535, length 0
4.036720 IP 10.1.1.8.9 > 10.1.1.1.49153: Flags [.], ack 121181, win 65535, length 0
4.039143 IP 10.1.1.5.654 > 10.1.1.255.654:  aodv rrep 20  prefix 0 hops 0
	dst 10.1.1.5 dseq 0 src 10.1.1.5 2000 ms
4.052328 Acknowledgment RA:00:00:00:00:00:02 
4.064858 IP 10.1.1.1.49153 > 10.1.1.8.9: Flags [.], seq 122641:124101, ack 1, win 65535, length 1460
4.064868 Acknowledgment RA:00:00:00:00:00:05 
4.066107 IP 10.1.1.7.654 > 10.1.1.255.654:  aodv rrep 20  prefix 0 hops 0
	dst 10.1.1.7 dseq 0 src 10.1.1.7 2000 ms
4.066277 IP 10.1.1.8.654 > 10.1.1.255.654:  aodv rrep 20  prefix 0 hops 0
	dst 10.1.1.8 dseq 3 src 10.1.1.8 2000 ms
4.067451 IP 10.1.1.8.9 > 10.1.1.1.49153: Flags [.], ack 124101, win 65535, length 0
4.069221 IP 10.1.1.8.9 > 10.1.1.1.49153: Flags [.], ack 124101, win 65535, length 0
4.071211 IP 10.1.1.8.9 > 10.1.1.1.49153: Flags [.], ack 124101, win 65535, length 0
4.073401 IP 10.1.1.8.9 > 10.1.1.1.49153: Flags [.], ack 124101, win 65535, length 0
4.075751 IP 10.1.1.8.9 > 10.1.1.1.49153: Flags [.], ack 124101, win 65535, length 0
4.078958 Acknowledgment RA:00:00:00:00:00:02 
4.080866 IP 10.1.1.6.654 > 10.1.1.255.654:  aodv rrep 20  prefix 0 hops 0
	dst 10.1.1.6 dseq 0 src 10.1.1.6 2000 ms
4.086616 IP 10.1.1.8.9 > 10.1.1.1.49153: Flags [.], ack 124101, win 65535, length 0
4.092086 IP 10.1.1.8.9 > 10.1.1.1.49153: Flags [.], ack 124101, win 65535, length 0
4.105517 IP 10.1.1.1.49153 > 10.1.1.8.9: Flags [.], seq 124101:125561, ack 1, win 65535, length 1460
4.105527 Acknowledgment RA:00:00:00:00:00:05 
4.118856 Acknowledgment RA:00:00:00:00:00:02 
4.134608 Acknowledgment RA:00:00:00:00:00:02 
4.147553 Acknowledgment RA:00:00:00:00:00:02 
4.160418 Acknowledgment RA:00:00:00:00:00:02 
4.173088 IP 10.1.1.1.49153 > 10.1.1.8.9: Flags [.], seq 125561:127021, ack 1, win 65535, length 1460
4.173098 Acknowledgment RA:00:00:00:00:00:05 
4.173452 IP 10.1.1.8.654 > 10.1.1.255.654:  aodv rreq 24  hops 0 id 0x00000004
	dst 10.1.1.1 seq 1 src 10.1.1.8 seq 4
4.174713 IP 10.1.1.7.654 > 10.1.1.8.654:  aodv rrep 20  prefix 0 hops 3
	dst 10.1.1.1 dseq 1 src 10.1.1.8 1846 ms
4.174723 Acknowledgment RA:00:00:00:00:00:07 
4.175472 IP 10.1.1.7.654 > 10.1.1.5.654:  aodv rrep 20  prefix 0 hops 1
	dst 10.1.1.8 dseq 4 src 10.1.1.1 5519 ms
4.175787 Acknowledgment RA:00:00:00:00:00:07 
