reading from file aufgabeEins-5-0.pcap, link-type IEEE802_11 (802.11)
0.003985 IP 10.1.1.7.654 > 10.1.1.255.654:  aodv rreq 24  hops 3 id 0x00000001
	dst 10.1.1.8 seq 0 src 10.1.1.1 seq 1
0.004035 IP 10.1.1.6.654 > 10.1.1.255.654:  aodv rreq 24  hops 4 id 0x00000001
	dst 10.1.1.8 seq 0 src 10.1.1.1 seq 1
0.005897 IP 10.1.1.4.654 > 10.1.1.255.654:  aodv rreq 24  hops 1 id 0x00000001
	dst 10.1.1.8 seq 0 src 10.1.1.1 seq 1
0.022864 IP 10.1.1.4.654 > 10.1.1.255.654:  aodv rrep 20  prefix 0 hops 0
	dst 10.1.1.4 dseq 0 src 10.1.1.4 2000 ms
0.024864 IP 10.1.1.5.654 > 10.1.1.255.654:  aodv rrep 20  prefix 0 hops 0
	dst 10.1.1.5 dseq 0 src 10.1.1.5 2000 ms
0.057864 IP 10.1.1.3.654 > 10.1.1.255.654:  aodv rrep 20  prefix 0 hops 0
	dst 10.1.1.3 dseq 0 src 10.1.1.3 2000 ms
0.058864 IP 10.1.1.8.654 > 10.1.1.255.654:  aodv rrep 20  prefix 0 hops 0
	dst 10.1.1.8 dseq 0 src 10.1.1.8 2000 ms
0.065864 IP 10.1.1.7.654 > 10.1.1.255.654:  aodv rrep 20  prefix 0 hops 0
	dst 10.1.1.7 dseq 0 src 10.1.1.7 2000 ms
0.075000 IP 10.1.1.6.654 > 10.1.1.255.654:  aodv rrep 20  prefix 0 hops 0
	dst 10.1.1.6 dseq 0 src 10.1.1.6 2000 ms
1.003743 ARP, Request who-has 10.1.1.5 (ff:ff:ff:ff:ff:ff) tell 10.1.1.8, length 32
1.003867 ARP, Reply 10.1.1.5 is-at 00:00:00:00:00:05, length 32
1.005381 ARP, Reply 10.1.1.5 is-at 00:00:00:00:00:05, length 32
1.005696 Acknowledgment RA:00:00:00:00:00:05 
1.007086 IP 10.1.1.8.654 > 10.1.1.5.654:  aodv rrep 20  prefix 0 hops 0
	dst 10.1.1.8 dseq 0 src 10.1.1.1 11199 ms
1.007400 Acknowledgment RA:00:00:00:00:00:08 
1.008294 ARP, Request who-has 10.1.1.2 (ff:ff:ff:ff:ff:ff) tell 10.1.1.5, length 32
1.010107 Acknowledgment RA:00:00:00:00:00:02 
1.010243 IP 10.1.1.5.654 > 10.1.1.2.654:  aodv rrep 20  prefix 0 hops 1
	dst 10.1.1.8 dseq 0 src 10.1.1.1 11199 ms
1.011497 IP 10.1.1.5.654 > 10.1.1.2.654:  aodv rrep 20  prefix 0 hops 1
	dst 10.1.1.8 dseq 0 src 10.1.1.1 11199 ms
1.017831 ARP, Reply 10.1.1.5 is-at 00:00:00:00:00:05, length 32
1.019405 ARP, Reply 10.1.1.5 is-at 00:00:00:00:00:05, length 32
1.020884 Acknowledgment RA:00:00:00:00:00:02 
1.021798 ARP, Request who-has 10.1.1.8 (ff:ff:ff:ff:ff:ff) tell 10.1.1.5, length 32
1.022553 ARP, Reply 10.1.1.8 is-at 00:00:00:00:00:08, length 32
1.022867 Acknowledgment RA:00:00:00:00:00:08 
1.023882 IP 10.1.1.4.654 > 10.1.1.255.654:  aodv rrep 20  prefix 0 hops 0
	dst 10.1.1.4 dseq 0 src 10.1.1.4 2000 ms
1.024812 IP 10.1.1.1.49153 > 10.1.1.8.9: Flags [S], seq 0, win 65535, length 0
1.025126 Acknowledgment RA:00:00:00:00:00:05 
1.026061 IP 10.1.1.5.654 > 10.1.1.255.654:  aodv rrep 20  prefix 0 hops 0
	dst 10.1.1.5 dseq 0 src 10.1.1.5 2000 ms
1.026647 IP 10.1.1.8.9 > 10.1.1.1.49153: Flags [S.], seq 0, ack 1, win 65535, length 0
1.026962 Acknowledgment RA:00:00:00:00:00:08 
1.027812 IP 10.1.1.8.9 > 10.1.1.1.49153: Flags [S.], seq 0, ack 1, win 65535, length 0
1.031719 Acknowledgment RA:00:00:00:00:00:02 
1.032385 IP 10.1.1.1.49153 > 10.1.1.8.9: Flags [.], ack 1, win 65535, length 0
1.032700 Acknowledgment RA:00:00:00:00:00:05 
1.072754 IP 10.1.1.1.49153 > 10.1.1.8.9: Flags [.], seq 1:1461, ack 1, win 65535, length 1460
1.073068 Acknowledgment RA:00:00:00:00:00:05 
1.073918 IP 10.1.1.8.9 > 10.1.1.1.49153: Flags [.], ack 1461, win 65535, length 0
1.074233 Acknowledgment RA:00:00:00:00:00:08 
1.075163 IP 10.1.1.8.9 > 10.1.1.1.49153: Flags [.], ack 1461, win 65535, length 0
1.076571 IP 10.1.1.7.654 > 10.1.1.255.654:  aodv rrep 20  prefix 0 hops 0
	dst 10.1.1.7 dseq 0 src 10.1.1.7 2000 ms
1.076781 IP 10.1.1.6.654 > 10.1.1.255.654:  aodv rrep 20  prefix 0 hops 0
	dst 10.1.1.6 dseq 0 src 10.1.1.6 2000 ms
1.126788 Acknowledgment RA:00:00:00:00:00:02 
1.133174 IP 10.1.1.1.49153 > 10.1.1.8.9: Flags [.], seq 1461:2921, ack 1, win 65535, length 1460
1.148057 Acknowledgment RA:00:00:00:00:00:02 
1.160707 IP 10.1.1.1.49153 > 10.1.1.8.9: Flags [.], seq 1461:2921, ack 1, win 65535, length 1460
1.161022 Acknowledgment RA:00:00:00:00:00:05 
1.167408 IP 10.1.1.1.49153 > 10.1.1.8.9: Flags [.], seq 2921:4381, ack 1, win 65535, length 1460
1.180358 IP 10.1.1.1.49153 > 10.1.1.8.9: Flags [.], seq 2921:4381, ack 1, win 65535, length 1460
1.180673 Acknowledgment RA:00:00:00:00:00:05 
1.181219 IP 10.1.1.8.9 > 10.1.1.1.49153: Flags [.], ack 4381, win 65535, length 0
1.181533 Acknowledgment RA:00:00:00:00:00:08 
1.182563 IP 10.1.1.8.9 > 10.1.1.1.49153: Flags [.], ack 4381, win 65535, length 0
1.200619 Acknowledgment RA:00:00:00:00:00:02 
1.208644 IP 10.1.1.1.49153 > 10.1.1.8.9: Flags [.], seq 4381:5841, ack 1, win 65535, length 1460
1.221903 Acknowledgment RA:00:00:00:00:00:02 
1.234533 IP 10.1.1.1.49153 > 10.1.1.8.9: Flags [.], seq 4381:5841, ack 1, win 65535, length 1460
1.234848 Acknowledgment RA:00:00:00:00:00:05 
1.241314 IP 10.1.1.1.49153 > 10.1.1.8.9: Flags [.], seq 5841:7301, ack 1, win 65535, length 1460
1.254533 Acknowledgment RA:00:00:00:00:00:02 
1.267503 IP 10.1.1.1.49153 > 10.1.1.8.9: Flags [.], seq 5841:7301, ack 1, win 65535, length 1460
1.267818 Acknowledgment RA:00:00:00:00:00:05 
1.268364 IP 10.1.1.8.9 > 10.1.1.1.49153: Flags [.], ack 7301, win 65535, length 0
1.269594 IP 10.1.1.8.9 > 10.1.1.1.49153: Flags [.], ack 7301, win 65535, length 0
1.269908 Acknowledgment RA:00:00:00:00:00:08 
1.282638 IP 10.1.1.1.49153 > 10.1.1.8.9: Flags [.], seq 7301:8761, ack 1, win 65535, length 1460
1.282953 Acknowledgment RA:00:00:00:00:00:05 
1.283883 IP 10.1.1.8.9 > 10.1.1.1.49153: Flags [.], ack 7301, win 65535, length 0
1.307657 Acknowledgment RA:00:00:00:00:00:02 
1.320327 IP 10.1.1.1.49153 > 10.1.1.8.9: Flags [.], seq 8761:10221, ack 1, win 65535, length 1460
1.320642 Acknowledgment RA:00:00:00:00:00:05 
1.321188 IP 10.1.1.8.9 > 10.1.1.1.49153: Flags [.], ack 10221, win 65535, length 0
1.322538 IP 10.1.1.8.9 > 10.1.1.1.49153: Flags [.], ack 10221, win 65535, length 0
1.322852 Acknowledgment RA:00:00:00:00:00:08 
1.328098 IP 10.1.1.8.9 > 10.1.1.1.49153: Flags [.], ack 10221, win 65535, length 0
1.341537 Acknowledgment RA:00:00:00:00:00:02 
1.342897 IP 10.1.1.1.49153 > 10.1.1.8.9: Flags [.], seq 10221:11681, ack 1, win 65535, length 1460
1.359393 Acknowledgment RA:00:00:00:00:00:02 
1.371943 IP 10.1.1.1.49153 > 10.1.1.8.9: Flags [.], seq 10221:11681, ack 1, win 65535, length 1460
1.372258 Acknowledgment RA:00:00:00:00:00:05 
1.387983 Acknowledgment RA:00:00:00:00:00:02 
1.401796 Acknowledgment RA:00:00:00:00:00:02 
1.414346 IP 10.1.1.1.49153 > 10.1.1.8.9: Flags [.], seq 11681:13141, ack 1, win 65535, length 1460
1.414661 Acknowledgment RA:00:00:00:00:00:05 
1.415207 IP 10.1.1.8.9 > 10.1.1.1.49153: Flags [.], ack 13141, win 65535, length 0
1.416597 IP 10.1.1.8.9 > 10.1.1.1.49153: Flags [.], ack 13141, win 65535, length 0
1.416911 Acknowledgment RA:00:00:00:00:00:08 
1.439861 IP 10.1.1.1.49153 > 10.1.1.8.9: Flags [.], seq 13141:14601, ack 1, win 65535, length 1460
1.440176 Acknowledgment RA:00:00:00:00:00:05 
1.452806 IP 10.1.1.1.49153 > 10.1.1.8.9: Flags [.], seq 14601:16061, ack 1, win 65535, length 1460
1.453121 Acknowledgment RA:00:00:00:00:00:05 
1.453667 IP 10.1.1.8.9 > 10.1.1.1.49153: Flags [.], ack 16061, win 65535, length 0
1.455077 IP 10.1.1.8.9 > 10.1.1.1.49153: Flags [.], ack 16061, win 65535, length 0
1.455391 Acknowledgment RA:00:00:00:00:00:08 
1.466801 IP 10.1.1.8.9 > 10.1.1.1.49153: Flags [.], ack 13141, win 65535, length 0
1.468186 IP 10.1.1.8.9 > 10.1.1.1.49153: Flags [.], ack 16061, win 65535, length 0
1.482365 Acknowledgment RA:00:00:00:00:00:02 
1.494895 IP 10.1.1.1.49153 > 10.1.1.8.9: Flags [.], seq 16061:17521, ack 1, win 65535, length 1460
1.495210 Acknowledgment RA:00:00:00:00:00:05 
1.513287 Acknowledgment RA:00:00:00:00:00:02 
1.525817 IP 10.1.1.1.49153 > 10.1.1.8.9: Flags [.], seq 17521:18981, ack 1, win 65535, length 1460
1.526132 Acknowledgment RA:00:00:00:00:00:05 
1.526982 IP 10.1.1.8.9 > 10.1.1.1.49153: Flags [.], ack 18981, win 65535, length 0
1.527296 Acknowledgment RA:00:00:00:00:00:08 
1.540659 Acknowledgment RA:00:00:00:00:00:02 
1.553604 Acknowledgment RA:00:00:00:00:00:02 
1.566529 Acknowledgment RA:00:00:00:00:00:02 
1.580482 Acknowledgment RA:00:00:00:00:00:02 
1.593327 Acknowledgment RA:00:00:00:00:00:02 
1.594237 IP 10.1.1.8.9 > 10.1.1.1.49153: Flags [.], ack 18981, win 65535, length 0
1.611205 Acknowledgment RA:00:00:00:00:00:02 
1.624050 Acknowledgment RA:00:00:00:00:00:02 
1.636680 IP 10.1.1.1.49153 > 10.1.1.8.9: Flags [.], seq 18981:20441, ack 1, win 65535, length 1460
1.636995 Acknowledgment RA:00:00:00:00:00:05 
1.649685 IP 10.1.1.1.49153 > 10.1.1.8.9: Flags [.], seq 20441:21901, ack 1, win 65535, length 1460
1.650000 Acknowledgment RA:00:00:00:00:00:05 
1.650850 IP 10.1.1.8.9 > 10.1.1.1.49153: Flags [.], ack 21901, win 65535, length 0
1.651164 Acknowledgment RA:00:00:00:00:00:08 
1.664190 IP 10.1.1.1.49153 > 10.1.1.8.9: Flags [.], seq 21901:23361, ack 1, win 65535, length 1460
1.664505 Acknowledgment RA:00:00:00:00:00:05 
1.677529 Acknowledgment RA:00:00:00:00:00:02 
1.690099 IP 10.1.1.1.49153 > 10.1.1.8.9: Flags [.], seq 23361:24821, ack 1, win 65535, length 1460
1.690414 Acknowledgment RA:00:00:00:00:00:05 
1.691264 IP 10.1.1.8.9 > 10.1.1.1.49153: Flags [.], ack 24821, win 65535, length 0
1.691578 Acknowledgment RA:00:00:00:00:00:08 
1.705628 IP 10.1.1.1.49153 > 10.1.1.8.9: Flags [.], seq 24821:26281, ack 1, win 65535, length 1460
1.705943 Acknowledgment RA:00:00:00:00:00:05 
1.718573 IP 10.1.1.1.49153 > 10.1.1.8.9: Flags [.], seq 26281:27741, ack 1, win 65535, length 1460
1.718888 Acknowledgment RA:00:00:00:00:00:05 
1.719738 IP 10.1.1.8.9 > 10.1.1.1.49153: Flags [.], ack 27741, win 65535, length 0
1.720052 Acknowledgment RA:00:00:00:00:00:08 
1.732642 IP 10.1.1.1.49153 > 10.1.1.8.9: Flags [.], seq 27741:29201, ack 1, win 65535, length 1460
1.732957 Acknowledgment RA:00:00:00:00:00:05 
1.733415 IP 10.1.1.8.9 > 10.1.1.1.49153: Flags [.], ack 21901, win 65535, length 0
1.734945 IP 10.1.1.8.9 > 10.1.1.1.49153: Flags [.], ack 21901, win 65535, length 0
1.749660 Acknowledgment RA:00:00:00:00:00:02 
1.763513 Acknowledgment RA:00:00:00:00:00:02 
1.777406 Acknowledgment RA:00:00:00:00:00:02 
1.790016 IP 10.1.1.1.49153 > 10.1.1.8.9: Flags [.], seq 29201:30661, ack 1, win 65535, length 1460
1.790331 Acknowledgment RA:00:00:00:00:00:05 
1.791181 IP 10.1.1.8.9 > 10.1.1.1.49153: Flags [.], ack 30661, win 65535, length 0
1.791495 Acknowledgment RA:00:00:00:00:00:08 
1.792385 IP 10.1.1.8.9 > 10.1.1.1.49153: Flags [.], ack 24821, win 65535, length 0
1.812272 Acknowledgment RA:00:00:00:00:00:02 
1.813302 IP 10.1.1.8.9 > 10.1.1.1.49153: Flags [.], ack 27741, win 65535, length 0
1.829438 Acknowledgment RA:00:00:00:00:00:02 
1.844880 IP 10.1.1.1.49153 > 10.1.1.8.9: Flags [.], seq 30661:32121, ack 1, win 65535, length 1460
1.845195 Acknowledgment RA:00:00:00:00:00:05 
1.857725 IP 10.1.1.1.49153 > 10.1.1.8.9: Flags [.], seq 32121:33581, ack 1, win 65535, length 1460
1.858040 Acknowledgment RA:00:00:00:00:00:05 
1.859474 IP 10.1.1.8.9 > 10.1.1.1.49153: Flags [.], ack 33581, win 65535, length 0
1.861564 IP 10.1.1.8.9 > 10.1.1.1.49153: Flags [.], ack 33581, win 65535, length 0
1.863154 IP 10.1.1.8.9 > 10.1.1.1.49153: Flags [.], ack 33581, win 65535, length 0
1.869384 IP 10.1.1.8.9 > 10.1.1.1.49153: Flags [.], ack 33581, win 65535, length 0
1.892147 IP 10.1.1.1.49153 > 10.1.1.8.9: Flags [.], seq 33581:35041, ack 1, win 65535, length 1460
1.892462 Acknowledgment RA:00:00:00:00:00:05 
1.893612 IP 10.1.1.8.9 > 10.1.1.1.49153: Flags [.], ack 30661, win 65535, length 0
1.906757 IP 10.1.1.1.49153 > 10.1.1.8.9: Flags [.], seq 35041:36501, ack 1, win 65535, length 1460
1.907072 Acknowledgment RA:00:00:00:00:00:05 
1.919762 IP 10.1.1.1.49153 > 10.1.1.8.9: Flags [.], seq 36501:37961, ack 1, win 65535, length 1460
1.920077 Acknowledgment RA:00:00:00:00:00:05 
1.932607 IP 10.1.1.1.49153 > 10.1.1.8.9: Flags [.], seq 37961:39421, ack 1, win 65535, length 1460
1.932922 Acknowledgment RA:00:00:00:00:00:05 
1.943892 IP 10.1.1.8.9 > 10.1.1.1.49153: Flags [.], ack 33581, win 65535, length 0
1.945302 IP 10.1.1.8.9 > 10.1.1.1.49153: Flags [.], ack 36501, win 65535, length 0
1.946812 IP 10.1.1.8.9 > 10.1.1.1.49153: Flags [.], ack 36501, win 65535, length 0
1.948542 IP 10.1.1.8.9 > 10.1.1.1.49153: Flags [.], ack 36501, win 65535, length 0
1.950783 Acknowledgment RA:00:00:00:00:00:02 
1.952227 IP 10.1.1.1.49153 > 10.1.1.8.9: Flags [.], seq 39421:40881, ack 1, win 65535, length 1460
1.953572 IP 10.1.1.8.9 > 10.1.1.1.49153: Flags [.], ack 36501, win 65535, length 0
1.953886 Acknowledgment RA:00:00:00:00:00:08 
1.954877 IP 10.1.1.8.9 > 10.1.1.1.49153: Flags [.], ack 39421, win 65535, length 0
1.955191 Acknowledgment RA:00:00:00:00:00:08 
1.978142 IP 10.1.1.1.49153 > 10.1.1.8.9: Flags [.], seq 39421:40881, ack 1, win 65535, length 1460
1.978457 Acknowledgment RA:00:00:00:00:00:05 
1.979387 IP 10.1.1.8.9 > 10.1.1.1.49153: Flags [.], ack 36501, win 65535, length 0
1.992606 Acknowledgment RA:00:00:00:00:00:02 
2.005611 Acknowledgment RA:00:00:00:00:00:02 
2.006541 IP 10.1.1.8.9 > 10.1.1.1.49153: Flags [.], ack 39421, win 65535, length 0
2.027690 Acknowledgment RA:00:00:00:00:00:02 
2.040280 IP 10.1.1.1.49153 > 10.1.1.8.9: Flags [.], seq 40881:42341, ack 1, win 65535, length 1460
2.040595 Acknowledgment RA:00:00:00:00:00:05 
2.041541 IP 10.1.1.8.654 > 10.1.1.255.654:  aodv rreq 24  hops 0 id 0x00000001
	dst 10.1.1.1 seq 1 src 10.1.1.8 seq 1
2.042295 ARP, Request who-has 10.1.1.8 (ff:ff:ff:ff:ff:ff) tell 10.1.1.7, length 32
2.043149 ARP, Request who-has 10.1.1.5 (ff:ff:ff:ff:ff:ff) tell 10.1.1.7, length 32
2.043361 Acknowledgment RA:00:00:00:00:00:08 
2.043517 IP 10.1.1.7.654 > 10.1.1.8.654:  aodv rrep 20  prefix 0 hops 3
	dst 10.1.1.1 dseq 1 src 10.1.1.8 3321 ms
2.044319 ARP, Request who-has 10.1.1.7 (ff:ff:ff:ff:ff:ff) tell 10.1.1.8, length 32
2.045353 ARP, Reply 10.1.1.7 is-at 00:00:00:00:00:07, length 32
2.045668 Acknowledgment RA:00:00:00:00:00:07 
2.046518 IP 10.1.1.8.9 > 10.1.1.1.49153: Flags [.], ack 42341, win 65535, length 0
2.046832 Acknowledgment RA:00:00:00:00:00:08 
2.054434 ARP, Request who-has 10.1.1.8 (ff:ff:ff:ff:ff:ff) tell 10.1.1.6, length 32
2.056484 IP 10.1.1.4.654 > 10.1.1.255.654:  aodv rrep 20  prefix 0 hops 0
	dst 10.1.1.4 dseq 0 src 10.1.1.4 2000 ms
2.057279 ARP, Reply 10.1.1.8 is-at 00:00:00:00:00:08, length 32
2.057289 Acknowledgment RA:00:00:00:00:00:08 
2.058647 IP 10.1.1.8.654 > 10.1.1.255.654:  aodv rrep 20  prefix 0 hops 0
	dst 10.1.1.8 dseq 1 src 10.1.1.8 2000 ms
2.058757 ARP, Request who-has 10.1.1.7 (ff:ff:ff:ff:ff:ff) tell 10.1.1.6, length 32
2.059586 ARP, Reply 10.1.1.7 is-at 00:00:00:00:00:07, length 32
2.059596 Acknowledgment RA:00:00:00:00:00:07 
2.059924 IP 10.1.1.6.654 > 10.1.1.8.654:  aodv rrep 20  prefix 0 hops 4
	dst 10.1.1.1 dseq 1 src 10.1.1.8 3242 ms
2.061020 IP 10.1.1.6.654 > 10.1.1.8.654:  aodv rrep 20  prefix 0 hops 4
	dst 10.1.1.1 dseq 1 src 10.1.1.8 3242 ms
2.062198 Acknowledgment RA:00:00:00:00:00:06 
2.062248 IP 10.1.1.6.654 > 10.1.1.7.654:  aodv rrep 20  prefix 0 hops 1
	dst 10.1.1.8 dseq 1 src 10.1.1.1 5519 ms
2.062383 Acknowledgment RA:00:00:00:00:00:06 
2.064274 IP 10.1.1.7.654 > 10.1.1.255.654:  aodv rrep 20  prefix 0 hops 0
	dst 10.1.1.7 dseq 0 src 10.1.1.7 2000 ms
2.070363 IP 10.1.1.3.654 > 10.1.1.255.654:  aodv rrep 20  prefix 0 hops 0
	dst 10.1.1.3 dseq 0 src 10.1.1.3 2000 ms
2.083586 IP 10.1.1.1.49153 > 10.1.1.8.9: Flags [.], seq 42341:43801, ack 1, win 65535, length 1460
2.083900 Acknowledgment RA:00:00:00:00:00:05 
2.084110 IP 10.1.1.6.654 > 10.1.1.255.654:  aodv rrep 20  prefix 0 hops 0
	dst 10.1.1.6 dseq 0 src 10.1.1.6 2000 ms
2.097865 IP 10.1.1.5.654 > 10.1.1.255.654:  aodv rrep 20  prefix 0 hops 0
	dst 10.1.1.5 dseq 0 src 10.1.1.5 2000 ms
2.110415 IP 10.1.1.1.49153 > 10.1.1.8.9: Flags [.], seq 43801:45261, ack 1, win 65535, length 1460
2.110730 Acknowledgment RA:00:00:00:00:00:05 
2.110890 Acknowledgment RA:00:00:00:00:00:08 
2.113455 IP 10.1.1.5.654 > 10.1.1.8.654:  aodv rrep 20  prefix 0 hops 2
	dst 10.1.1.1 dseq 1 src 10.1.1.8 3400 ms
2.113769 Acknowledgment RA:00:00:00:00:00:05 
2.114744 IP 10.1.1.5.654 > 10.1.1.2.654:  aodv rrep 20  prefix 0 hops 1
	dst 10.1.1.8 dseq 1 src 10.1.1.1 5519 ms
2.115263 ARP, Reply 10.1.1.5 is-at 00:00:00:00:00:05, length 32
2.116477 ARP, Reply 10.1.1.5 is-at 00:00:00:00:00:05, length 32
2.116791 Acknowledgment RA:00:00:00:00:00:05 
2.116927 IP 10.1.1.7.654 > 10.1.1.5.654:  aodv rrep 20  prefix 0 hops 1
	dst 10.1.1.8 dseq 1 src 10.1.1.1 5519 ms
2.118741 IP 10.1.1.7.654 > 10.1.1.5.654:  aodv rrep 20  prefix 0 hops 1
	dst 10.1.1.8 dseq 1 src 10.1.1.1 5519 ms
2.120495 IP 10.1.1.7.654 > 10.1.1.5.654:  aodv rrep 20  prefix 0 hops 1
	dst 10.1.1.8 dseq 1 src 10.1.1.1 5519 ms
2.123029 IP 10.1.1.7.654 > 10.1.1.5.654:  aodv rrep 20  prefix 0 hops 1
	dst 10.1.1.8 dseq 1 src 10.1.1.1 5519 ms
2.127123 IP 10.1.1.7.654 > 10.1.1.5.654:  aodv rrep 20  prefix 0 hops 1
	dst 10.1.1.8 dseq 1 src 10.1.1.1 5519 ms
2.130697 IP 10.1.1.7.654 > 10.1.1.5.654:  aodv rrep 20  prefix 0 hops 1
	dst 10.1.1.8 dseq 1 src 10.1.1.1 5519 ms
2.131011 Acknowledgment RA:00:00:00:00:00:07 
2.131882 IP 10.1.1.8.9 > 10.1.1.1.49153: Flags [.], ack 42341, win 65535, length 0
2.132196 Acknowledgment RA:00:00:00:00:00:07 
2.133290 IP 10.1.1.7.654 > 10.1.1.5.654:  aodv rrep 20  prefix 0 hops 2
	dst 10.1.1.8 dseq 1 src 10.1.1.1 5519 ms
2.133605 Acknowledgment RA:00:00:00:00:00:07 
2.144796 IP 10.1.1.5.654 > 10.1.1.2.654:  aodv rrep 20  prefix 0 hops 2
	dst 10.1.1.8 dseq 1 src 10.1.1.1 5519 ms
2.146201 IP 10.1.1.8.9 > 10.1.1.1.49153: Flags [.], ack 42341, win 65535, length 0
2.147730 IP 10.1.1.5.654 > 10.1.1.2.654:  aodv rrep 20  prefix 0 hops 3
	dst 10.1.1.8 dseq 1 src 10.1.1.1 5519 ms
2.161449 Acknowledgment RA:00:00:00:00:00:02 
2.173979 IP 10.1.1.1.49153 > 10.1.1.8.9: Flags [.], seq 45261:46721, ack 1, win 65535, length 1460
2.174294 Acknowledgment RA:00:00:00:00:00:05 
2.187198 Acknowledgment RA:00:00:00:00:00:02 
2.199808 IP 10.1.1.1.49153 > 10.1.1.8.9: Flags [.], seq 46721:48181, ack 1, win 65535, length 1460
2.200123 Acknowledgment RA:00:00:00:00:00:05 
2.201605 IP 10.1.1.8.9 > 10.1.1.1.49153: Flags [.], ack 48181, win 65535, length 0
2.203515 IP 10.1.1.8.9 > 10.1.1.1.49153: Flags [.], ack 48181, win 65535, length 0
2.210397 IP 10.1.1.8.9 > 10.1.1.1.49153: Flags [.], ack 48181, win 65535, length 0
2.213087 Acknowledgment RA:00:00:00:00:00:02 
2.222632 IP 10.1.1.8.9 > 10.1.1.1.49153: Flags [.], ack 48181, win 65535, length 0
2.228990 Acknowledgment RA:00:00:00:00:00:02 
2.241540 IP 10.1.1.1.49153 > 10.1.1.8.9: Flags [.], seq 48181:49641, ack 1, win 65535, length 1460
2.241855 Acknowledgment RA:00:00:00:00:00:05 
2.254525 IP 10.1.1.1.49153 > 10.1.1.8.9: Flags [.], seq 49641:51101, ack 1, win 65535, length 1460
2.254840 Acknowledgment RA:00:00:00:00:00:05 
2.256610 IP 10.1.1.8.9 > 10.1.1.1.49153: Flags [.], ack 48181, win 65535, length 0
2.258432 IP 10.1.1.8.9 > 10.1.1.1.49153: Flags [.], ack 51101, win 65535, length 0
2.260522 IP 10.1.1.8.9 > 10.1.1.1.49153: Flags [.], ack 51101, win 65535, length 0
2.265924 IP 10.1.1.8.9 > 10.1.1.1.49153: Flags [.], ack 51101, win 65535, length 0
2.267744 Acknowledgment RA:00:00:00:00:00:02 
2.280274 IP 10.1.1.1.49153 > 10.1.1.8.9: Flags [.], seq 51101:52561, ack 1, win 65535, length 1460
2.280589 Acknowledgment RA:00:00:00:00:00:05 
2.281919 IP 10.1.1.8.9 > 10.1.1.1.49153: Flags [.], ack 51101, win 65535, length 0
2.293673 Acknowledgment RA:00:00:00:00:00:02 
2.306203 IP 10.1.1.1.49153 > 10.1.1.8.9: Flags [.], seq 52561:54021, ack 1, win 65535, length 1460
2.306518 Acknowledgment RA:00:00:00:00:00:05 
2.307488 IP 10.1.1.8.9 > 10.1.1.1.49153: Flags [.], ack 51101, win 65535, length 0
2.307802 Acknowledgment RA:00:00:00:00:00:08 
2.309009 IP 10.1.1.8.654 > 10.1.1.255.654:  aodv rreq 24  hops 0 id 0x00000002
	dst 10.1.1.1 seq 1 src 10.1.1.8 seq 2
2.310555 IP 10.1.1.7.654 > 10.1.1.8.654:  aodv rrep 20  prefix 0 hops 3
	dst 10.1.1.1 dseq 1 src 10.1.1.8 3054 ms
2.310869 Acknowledgment RA:00:00:00:00:00:07 
2.311294 IP 10.1.1.7.654 > 10.1.1.5.654:  aodv rrep 20  prefix 0 hops 1
	dst 10.1.1.8 dseq 2 src 10.1.1.1 5519 ms
2.311609 Acknowledgment RA:00:00:00:00:00:07 
2.312479 IP 10.1.1.8.9 > 10.1.1.1.49153: Flags [.], ack 54021, win 65535, length 0
2.312793 Acknowledgment RA:00:00:00:00:00:08 
2.313743 IP 10.1.1.8.9 > 10.1.1.1.49153: Flags [.], ack 54021, win 65535, length 0
2.314058 Acknowledgment RA:00:00:00:00:00:07 
2.319584 IP 10.1.1.6.654 > 10.1.1.8.654:  aodv rrep 20  prefix 0 hops 4
	dst 10.1.1.1 dseq 1 src 10.1.1.8 2974 ms
2.320649 IP 10.1.1.8.9 > 10.1.1.1.49153: Flags [.], ack 51101, win 65535, length 0
2.321978 IP 10.1.1.5.654 > 10.1.1.8.654:  aodv rrep 20  prefix 0 hops 2
	dst 10.1.1.1 dseq 1 src 10.1.1.8 3133 ms
2.322292 Acknowledgment RA:00:00:00:00:00:05 
2.322429 IP 10.1.1.5.654 > 10.1.1.2.654:  aodv rrep 20  prefix 0 hops 1
	dst 10.1.1.8 dseq 2 src 10.1.1.1 5519 ms
2.322687 IP 10.1.1.6.654 > 10.1.1.8.654:  aodv rrep 20  prefix 0 hops 4
	dst 10.1.1.1 dseq 1 src 10.1.1.8 2974 ms
2.323865 Acknowledgment RA:00:00:00:00:00:06 
2.336936 Acknowledgment RA:00:00:00:00:00:02 
2.337870 IP 10.1.1.5.654 > 10.1.1.2.654:  aodv rrep 20  prefix 0 hops 1
	dst 10.1.1.8 dseq 2 src 10.1.1.1 5519 ms
2.339119 IP 10.1.1.5.654 > 10.1.1.2.654:  aodv rrep 20  prefix 0 hops 2
	dst 10.1.1.8 dseq 2 src 10.1.1.1 5519 ms
2.339504 IP 10.1.1.6.654 > 10.1.1.7.654:  aodv rrep 20  prefix 0 hops 1
	dst 10.1.1.8 dseq 2 src 10.1.1.1 5519 ms
2.340682 Acknowledgment RA:00:00:00:00:00:06 
2.341596 IP 10.1.1.7.654 > 10.1.1.5.654:  aodv rrep 20  prefix 0 hops 2
	dst 10.1.1.8 dseq 2 src 10.1.1.1 5519 ms
2.341911 Acknowledgment RA:00:00:00:00:00:07 
2.354069 IP 10.1.1.8.9 > 10.1.1.1.49153: Flags [.], ack 54021, win 65535, length 0
2.366994 IP 10.1.1.1.49153 > 10.1.1.8.9: Flags [.], seq 54021:55481, ack 1, win 65535, length 1460
2.367309 Acknowledgment RA:00:00:00:00:00:05 
2.368383 IP 10.1.1.5.654 > 10.1.1.2.654:  aodv rrep 20  prefix 0 hops 3
	dst 10.1.1.8 dseq 2 src 10.1.1.1 5519 ms
2.381862 Acknowledgment RA:00:00:00:00:00:02 
2.394392 IP 10.1.1.1.49153 > 10.1.1.8.9: Flags [.], seq 55481:56941, ack 1, win 65535, length 1460
2.394707 Acknowledgment RA:00:00:00:00:00:05 
2.395557 IP 10.1.1.8.9 > 10.1.1.1.49153: Flags [.], ack 56941, win 65535, length 0
2.395871 Acknowledgment RA:00:00:00:00:00:08 
2.408207 IP 10.1.1.8.9 > 10.1.1.1.49153: Flags [.], ack 56941, win 65535, length 0
2.421926 Acknowledgment RA:00:00:00:00:00:02 
2.434456 IP 10.1.1.1.49153 > 10.1.1.8.9: Flags [.], seq 56941:58401, ack 1, win 65535, length 1460
2.434771 Acknowledgment RA:00:00:00:00:00:05 
2.447915 Acknowledgment RA:00:00:00:00:00:02 
2.460445 IP 10.1.1.1.49153 > 10.1.1.8.9: Flags [.], seq 58401:59861, ack 1, win 65535, length 1460
2.460760 Acknowledgment RA:00:00:00:00:00:05 
2.461610 IP 10.1.1.8.9 > 10.1.1.1.49153: Flags [.], ack 59861, win 65535, length 0
2.461924 Acknowledgment RA:00:00:00:00:00:08 
2.463159 IP 10.1.1.8.9 > 10.1.1.1.49153: Flags [.], ack 59861, win 65535, length 0
2.494386 Acknowledgment RA:00:00:00:00:00:02 
2.510659 IP 10.1.1.1.49153 > 10.1.1.8.9: Flags [.], seq 59861:61321, ack 1, win 65535, length 1460
2.510974 Acknowledgment RA:00:00:00:00:00:05 
2.525157 Acknowledgment RA:00:00:00:00:00:02 
2.552630 IP 10.1.1.1.49153 > 10.1.1.8.9: Flags [.], seq 61321:62781, ack 1, win 65535, length 1460
2.552945 Acknowledgment RA:00:00:00:00:00:05 
2.553795 IP 10.1.1.8.9 > 10.1.1.1.49153: Flags [.], ack 62781, win 65535, length 0
2.554109 Acknowledgment RA:00:00:00:00:00:08 
2.555215 IP 10.1.1.8.9 > 10.1.1.1.49153: Flags [.], ack 62781, win 65535, length 0
2.572874 Acknowledgment RA:00:00:00:00:00:02 
2.585404 IP 10.1.1.1.49153 > 10.1.1.8.9: Flags [.], seq 62781:64241, ack 1, win 65535, length 1460
2.585719 Acknowledgment RA:00:00:00:00:00:05 
2.600763 Acknowledgment RA:00:00:00:00:00:02 
2.613293 IP 10.1.1.1.49153 > 10.1.1.8.9: Flags [.], seq 64241:65701, ack 1, win 65535, length 1460
2.613608 Acknowledgment RA:00:00:00:00:00:05 
2.614458 IP 10.1.1.8.9 > 10.1.1.1.49153: Flags [.], ack 65701, win 65535, length 0
2.614772 Acknowledgment RA:00:00:00:00:00:08 
2.626891 IP 10.1.1.8.9 > 10.1.1.1.49153: Flags [.], ack 65701, win 65535, length 0
2.628401 IP 10.1.1.8.9 > 10.1.1.1.49153: Flags [.], ack 65701, win 65535, length 0
2.641640 Acknowledgment RA:00:00:00:00:00:02 
2.654190 IP 10.1.1.1.49153 > 10.1.1.8.9: Flags [.], seq 65701:67161, ack 1, win 65535, length 1460
2.654505 Acknowledgment RA:00:00:00:00:00:05 
2.667589 Acknowledgment RA:00:00:00:00:00:02 
2.680179 IP 10.1.1.1.49153 > 10.1.1.8.9: Flags [.], seq 67161:68621, ack 1, win 65535, length 1460
2.680494 Acknowledgment RA:00:00:00:00:00:05 
2.681344 IP 10.1.1.8.9 > 10.1.1.1.49153: Flags [.], ack 68621, win 65535, length 0
2.681658 Acknowledgment RA:00:00:00:00:00:08 
2.694014 IP 10.1.1.8.9 > 10.1.1.1.49153: Flags [.], ack 68621, win 65535, length 0
2.707793 Acknowledgment RA:00:00:00:00:00:02 
2.720323 IP 10.1.1.1.49153 > 10.1.1.8.9: Flags [.], seq 68621:70081, ack 1, win 65535, length 1460
2.720638 Acknowledgment RA:00:00:00:00:00:05 
2.733682 Acknowledgment RA:00:00:00:00:00:02 
2.746527 Acknowledgment RA:00:00:00:00:00:02 
2.759077 IP 10.1.1.1.49153 > 10.1.1.8.9: Flags [.], seq 70081:71541, ack 1, win 65535, length 1460
2.759392 Acknowledgment RA:00:00:00:00:00:05 
2.760890 IP 10.1.1.8.9 > 10.1.1.1.49153: Flags [.], ack 71541, win 65535, length 0
2.762680 IP 10.1.1.8.9 > 10.1.1.1.49153: Flags [.], ack 71541, win 65535, length 0
2.765350 IP 10.1.1.8.9 > 10.1.1.1.49153: Flags [.], ack 71541, win 65535, length 0
2.770100 IP 10.1.1.8.9 > 10.1.1.1.49153: Flags [.], ack 71541, win 65535, length 0
2.772356 Acknowledgment RA:00:00:00:00:00:02 
2.777907 IP 10.1.1.8.9 > 10.1.1.1.49153: Flags [.], ack 71541, win 65535, length 0
2.785261 Acknowledgment RA:00:00:00:00:00:02 
2.797851 IP 10.1.1.1.49153 > 10.1.1.8.9: Flags [.], seq 71541:73001, ack 1, win 65535, length 1460
2.798166 Acknowledgment RA:00:00:00:00:00:05 
2.810836 IP 10.1.1.1.49153 > 10.1.1.8.9: Flags [.], seq 73001:74461, ack 1, win 65535, length 1460
2.811151 Acknowledgment RA:00:00:00:00:00:05 
2.823361 IP 10.1.1.8.9 > 10.1.1.1.49153: Flags [.], ack 71541, win 65535, length 0
2.824015 Acknowledgment RA:00:00:00:00:00:02 
2.836805 IP 10.1.1.1.49153 > 10.1.1.8.9: Flags [.], seq 74461:75921, ack 1, win 65535, length 1460
2.838236 IP 10.1.1.8.9 > 10.1.1.1.49153: Flags [.], ack 74461, win 65535, length 0
2.839766 IP 10.1.1.8.9 > 10.1.1.1.49153: Flags [.], ack 74461, win 65535, length 0
2.843216 IP 10.1.1.8.9 > 10.1.1.1.49153: Flags [.], ack 74461, win 65535, length 0
2.847486 IP 10.1.1.8.9 > 10.1.1.1.49153: Flags [.], ack 74461, win 65535, length 0
2.849984 Acknowledgment RA:00:00:00:00:00:02 
2.858035 IP 10.1.1.8.9 > 10.1.1.1.49153: Flags [.], ack 74461, win 65535, length 0
2.862869 Acknowledgment RA:00:00:00:00:00:02 
2.876810 Acknowledgment RA:00:00:00:00:00:02 
2.889460 IP 10.1.1.1.49153 > 10.1.1.8.9: Flags [.], seq 74461:75921, ack 1, win 65535, length 1460
2.889775 Acknowledgment RA:00:00:00:00:00:05 
2.891385 IP 10.1.1.8.9 > 10.1.1.1.49153: Flags [.], ack 74461, win 65535, length 0
2.915349 IP 10.1.1.1.49153 > 10.1.1.8.9: Flags [.], seq 75921:77381, ack 1, win 65535, length 1460
2.915664 Acknowledgment RA:00:00:00:00:00:05 
2.916610 IP 10.1.1.8.654 > 10.1.1.255.654:  aodv rreq 24  hops 0 id 0x00000003
	dst 10.1.1.1 seq 1 src 10.1.1.8 seq 3
2.916975 IP 10.1.1.7.654 > 10.1.1.8.654:  aodv rrep 20  prefix 0 hops 3
	dst 10.1.1.1 dseq 1 src 10.1.1.8 2446 ms
2.917289 Acknowledgment RA:00:00:00:00:00:07 
2.918319 IP 10.1.1.8.9 > 10.1.1.1.49153: Flags [.], ack 77381, win 65535, length 0
2.918633 Acknowledgment RA:00:00:00:00:00:08 
2.919098 IP 10.1.1.7.654 > 10.1.1.5.654:  aodv rrep 20  prefix 0 hops 1
	dst 10.1.1.8 dseq 3 src 10.1.1.1 5519 ms
2.919413 Acknowledgment RA:00:00:00:00:00:07 
2.919906 IP 10.1.1.8.9 > 10.1.1.1.49153: Flags [.], ack 77381, win 65535, length 0
2.921476 IP 10.1.1.8.9 > 10.1.1.1.49153: Flags [.], ack 77381, win 65535, length 0
2.921790 Acknowledgment RA:00:00:00:00:00:07 
2.928304 IP 10.1.1.6.654 > 10.1.1.8.654:  aodv rrep 20  prefix 0 hops 4
	dst 10.1.1.1 dseq 1 src 10.1.1.8 2367 ms
2.941438 Acknowledgment RA:00:00:00:00:00:02 
2.954752 IP 10.1.1.1.49153 > 10.1.1.8.9: Flags [.], seq 77381:78841, ack 1, win 65535, length 1460
2.955067 Acknowledgment RA:00:00:00:00:00:05 
2.967951 Acknowledgment RA:00:00:00:00:00:02 
2.968141 IP 10.1.1.6.654 > 10.1.1.8.654:  aodv rrep 20  prefix 0 hops 4
	dst 10.1.1.1 dseq 1 src 10.1.1.8 2367 ms
2.969320 Acknowledgment RA:00:00:00:00:00:06 
2.994307 IP 10.1.1.1.49153 > 10.1.1.8.9: Flags [.], seq 78841:80301, ack 1, win 65535, length 1460
2.994621 Acknowledgment RA:00:00:00:00:00:05 
2.995471 IP 10.1.1.8.9 > 10.1.1.1.49153: Flags [.], ack 80301, win 65535, length 0
2.995785 Acknowledgment RA:00:00:00:00:00:08 
2.996138 IP 10.1.1.8.9 > 10.1.1.1.49153: Flags [.], ack 80301, win 65535, length 0
2.996453 Acknowledgment RA:00:00:00:00:00:07 
3.020422 IP 10.1.1.1.49153 > 10.1.1.8.9: Flags [.], seq 80301:81761, ack 1, win 65535, length 1460
3.020736 Acknowledgment RA:00:00:00:00:00:05 
3.020826 IP 10.1.1.6.654 > 10.1.1.7.654:  aodv rrep 20  prefix 0 hops 1
	dst 10.1.1.8 dseq 3 src 10.1.1.1 5519 ms
3.020961 Acknowledgment RA:00:00:00:00:00:06 
3.021326 IP 10.1.1.7.654 > 10.1.1.5.654:  aodv rrep 20  prefix 0 hops 2
	dst 10.1.1.8 dseq 3 src 10.1.1.1 5519 ms
3.021640 Acknowledgment RA:00:00:00:00:00:07 
3.022654 IP 10.1.1.4.654 > 10.1.1.255.654:  aodv rrep 20  prefix 0 hops 0
	dst 10.1.1.4 dseq 0 src 10.1.1.4 2000 ms
3.035559 Acknowledgment RA:00:00:00:00:00:02 
3.048404 Acknowledgment RA:00:00:00:00:00:02 
3.049358 IP 10.1.1.5.654 > 10.1.1.8.654:  aodv rrep 20  prefix 0 hops 2
	dst 10.1.1.1 dseq 1 src 10.1.1.8 2959 ms
3.049673 Acknowledgment RA:00:00:00:00:00:05 
3.054608 IP 10.1.1.5.654 > 10.1.1.2.654:  aodv rrep 20  prefix 0 hops 1
	dst 10.1.1.8 dseq 3 src 10.1.1.1 5519 ms
3.055977 IP 10.1.1.5.654 > 10.1.1.2.654:  aodv rrep 20  prefix 0 hops 2
	dst 10.1.1.8 dseq 3 src 10.1.1.1 5519 ms
3.057305 IP 10.1.1.8.654 > 10.1.1.255.654:  aodv rrep 20  prefix 0 hops 0
	dst 10.1.1.8 dseq 3 src 10.1.1.8 2000 ms
3.063454 IP 10.1.1.7.654 > 10.1.1.255.654:  aodv rrep 20  prefix 0 hops 0
	dst 10.1.1.7 dseq 0 src 10.1.1.7 2000 ms
3.070110 IP 10.1.1.3.654 > 10.1.1.255.654:  aodv rrep 20  prefix 0 hops 0
	dst 10.1.1.3 dseq 0 src 10.1.1.3 2000 ms
3.072075 IP 10.1.1.8.9 > 10.1.1.1.49153: Flags [.], ack 77381, win 65535, length 0
3.084920 IP 10.1.1.1.49153 > 10.1.1.8.9: Flags [.], seq 81761:83221, ack 1, win 65535, length 1460
3.085234 Acknowledgment RA:00:00:00:00:00:05 
3.086084 IP 10.1.1.8.9 > 10.1.1.1.49153: Flags [.], ack 83221, win 65535, length 0
3.086399 Acknowledgment RA:00:00:00:00:00:08 
3.086489 IP 10.1.1.6.654 > 10.1.1.255.654:  aodv rrep 20  prefix 0 hops 0
	dst 10.1.1.6 dseq 0 src 10.1.1.6 2000 ms
3.099943 IP 10.1.1.1.49153 > 10.1.1.8.9: Flags [.], seq 83221:84681, ack 1, win 65535, length 1460
3.100258 Acknowledgment RA:00:00:00:00:00:05 
3.101148 IP 10.1.1.8.9 > 10.1.1.1.49153: Flags [.], ack 80301, win 65535, length 0
3.115421 IP 10.1.1.5.654 > 10.1.1.2.654:  aodv rrep 20  prefix 0 hops 3
	dst 10.1.1.8 dseq 3 src 10.1.1.1 5519 ms
3.117854 IP 10.1.1.5.654 > 10.1.1.255.654:  aodv rrep 20  prefix 0 hops 0
	dst 10.1.1.5 dseq 0 src 10.1.1.5 2000 ms
3.131560 IP 10.1.1.1.49153 > 10.1.1.8.9: Flags [.], seq 84681:86141, ack 1, win 65535, length 1460
3.147499 Acknowledgment RA:00:00:00:00:00:02 
3.163345 IP 10.1.1.1.49153 > 10.1.1.8.9: Flags [.], seq 84681:86141, ack 1, win 65535, length 1460
3.163660 Acknowledgment RA:00:00:00:00:00:05 
3.164510 IP 10.1.1.8.9 > 10.1.1.1.49153: Flags [.], ack 86141, win 65535, length 0
3.164824 Acknowledgment RA:00:00:00:00:00:08 
3.189140 IP 10.1.1.1.49153 > 10.1.1.8.9: Flags [.], seq 86141:87601, ack 1, win 65535, length 1460
3.189455 Acknowledgment RA:00:00:00:00:00:05 
3.190305 IP 10.1.1.8.9 > 10.1.1.1.49153: Flags [.], ack 83221, win 65535, length 0
3.203190 IP 10.1.1.1.49153 > 10.1.1.8.9: Flags [.], seq 87601:89061, ack 1, win 65535, length 1460
3.203505 Acknowledgment RA:00:00:00:00:00:05 
3.204355 IP 10.1.1.8.9 > 10.1.1.1.49153: Flags [.], ack 89061, win 65535, length 0
3.204669 Acknowledgment RA:00:00:00:00:00:08 
3.217325 IP 10.1.1.8.9 > 10.1.1.1.49153: Flags [.], ack 86141, win 65535, length 0
3.218650 IP 10.1.1.8.9 > 10.1.1.1.49153: Flags [.], ack 89061, win 65535, length 0
3.232249 Acknowledgment RA:00:00:00:00:00:02 
3.244779 IP 10.1.1.1.49153 > 10.1.1.8.9: Flags [.], seq 89061:90521, ack 1, win 65535, length 1460
3.245094 Acknowledgment RA:00:00:00:00:00:05 
3.262687 Acknowledgment RA:00:00:00:00:00:02 
3.275217 IP 10.1.1.1.49153 > 10.1.1.8.9: Flags [.], seq 90521:91981, ack 1, win 65535, length 1460
3.275532 Acknowledgment RA:00:00:00:00:00:05 
3.276382 IP 10.1.1.8.9 > 10.1.1.1.49153: Flags [.], ack 91981, win 65535, length 0
3.276696 Acknowledgment RA:00:00:00:00:00:08 
3.277806 IP 10.1.1.8.9 > 10.1.1.1.49153: Flags [.], ack 91981, win 65535, length 0
3.295471 IP 10.1.1.8.9 > 10.1.1.1.49153: Flags [.], ack 91981, win 65535, length 0
3.311795 Acknowledgment RA:00:00:00:00:00:02 
3.324345 IP 10.1.1.1.49153 > 10.1.1.8.9: Flags [.], seq 91981:93441, ack 1, win 65535, length 1460
3.324660 Acknowledgment RA:00:00:00:00:00:05 
3.344748 Acknowledgment RA:00:00:00:00:00:02 
3.357278 IP 10.1.1.1.49153 > 10.1.1.8.9: Flags [.], seq 93441:94901, ack 1, win 65535, length 1460
3.357593 Acknowledgment RA:00:00:00:00:00:05 
3.358443 IP 10.1.1.8.9 > 10.1.1.1.49153: Flags [.], ack 94901, win 65535, length 0
3.358757 Acknowledgment RA:00:00:00:00:00:08 
3.360951 IP 10.1.1.8.9 > 10.1.1.1.49153: Flags [.], ack 94901, win 65535, length 0
3.374170 Acknowledgment RA:00:00:00:00:00:02 
3.386700 IP 10.1.1.1.49153 > 10.1.1.8.9: Flags [.], seq 94901:96361, ack 1, win 65535, length 1460
3.387015 Acknowledgment RA:00:00:00:00:00:05 
3.399899 Acknowledgment RA:00:00:00:00:00:02 
3.412449 IP 10.1.1.1.49153 > 10.1.1.8.9: Flags [.], seq 96361:97821, ack 1, win 65535, length 1460
3.412764 Acknowledgment RA:00:00:00:00:00:05 
3.413614 IP 10.1.1.8.9 > 10.1.1.1.49153: Flags [.], ack 97821, win 65535, length 0
3.413928 Acknowledgment RA:00:00:00:00:00:08 
3.426270 IP 10.1.1.8.9 > 10.1.1.1.49153: Flags [.], ack 97821, win 65535, length 0
3.440069 Acknowledgment RA:00:00:00:00:00:02 
3.441429 IP 10.1.1.1.49153 > 10.1.1.8.9: Flags [.], seq 97821:99281, ack 1, win 65535, length 1460
3.454648 Acknowledgment RA:00:00:00:00:00:02 
3.468967 IP 10.1.1.1.49153 > 10.1.1.8.9: Flags [.], seq 97821:99281, ack 1, win 65535, length 1460
3.469282 Acknowledgment RA:00:00:00:00:00:05 
3.485287 IP 10.1.1.1.49153 > 10.1.1.8.9: Flags [.], seq 99281:100741, ack 1, win 65535, length 1460
3.485602 Acknowledgment RA:00:00:00:00:00:05 
3.486452 IP 10.1.1.8.9 > 10.1.1.1.49153: Flags [.], ack 100741, win 65535, length 0
3.486766 Acknowledgment RA:00:00:00:00:00:08 
3.498301 IP 10.1.1.8.9 > 10.1.1.1.49153: Flags [.], ack 100741, win 65535, length 0
3.516451 Acknowledgment RA:00:00:00:00:00:02 
3.517341 IP 10.1.1.8.9 > 10.1.1.1.49153: Flags [.], ack 100741, win 65535, length 0
3.518531 IP 10.1.1.8.9 > 10.1.1.1.49153: Flags [.], ack 100741, win 65535, length 0
3.533555 IP 10.1.1.1.49153 > 10.1.1.8.9: Flags [.], seq 100741:102201, ack 1, win 65535, length 1460
3.533869 Acknowledgment RA:00:00:00:00:00:05 
3.549062 Acknowledgment RA:00:00:00:00:00:02 
3.561632 IP 10.1.1.1.49153 > 10.1.1.8.9: Flags [.], seq 100741:102201, ack 1, win 65535, length 1460
3.561947 Acknowledgment RA:00:00:00:00:00:05 
3.574677 IP 10.1.1.1.49153 > 10.1.1.8.9: Flags [.], seq 102201:103661, ack 1, win 65535, length 1460
3.574992 Acknowledgment RA:00:00:00:00:00:05 
3.575842 IP 10.1.1.8.9 > 10.1.1.1.49153: Flags [.], ack 103661, win 65535, length 0
3.576156 Acknowledgment RA:00:00:00:00:00:08 
3.588512 IP 10.1.1.8.9 > 10.1.1.1.49153: Flags [.], ack 103661, win 65535, length 0
3.601871 Acknowledgment RA:00:00:00:00:00:02 
3.614401 IP 10.1.1.1.49153 > 10.1.1.8.9: Flags [.], seq 103661:105121, ack 1, win 65535, length 1460
3.614716 Acknowledgment RA:00:00:00:00:00:05 
3.627860 Acknowledgment RA:00:00:00:00:00:02 
3.640390 IP 10.1.1.1.49153 > 10.1.1.8.9: Flags [.], seq 105121:106581, ack 1, win 65535, length 1460
3.640705 Acknowledgment RA:00:00:00:00:00:05 
3.641555 IP 10.1.1.8.9 > 10.1.1.1.49153: Flags [.], ack 106581, win 65535, length 0
3.641869 Acknowledgment RA:00:00:00:00:00:08 
3.654425 IP 10.1.1.8.9 > 10.1.1.1.49153: Flags [.], ack 106581, win 65535, length 0
3.667684 Acknowledgment RA:00:00:00:00:00:02 
3.680374 IP 10.1.1.1.49153 > 10.1.1.8.9: Flags [.], seq 106581:108041, ack 1, win 65535, length 1460
3.680689 Acknowledgment RA:00:00:00:00:00:05 
3.693573 Acknowledgment RA:00:00:00:00:00:02 
3.706458 Acknowledgment RA:00:00:00:00:00:02 
3.719008 IP 10.1.1.1.49153 > 10.1.1.8.9: Flags [.], seq 108041:109501, ack 1, win 65535, length 1460
3.719323 Acknowledgment RA:00:00:00:00:00:05 
3.719869 IP 10.1.1.8.9 > 10.1.1.1.49153: Flags [.], ack 109501, win 65535, length 0
3.721359 IP 10.1.1.8.9 > 10.1.1.1.49153: Flags [.], ack 109501, win 65535, length 0
3.721673 Acknowledgment RA:00:00:00:00:00:08 
3.744423 IP 10.1.1.1.49153 > 10.1.1.8.9: Flags [.], seq 109501:110961, ack 1, win 65535, length 1460
3.744738 Acknowledgment RA:00:00:00:00:00:05 
3.745668 IP 10.1.1.8.9 > 10.1.1.1.49153: Flags [.], ack 109501, win 65535, length 0
3.759067 Acknowledgment RA:00:00:00:00:00:02 
3.765453 IP 10.1.1.1.49153 > 10.1.1.8.9: Flags [.], seq 110961:112421, ack 1, win 65535, length 1460
3.778892 Acknowledgment RA:00:00:00:00:00:02 
3.791642 IP 10.1.1.1.49153 > 10.1.1.8.9: Flags [.], seq 110961:112421, ack 1, win 65535, length 1460
3.791957 Acknowledgment RA:00:00:00:00:00:05 
3.792807 IP 10.1.1.8.9 > 10.1.1.1.49153: Flags [.], ack 112421, win 65535, length 0
3.793121 Acknowledgment RA:00:00:00:00:00:08 
3.817257 IP 10.1.1.1.49153 > 10.1.1.8.9: Flags [.], seq 112421:113881, ack 1, win 65535, length 1460
3.817572 Acknowledgment RA:00:00:00:00:00:05 
3.818442 IP 10.1.1.8.9 > 10.1.1.1.49153: Flags [.], ack 112421, win 65535, length 0
3.832121 Acknowledgment RA:00:00:00:00:00:02 
3.844651 IP 10.1.1.1.49153 > 10.1.1.8.9: Flags [.], seq 113881:115341, ack 1, win 65535, length 1460
3.844966 Acknowledgment RA:00:00:00:00:00:05 
3.845816 IP 10.1.1.8.9 > 10.1.1.1.49153: Flags [.], ack 115341, win 65535, length 0
3.846130 Acknowledgment RA:00:00:00:00:00:08 
3.865942 IP 10.1.1.8.9 > 10.1.1.1.49153: Flags [.], ack 115341, win 65535, length 0
3.892721 Acknowledgment RA:00:00:00:00:00:02 
3.905251 IP 10.1.1.1.49153 > 10.1.1.8.9: Flags [.], seq 115341:116801, ack 1, win 65535, length 1460
3.905566 Acknowledgment RA:00:00:00:00:00:05 
3.918450 Acknowledgment RA:00:00:00:00:00:02 
3.931295 Acknowledgment RA:00:00:00:00:00:02 
3.944160 Acknowledgment RA:00:00:00:00:00:02 
3.957105 Acknowledgment RA:00:00:00:00:00:02 
3.969735 IP 10.1.1.1.49153 > 10.1.1.8.9: Flags [.], seq 116801:118261, ack 1, win 65535, length 1460
3.970050 Acknowledgment RA:00:00:00:00:00:05 
3.970900 IP 10.1.1.8.9 > 10.1.1.1.49153: Flags [.], ack 118261, win 65535, length 0
3.971214 Acknowledgment RA:00:00:00:00:00:08 
3.995430 IP 10.1.1.1.49153 > 10.1.1.8.9: Flags [.], seq 118261:119721, ack 1, win 65535, length 1460
3.995745 Acknowledgment RA:00:00:00:00:00:05 
4.008555 IP 10.1.1.1.49153 > 10.1.1.8.9: Flags [.], seq 119721:121181, ack 1, win 65535, length 1460
4.008870 Acknowledgment RA:00:00:00:00:00:05 
4.009720 IP 10.1.1.8.9 > 10.1.1.1.49153: Flags [.], ack 121181, win 65535, length 0
4.010034 Acknowledgment RA:00:00:00:00:00:08 
4.034330 IP 10.1.1.1.49153 > 10.1.1.8.9: Flags [.], seq 121181:122641, ack 1, win 65535, length 1460
4.034645 Acknowledgment RA:00:00:00:00:00:05 
4.035555 IP 10.1.1.8.9 > 10.1.1.1.49153: Flags [.], ack 118261, win 65535, length 0
4.036720 IP 10.1.1.8.9 > 10.1.1.1.49153: Flags [.], ack 121181, win 65535, length 0
4.038069 IP 10.1.1.4.654 > 10.1.1.255.654:  aodv rrep 20  prefix 0 hops 0
	dst 10.1.1.4 dseq 0 src 10.1.1.4 2000 ms
4.039143 IP 10.1.1.5.654 > 10.1.1.255.654:  aodv rrep 20  prefix 0 hops 0
	dst 10.1.1.5 dseq 0 src 10.1.1.5 2000 ms
4.052328 Acknowledgment RA:00:00:00:00:00:02 
