reading from file aufgabeEins-4-0.pcap, link-type IEEE802_11 (802.11)
0.002092 IP 10.1.1.2.654 > 10.1.1.255.654:  aodv rreq 24  hops 1 id 0x00000001
	dst 10.1.1.8 seq 0 src 10.1.1.1 seq 1
0.002142 IP 10.1.1.5.654 > 10.1.1.255.654:  aodv rreq 24  hops 2 id 0x00000001
	dst 10.1.1.8 seq 0 src 10.1.1.1 seq 1
0.003985 IP 10.1.1.7.654 > 10.1.1.255.654:  aodv rreq 24  hops 3 id 0x00000001
	dst 10.1.1.8 seq 0 src 10.1.1.1 seq 1
0.004931 IP 10.1.1.6.654 > 10.1.1.255.654:  aodv rreq 24  hops 4 id 0x00000001
	dst 10.1.1.8 seq 0 src 10.1.1.1 seq 1
0.005897 IP 10.1.1.4.654 > 10.1.1.255.654:  aodv rreq 24  hops 1 id 0x00000001
	dst 10.1.1.8 seq 0 src 10.1.1.1 seq 1
0.014864 IP 10.1.1.2.654 > 10.1.1.255.654:  aodv rrep 20  prefix 0 hops 0
	dst 10.1.1.2 dseq 0 src 10.1.1.2 2000 ms
0.022864 IP 10.1.1.4.654 > 10.1.1.255.654:  aodv rrep 20  prefix 0 hops 0
	dst 10.1.1.4 dseq 0 src 10.1.1.4 2000 ms
0.024000 IP 10.1.1.5.654 > 10.1.1.255.654:  aodv rrep 20  prefix 0 hops 0
	dst 10.1.1.5 dseq 0 src 10.1.1.5 2000 ms
0.057864 IP 10.1.1.3.654 > 10.1.1.255.654:  aodv rrep 20  prefix 0 hops 0
	dst 10.1.1.3 dseq 0 src 10.1.1.3 2000 ms
0.058864 IP 10.1.1.8.654 > 10.1.1.255.654:  aodv rrep 20  prefix 0 hops 0
	dst 10.1.1.8 dseq 0 src 10.1.1.8 2000 ms
0.065864 IP 10.1.1.7.654 > 10.1.1.255.654:  aodv rrep 20  prefix 0 hops 0
	dst 10.1.1.7 dseq 0 src 10.1.1.7 2000 ms
0.075864 IP 10.1.1.6.654 > 10.1.1.255.654:  aodv rrep 20  prefix 0 hops 0
	dst 10.1.1.6 dseq 0 src 10.1.1.6 2000 ms
1.003743 ARP, Request who-has 10.1.1.5 (ff:ff:ff:ff:ff:ff) tell 10.1.1.8, length 32
1.003793 ARP, Reply 10.1.1.5 is-at 00:00:00:00:00:05, length 32
1.004677 ARP, Reply 10.1.1.5 is-at 00:00:00:00:00:05, length 32
1.005696 Acknowledgment RA:00:00:00:00:00:05 
1.007086 IP 10.1.1.8.654 > 10.1.1.5.654:  aodv rrep 20  prefix 0 hops 0
	dst 10.1.1.8 dseq 0 src 10.1.1.1 11199 ms
1.007096 Acknowledgment RA:00:00:00:00:00:08 
1.007590 ARP, Request who-has 10.1.1.2 (ff:ff:ff:ff:ff:ff) tell 10.1.1.5, length 32
1.009793 ARP, Reply 10.1.1.2 is-at 00:00:00:00:00:02, length 32
1.009803 Acknowledgment RA:00:00:00:00:00:02 
1.010157 IP 10.1.1.5.654 > 10.1.1.2.654:  aodv rrep 20  prefix 0 hops 1
	dst 10.1.1.8 dseq 0 src 10.1.1.1 11199 ms
1.010633 IP 10.1.1.5.654 > 10.1.1.2.654:  aodv rrep 20  prefix 0 hops 1
	dst 10.1.1.8 dseq 0 src 10.1.1.1 11199 ms
1.011812 Acknowledgment RA:00:00:00:00:00:05 
1.012746 ARP, Request who-has 10.1.1.1 (ff:ff:ff:ff:ff:ff) tell 10.1.1.2, length 32
1.015191 IP 10.1.1.2.654 > 10.1.1.255.654:  aodv rrep 20  prefix 0 hops 0
	dst 10.1.1.2 dseq 0 src 10.1.1.2 2000 ms
1.016025 ARP, Reply 10.1.1.2 is-at 00:00:00:00:00:02, length 32
1.017333 ARP, Request who-has 10.1.1.5 (ff:ff:ff:ff:ff:ff) tell 10.1.1.2, length 32
1.017383 ARP, Reply 10.1.1.5 is-at 00:00:00:00:00:05, length 32
1.018701 ARP, Reply 10.1.1.5 is-at 00:00:00:00:00:05, length 32
1.019720 Acknowledgment RA:00:00:00:00:00:05 
1.020570 IP 10.1.1.1.49153 > 10.1.1.8.9: Flags [S], seq 0, win 65535, length 0
1.020580 Acknowledgment RA:00:00:00:00:00:02 
1.021094 ARP, Request who-has 10.1.1.8 (ff:ff:ff:ff:ff:ff) tell 10.1.1.5, length 32
1.022553 ARP, Reply 10.1.1.8 is-at 00:00:00:00:00:08, length 32
1.022563 Acknowledgment RA:00:00:00:00:00:08 
1.023881 IP 10.1.1.4.654 > 10.1.1.255.654:  aodv rrep 20  prefix 0 hops 0
	dst 10.1.1.4 dseq 0 src 10.1.1.4 2000 ms
1.024011 IP 10.1.1.1.49153 > 10.1.1.8.9: Flags [S], seq 0, win 65535, length 0
1.025126 Acknowledgment RA:00:00:00:00:00:05 
1.025196 IP 10.1.1.5.654 > 10.1.1.255.654:  aodv rrep 20  prefix 0 hops 0
	dst 10.1.1.5 dseq 0 src 10.1.1.5 2000 ms
1.026647 IP 10.1.1.8.9 > 10.1.1.1.49153: Flags [S.], seq 0, ack 1, win 65535, length 0
1.026657 Acknowledgment RA:00:00:00:00:00:08 
1.027011 IP 10.1.1.8.9 > 10.1.1.1.49153: Flags [S.], seq 0, ack 1, win 65535, length 0
1.028126 Acknowledgment RA:00:00:00:00:00:05 
1.028976 IP 10.1.1.8.9 > 10.1.1.1.49153: Flags [S.], seq 0, ack 1, win 65535, length 0
1.030455 Acknowledgment RA:00:00:00:00:00:01 
1.031405 IP 10.1.1.1.49153 > 10.1.1.8.9: Flags [.], ack 1, win 65535, length 0
1.031415 Acknowledgment RA:00:00:00:00:00:02 
1.031889 IP 10.1.1.1.49153 > 10.1.1.8.9: Flags [.], ack 1, win 65535, length 0
1.032700 Acknowledgment RA:00:00:00:00:00:05 
1.045290 Acknowledgment RA:00:00:00:00:00:01 
1.057920 IP 10.1.1.1.49153 > 10.1.1.8.9: Flags [.], seq 1:1461, ack 1, win 65535, length 1460
1.057930 Acknowledgment RA:00:00:00:00:00:02 
1.059149 IP 10.1.1.3.654 > 10.1.1.255.654:  aodv rrep 20  prefix 0 hops 0
	dst 10.1.1.3 dseq 0 src 10.1.1.3 2000 ms
1.060273 IP 10.1.1.1.49153 > 10.1.1.8.9: Flags [.], seq 1:1461, ack 1, win 65535, length 1460
1.073068 Acknowledgment RA:00:00:00:00:00:05 
1.073918 IP 10.1.1.8.9 > 10.1.1.1.49153: Flags [.], ack 1461, win 65535, length 0
1.073928 Acknowledgment RA:00:00:00:00:00:08 
1.074362 IP 10.1.1.8.9 > 10.1.1.1.49153: Flags [.], ack 1461, win 65535, length 0
1.075477 Acknowledgment RA:00:00:00:00:00:05 
1.077645 IP 10.1.1.6.654 > 10.1.1.255.654:  aodv rrep 20  prefix 0 hops 0
	dst 10.1.1.6 dseq 0 src 10.1.1.6 2000 ms
1.089486 Acknowledgment RA:00:00:00:00:00:01 
1.102370 Acknowledgment RA:00:00:00:00:00:01 
1.126474 IP 10.1.1.1.49153 > 10.1.1.8.9: Flags [.], seq 1461:2921, ack 1, win 65535, length 1460
1.126484 Acknowledgment RA:00:00:00:00:00:02 
1.126838 IP 10.1.1.1.49153 > 10.1.1.8.9: Flags [.], seq 1461:2921, ack 1, win 65535, length 1460
1.147743 IP 10.1.1.1.49153 > 10.1.1.8.9: Flags [.], seq 2921:4381, ack 1, win 65535, length 1460
1.147753 Acknowledgment RA:00:00:00:00:00:02 
1.148227 IP 10.1.1.1.49153 > 10.1.1.8.9: Flags [.], seq 1461:2921, ack 1, win 65535, length 1460
1.161022 Acknowledgment RA:00:00:00:00:00:05 
1.161072 IP 10.1.1.1.49153 > 10.1.1.8.9: Flags [.], seq 2921:4381, ack 1, win 65535, length 1460
1.167878 IP 10.1.1.1.49153 > 10.1.1.8.9: Flags [.], seq 2921:4381, ack 1, win 65535, length 1460
1.180673 Acknowledgment RA:00:00:00:00:00:05 
1.181219 IP 10.1.1.8.9 > 10.1.1.1.49153: Flags [.], ack 4381, win 65535, length 0
1.181229 Acknowledgment RA:00:00:00:00:00:08 
1.181763 IP 10.1.1.8.9 > 10.1.1.1.49153: Flags [.], ack 4381, win 65535, length 0
1.182878 Acknowledgment RA:00:00:00:00:00:05 
1.183424 IP 10.1.1.8.9 > 10.1.1.1.49153: Flags [.], ack 4381, win 65535, length 0
1.200305 IP 10.1.1.1.49153 > 10.1.1.8.9: Flags [.], seq 4381:5841, ack 1, win 65535, length 1460
1.200315 Acknowledgment RA:00:00:00:00:00:02 
1.202308 IP 10.1.1.1.49153 > 10.1.1.8.9: Flags [.], seq 4381:5841, ack 1, win 65535, length 1460
1.221589 IP 10.1.1.1.49153 > 10.1.1.8.9: Flags [.], seq 5841:7301, ack 1, win 65535, length 1460
1.221599 Acknowledgment RA:00:00:00:00:00:02 
1.222053 IP 10.1.1.1.49153 > 10.1.1.8.9: Flags [.], seq 4381:5841, ack 1, win 65535, length 1460
1.234848 Acknowledgment RA:00:00:00:00:00:05 
1.234978 IP 10.1.1.1.49153 > 10.1.1.8.9: Flags [.], seq 5841:7301, ack 1, win 65535, length 1460
1.254219 IP 10.1.1.1.49153 > 10.1.1.8.9: Flags [.], seq 7301:8761, ack 1, win 65535, length 1460
1.254229 Acknowledgment RA:00:00:00:00:00:02 
1.255023 IP 10.1.1.1.49153 > 10.1.1.8.9: Flags [.], seq 5841:7301, ack 1, win 65535, length 1460
1.267818 Acknowledgment RA:00:00:00:00:00:05 
1.269594 IP 10.1.1.8.9 > 10.1.1.1.49153: Flags [.], ack 7301, win 65535, length 0
1.269604 Acknowledgment RA:00:00:00:00:00:08 
1.270158 IP 10.1.1.1.49153 > 10.1.1.8.9: Flags [.], seq 7301:8761, ack 1, win 65535, length 1460
1.282953 Acknowledgment RA:00:00:00:00:00:05 
1.283083 IP 10.1.1.8.9 > 10.1.1.1.49153: Flags [.], ack 7301, win 65535, length 0
1.284198 Acknowledgment RA:00:00:00:00:00:05 
1.285048 IP 10.1.1.8.9 > 10.1.1.1.49153: Flags [.], ack 7301, win 65535, length 0
1.307343 IP 10.1.1.1.49153 > 10.1.1.8.9: Flags [.], seq 8761:10221, ack 1, win 65535, length 1460
1.307353 Acknowledgment RA:00:00:00:00:00:02 
1.307847 IP 10.1.1.1.49153 > 10.1.1.8.9: Flags [.], seq 8761:10221, ack 1, win 65535, length 1460
1.320642 Acknowledgment RA:00:00:00:00:00:05 
1.322538 IP 10.1.1.8.9 > 10.1.1.1.49153: Flags [.], ack 10221, win 65535, length 0
1.322548 Acknowledgment RA:00:00:00:00:00:08 
1.327298 IP 10.1.1.8.9 > 10.1.1.1.49153: Flags [.], ack 10221, win 65535, length 0
1.328413 Acknowledgment RA:00:00:00:00:00:05 
1.341223 IP 10.1.1.1.49153 > 10.1.1.8.9: Flags [.], seq 10221:11681, ack 1, win 65535, length 1460
1.341233 Acknowledgment RA:00:00:00:00:00:02 
1.341587 IP 10.1.1.1.49153 > 10.1.1.8.9: Flags [.], seq 10221:11681, ack 1, win 65535, length 1460
1.359079 IP 10.1.1.1.49153 > 10.1.1.8.9: Flags [.], seq 11681:13141, ack 1, win 65535, length 1460
1.359089 Acknowledgment RA:00:00:00:00:00:02 
1.359463 IP 10.1.1.1.49153 > 10.1.1.8.9: Flags [.], seq 10221:11681, ack 1, win 65535, length 1460
1.372258 Acknowledgment RA:00:00:00:00:00:05 
1.373148 IP 10.1.1.8.9 > 10.1.1.1.49153: Flags [.], ack 10221, win 65535, length 0
1.387669 IP 10.1.1.1.49153 > 10.1.1.8.9: Flags [.], seq 13141:14601, ack 1, win 65535, length 1460
1.387679 Acknowledgment RA:00:00:00:00:00:02 
1.401482 IP 10.1.1.1.49153 > 10.1.1.8.9: Flags [.], seq 14601:16061, ack 1, win 65535, length 1460
1.401492 Acknowledgment RA:00:00:00:00:00:02 
1.401866 IP 10.1.1.1.49153 > 10.1.1.8.9: Flags [.], seq 11681:13141, ack 1, win 65535, length 1460
1.414661 Acknowledgment RA:00:00:00:00:00:05 
1.416597 IP 10.1.1.8.9 > 10.1.1.1.49153: Flags [.], ack 13141, win 65535, length 0
1.416607 Acknowledgment RA:00:00:00:00:00:08 
1.427381 IP 10.1.1.1.49153 > 10.1.1.8.9: Flags [.], seq 13141:14601, ack 1, win 65535, length 1460
1.440176 Acknowledgment RA:00:00:00:00:00:05 
1.440326 IP 10.1.1.1.49153 > 10.1.1.8.9: Flags [.], seq 14601:16061, ack 1, win 65535, length 1460
1.453121 Acknowledgment RA:00:00:00:00:00:05 
1.455077 IP 10.1.1.8.9 > 10.1.1.1.49153: Flags [.], ack 16061, win 65535, length 0
1.455087 Acknowledgment RA:00:00:00:00:00:08 
1.466001 IP 10.1.1.8.9 > 10.1.1.1.49153: Flags [.], ack 13141, win 65535, length 0
1.467116 Acknowledgment RA:00:00:00:00:00:05 
1.467386 IP 10.1.1.8.9 > 10.1.1.1.49153: Flags [.], ack 16061, win 65535, length 0
1.468501 Acknowledgment RA:00:00:00:00:00:05 
1.482051 IP 10.1.1.1.49153 > 10.1.1.8.9: Flags [.], seq 16061:17521, ack 1, win 65535, length 1460
1.482061 Acknowledgment RA:00:00:00:00:00:02 
1.482415 IP 10.1.1.1.49153 > 10.1.1.8.9: Flags [.], seq 16061:17521, ack 1, win 65535, length 1460
1.495210 Acknowledgment RA:00:00:00:00:00:05 
1.496200 IP 10.1.1.8.9 > 10.1.1.1.49153: Flags [.], ack 13141, win 65535, length 0
1.499081 IP 10.1.1.8.9 > 10.1.1.1.49153: Flags [.], ack 16061, win 65535, length 0
1.512973 IP 10.1.1.1.49153 > 10.1.1.8.9: Flags [.], seq 17521:18981, ack 1, win 65535, length 1460
1.512983 Acknowledgment RA:00:00:00:00:00:02 
1.513337 IP 10.1.1.1.49153 > 10.1.1.8.9: Flags [.], seq 17521:18981, ack 1, win 65535, length 1460
1.526132 Acknowledgment RA:00:00:00:00:00:05 
1.526982 IP 10.1.1.8.9 > 10.1.1.1.49153: Flags [.], ack 18981, win 65535, length 0
1.526992 Acknowledgment RA:00:00:00:00:00:08 
1.540345 IP 10.1.1.1.49153 > 10.1.1.8.9: Flags [.], seq 18981:20441, ack 1, win 65535, length 1460
1.540355 Acknowledgment RA:00:00:00:00:00:02 
1.553290 IP 10.1.1.1.49153 > 10.1.1.8.9: Flags [.], seq 20441:21901, ack 1, win 65535, length 1460
1.553300 Acknowledgment RA:00:00:00:00:00:02 
1.566215 IP 10.1.1.1.49153 > 10.1.1.8.9: Flags [.], seq 21901:23361, ack 1, win 65535, length 1460
1.566225 Acknowledgment RA:00:00:00:00:00:02 
1.580168 IP 10.1.1.1.49153 > 10.1.1.8.9: Flags [.], seq 23361:24821, ack 1, win 65535, length 1460
1.580178 Acknowledgment RA:00:00:00:00:00:02 
1.593013 IP 10.1.1.1.49153 > 10.1.1.8.9: Flags [.], seq 24821:26281, ack 1, win 65535, length 1460
1.593023 Acknowledgment RA:00:00:00:00:00:02 
1.593437 IP 10.1.1.8.9 > 10.1.1.1.49153: Flags [.], ack 18981, win 65535, length 0
1.594552 Acknowledgment RA:00:00:00:00:00:05 
1.595462 IP 10.1.1.8.9 > 10.1.1.1.49153: Flags [.], ack 18981, win 65535, length 0
1.610891 IP 10.1.1.1.49153 > 10.1.1.8.9: Flags [.], seq 26281:27741, ack 1, win 65535, length 1460
1.610901 Acknowledgment RA:00:00:00:00:00:02 
1.623736 IP 10.1.1.1.49153 > 10.1.1.8.9: Flags [.], seq 27741:29201, ack 1, win 65535, length 1460
1.623746 Acknowledgment RA:00:00:00:00:00:02 
1.624200 IP 10.1.1.1.49153 > 10.1.1.8.9: Flags [.], seq 18981:20441, ack 1, win 65535, length 1460
1.636995 Acknowledgment RA:00:00:00:00:00:05 
1.637205 IP 10.1.1.1.49153 > 10.1.1.8.9: Flags [.], seq 20441:21901, ack 1, win 65535, length 1460
1.650000 Acknowledgment RA:00:00:00:00:00:05 
1.650850 IP 10.1.1.8.9 > 10.1.1.1.49153: Flags [.], ack 21901, win 65535, length 0
1.650860 Acknowledgment RA:00:00:00:00:00:08 
1.651710 IP 10.1.1.1.49153 > 10.1.1.8.9: Flags [.], seq 21901:23361, ack 1, win 65535, length 1460
1.664505 Acknowledgment RA:00:00:00:00:00:05 
1.677215 IP 10.1.1.1.49153 > 10.1.1.8.9: Flags [.], seq 29201:30661, ack 1, win 65535, length 1460
1.677225 Acknowledgment RA:00:00:00:00:00:02 
1.677619 IP 10.1.1.1.49153 > 10.1.1.8.9: Flags [.], seq 23361:24821, ack 1, win 65535, length 1460
1.690414 Acknowledgment RA:00:00:00:00:00:05 
1.691264 IP 10.1.1.8.9 > 10.1.1.1.49153: Flags [.], ack 24821, win 65535, length 0
1.691274 Acknowledgment RA:00:00:00:00:00:08 
1.691928 IP 10.1.1.1.49153 > 10.1.1.8.9: Flags [.], seq 24821:26281, ack 1, win 65535, length 1460
1.693148 IP 10.1.1.1.49153 > 10.1.1.8.9: Flags [.], seq 24821:26281, ack 1, win 65535, length 1460
1.705943 Acknowledgment RA:00:00:00:00:00:05 
1.706093 IP 10.1.1.1.49153 > 10.1.1.8.9: Flags [.], seq 26281:27741, ack 1, win 65535, length 1460
1.718888 Acknowledgment RA:00:00:00:00:00:05 
1.719738 IP 10.1.1.8.9 > 10.1.1.1.49153: Flags [.], ack 27741, win 65535, length 0
1.719748 Acknowledgment RA:00:00:00:00:00:08 
1.720162 IP 10.1.1.1.49153 > 10.1.1.8.9: Flags [.], seq 27741:29201, ack 1, win 65535, length 1460
1.732957 Acknowledgment RA:00:00:00:00:00:05 
1.733167 IP 10.1.1.8.9 > 10.1.1.1.49153: Flags [.], ack 21901, win 65535, length 0
1.734145 IP 10.1.1.8.9 > 10.1.1.1.49153: Flags [.], ack 21901, win 65535, length 0
1.735260 Acknowledgment RA:00:00:00:00:00:05 
1.749345 IP 10.1.1.1.49153 > 10.1.1.8.9: Flags [.], seq 30661:32121, ack 1, win 65535, length 1460
1.749355 Acknowledgment RA:00:00:00:00:00:02 
1.763199 IP 10.1.1.1.49153 > 10.1.1.8.9: Flags [.], seq 32121:33581, ack 1, win 65535, length 1460
1.763209 Acknowledgment RA:00:00:00:00:00:02 
1.777092 IP 10.1.1.1.49153 > 10.1.1.8.9: Flags [.], seq 33581:35041, ack 1, win 65535, length 1460
1.777102 Acknowledgment RA:00:00:00:00:00:02 
1.777536 IP 10.1.1.1.49153 > 10.1.1.8.9: Flags [.], seq 29201:30661, ack 1, win 65535, length 1460
1.790331 Acknowledgment RA:00:00:00:00:00:05 
1.791181 IP 10.1.1.8.9 > 10.1.1.1.49153: Flags [.], ack 30661, win 65535, length 0
1.791191 Acknowledgment RA:00:00:00:00:00:08 
1.791585 IP 10.1.1.8.9 > 10.1.1.1.49153: Flags [.], ack 24821, win 65535, length 0
1.792700 Acknowledgment RA:00:00:00:00:00:05 
1.793550 IP 10.1.1.8.9 > 10.1.1.1.49153: Flags [.], ack 24821, win 65535, length 0
1.811958 IP 10.1.1.1.49153 > 10.1.1.8.9: Flags [.], seq 35041:36501, ack 1, win 65535, length 1460
1.811968 Acknowledgment RA:00:00:00:00:00:02 
1.812502 IP 10.1.1.8.9 > 10.1.1.1.49153: Flags [.], ack 27741, win 65535, length 0
1.813617 Acknowledgment RA:00:00:00:00:00:05 
1.829124 IP 10.1.1.1.49153 > 10.1.1.8.9: Flags [.], seq 36501:37961, ack 1, win 65535, length 1460
1.829134 Acknowledgment RA:00:00:00:00:00:02 
1.832400 IP 10.1.1.1.49153 > 10.1.1.8.9: Flags [.], seq 30661:32121, ack 1, win 65535, length 1460
1.845195 Acknowledgment RA:00:00:00:00:00:05 
1.845245 IP 10.1.1.1.49153 > 10.1.1.8.9: Flags [.], seq 32121:33581, ack 1, win 65535, length 1460
1.858040 Acknowledgment RA:00:00:00:00:00:05 
1.870750 IP 10.1.1.1.49153 > 10.1.1.8.9: Flags [.], seq 37961:39421, ack 1, win 65535, length 1460
1.870760 Acknowledgment RA:00:00:00:00:00:02 
1.871935 IP 10.1.1.8.9 > 10.1.1.1.49153: Flags [.], ack 27741, win 65535, length 0
1.879667 IP 10.1.1.1.49153 > 10.1.1.8.9: Flags [.], seq 33581:35041, ack 1, win 65535, length 1460
1.892462 Acknowledgment RA:00:00:00:00:00:05 
1.892812 IP 10.1.1.8.9 > 10.1.1.1.49153: Flags [.], ack 30661, win 65535, length 0
1.893927 Acknowledgment RA:00:00:00:00:00:05 
1.894277 IP 10.1.1.1.49153 > 10.1.1.8.9: Flags [.], seq 35041:36501, ack 1, win 65535, length 1460
1.907072 Acknowledgment RA:00:00:00:00:00:05 
1.907282 IP 10.1.1.1.49153 > 10.1.1.8.9: Flags [.], seq 36501:37961, ack 1, win 65535, length 1460
1.920077 Acknowledgment RA:00:00:00:00:00:05 
1.920127 IP 10.1.1.1.49153 > 10.1.1.8.9: Flags [.], seq 37961:39421, ack 1, win 65535, length 1460
1.932922 Acknowledgment RA:00:00:00:00:00:05 
1.950469 IP 10.1.1.1.49153 > 10.1.1.8.9: Flags [.], seq 39421:40881, ack 1, win 65535, length 1460
1.950479 Acknowledgment RA:00:00:00:00:00:02 
1.950833 IP 10.1.1.1.49153 > 10.1.1.8.9: Flags [.], seq 39421:40881, ack 1, win 65535, length 1460
1.953572 IP 10.1.1.8.9 > 10.1.1.1.49153: Flags [.], ack 36501, win 65535, length 0
1.953582 Acknowledgment RA:00:00:00:00:00:08 
1.954877 IP 10.1.1.8.9 > 10.1.1.1.49153: Flags [.], ack 39421, win 65535, length 0
1.954887 Acknowledgment RA:00:00:00:00:00:08 
1.965662 IP 10.1.1.1.49153 > 10.1.1.8.9: Flags [.], seq 39421:40881, ack 1, win 65535, length 1460
1.978457 Acknowledgment RA:00:00:00:00:00:05 
1.978587 IP 10.1.1.8.9 > 10.1.1.1.49153: Flags [.], ack 36501, win 65535, length 0
1.979702 Acknowledgment RA:00:00:00:00:00:05 
1.992292 IP 10.1.1.1.49153 > 10.1.1.8.9: Flags [.], seq 40881:42341, ack 1, win 65535, length 1460
1.992302 Acknowledgment RA:00:00:00:00:00:02 
2.005297 IP 10.1.1.1.49153 > 10.1.1.8.9: Flags [.], seq 42341:43801, ack 1, win 65535, length 1460
2.005307 Acknowledgment RA:00:00:00:00:00:02 
2.005741 IP 10.1.1.8.9 > 10.1.1.1.49153: Flags [.], ack 39421, win 65535, length 0
2.006856 Acknowledgment RA:00:00:00:00:00:05 
2.007826 IP 10.1.1.8.9 > 10.1.1.1.49153: Flags [.], ack 30661, win 65535, length 0
2.011099 IP 10.1.1.8.9 > 10.1.1.1.49153: Flags [.], ack 36501, win 65535, length 0
2.013019 IP 10.1.1.8.9 > 10.1.1.1.49153: Flags [.], ack 39421, win 65535, length 0
2.027376 IP 10.1.1.1.49153 > 10.1.1.8.9: Flags [.], seq 43801:45261, ack 1, win 65535, length 1460
2.027386 Acknowledgment RA:00:00:00:00:00:02 
2.027800 IP 10.1.1.1.49153 > 10.1.1.8.9: Flags [.], seq 40881:42341, ack 1, win 65535, length 1460
2.040595 Acknowledgment RA:00:00:00:00:00:05 
2.041541 IP 10.1.1.8.654 > 10.1.1.255.654:  aodv rreq 24  hops 0 id 0x00000001
	dst 10.1.1.1 seq 1 src 10.1.1.8 seq 1
2.042295 ARP, Request who-has 10.1.1.8 (ff:ff:ff:ff:ff:ff) tell 10.1.1.7, length 32
2.043149 ARP, Request who-has 10.1.1.5 (ff:ff:ff:ff:ff:ff) tell 10.1.1.7, length 32
2.044320 ARP, Request who-has 10.1.1.7 (ff:ff:ff:ff:ff:ff) tell 10.1.1.8, length 32
2.045354 ARP, Reply 10.1.1.7 is-at 00:00:00:00:00:07, length 32
2.045668 Acknowledgment RA:00:00:00:00:00:07 
2.046518 IP 10.1.1.8.9 > 10.1.1.1.49153: Flags [.], ack 42341, win 65535, length 0
2.046832 Acknowledgment RA:00:00:00:00:00:08 
2.055138 ARP, Request who-has 10.1.1.8 (ff:ff:ff:ff:ff:ff) tell 10.1.1.6, length 32
2.056484 IP 10.1.1.4.654 > 10.1.1.255.654:  aodv rrep 20  prefix 0 hops 0
	dst 10.1.1.4 dseq 0 src 10.1.1.4 2000 ms
2.057279 ARP, Reply 10.1.1.8 is-at 00:00:00:00:00:08, length 32
2.057593 Acknowledgment RA:00:00:00:00:00:08 
2.058648 IP 10.1.1.8.654 > 10.1.1.255.654:  aodv rrep 20  prefix 0 hops 0
	dst 10.1.1.8 dseq 1 src 10.1.1.8 2000 ms
2.059462 ARP, Request who-has 10.1.1.7 (ff:ff:ff:ff:ff:ff) tell 10.1.1.6, length 32
2.059634 Acknowledgment RA:00:00:00:00:00:07 
2.060010 IP 10.1.1.6.654 > 10.1.1.8.654:  aodv rrep 20  prefix 0 hops 4
	dst 10.1.1.1 dseq 1 src 10.1.1.8 3242 ms
2.061884 IP 10.1.1.6.654 > 10.1.1.8.654:  aodv rrep 20  prefix 0 hops 4
	dst 10.1.1.1 dseq 1 src 10.1.1.8 3242 ms
2.062199 Acknowledgment RA:00:00:00:00:00:06 
2.062335 IP 10.1.1.6.654 > 10.1.1.7.654:  aodv rrep 20  prefix 0 hops 1
	dst 10.1.1.8 dseq 1 src 10.1.1.1 5519 ms
2.064274 IP 10.1.1.7.654 > 10.1.1.255.654:  aodv rrep 20  prefix 0 hops 0
	dst 10.1.1.7 dseq 0 src 10.1.1.7 2000 ms
2.069409 Acknowledgment RA:00:00:00:00:00:01 
2.070363 IP 10.1.1.3.654 > 10.1.1.255.654:  aodv rrep 20  prefix 0 hops 0
	dst 10.1.1.3 dseq 0 src 10.1.1.3 2000 ms
2.071106 IP 10.1.1.1.49153 > 10.1.1.8.9: Flags [.], seq 42341:43801, ack 1, win 65535, length 1460
2.083901 Acknowledgment RA:00:00:00:00:00:05 
2.084975 IP 10.1.1.6.654 > 10.1.1.255.654:  aodv rrep 20  prefix 0 hops 0
	dst 10.1.1.6 dseq 0 src 10.1.1.6 2000 ms
2.096751 Acknowledgment RA:00:00:00:00:00:01 
2.097001 IP 10.1.1.5.654 > 10.1.1.255.654:  aodv rrep 20  prefix 0 hops 0
	dst 10.1.1.5 dseq 0 src 10.1.1.5 2000 ms
2.097935 IP 10.1.1.1.49153 > 10.1.1.8.9: Flags [.], seq 43801:45261, ack 1, win 65535, length 1460
2.110730 Acknowledgment RA:00:00:00:00:00:05 
2.112591 IP 10.1.1.5.654 > 10.1.1.8.654:  aodv rrep 20  prefix 0 hops 2
	dst 10.1.1.1 dseq 1 src 10.1.1.8 3400 ms
2.113770 Acknowledgment RA:00:00:00:00:00:05 
2.113880 IP 10.1.1.5.654 > 10.1.1.2.654:  aodv rrep 20  prefix 0 hops 1
	dst 10.1.1.8 dseq 1 src 10.1.1.1 5519 ms
2.115059 Acknowledgment RA:00:00:00:00:00:05 
2.115189 ARP, Reply 10.1.1.5 is-at 00:00:00:00:00:05, length 32
2.115773 ARP, Reply 10.1.1.5 is-at 00:00:00:00:00:05, length 32
2.116791 Acknowledgment RA:00:00:00:00:00:05 
2.130697 IP 10.1.1.7.654 > 10.1.1.5.654:  aodv rrep 20  prefix 0 hops 1
	dst 10.1.1.8 dseq 1 src 10.1.1.1 5519 ms
2.130707 Acknowledgment RA:00:00:00:00:00:07 
2.131882 IP 10.1.1.8.9 > 10.1.1.1.49153: Flags [.], ack 42341, win 65535, length 0
2.131892 Acknowledgment RA:00:00:00:00:00:07 
2.133291 IP 10.1.1.7.654 > 10.1.1.5.654:  aodv rrep 20  prefix 0 hops 2
	dst 10.1.1.8 dseq 1 src 10.1.1.1 5519 ms
2.133301 Acknowledgment RA:00:00:00:00:00:07 
2.143932 IP 10.1.1.5.654 > 10.1.1.2.654:  aodv rrep 20  prefix 0 hops 2
	dst 10.1.1.8 dseq 1 src 10.1.1.1 5519 ms
2.145111 Acknowledgment RA:00:00:00:00:00:05 
2.145401 IP 10.1.1.8.9 > 10.1.1.1.49153: Flags [.], ack 42341, win 65535, length 0
2.146516 Acknowledgment RA:00:00:00:00:00:05 
2.146866 IP 10.1.1.5.654 > 10.1.1.2.654:  aodv rrep 20  prefix 0 hops 3
	dst 10.1.1.8 dseq 1 src 10.1.1.1 5519 ms
2.148045 Acknowledgment RA:00:00:00:00:00:05 
2.161135 IP 10.1.1.1.49153 > 10.1.1.8.9: Flags [.], seq 45261:46721, ack 1, win 65535, length 1460
2.161145 Acknowledgment RA:00:00:00:00:00:02 
2.161499 IP 10.1.1.1.49153 > 10.1.1.8.9: Flags [.], seq 45261:46721, ack 1, win 65535, length 1460
2.174294 Acknowledgment RA:00:00:00:00:00:05 
2.186884 IP 10.1.1.1.49153 > 10.1.1.8.9: Flags [.], seq 46721:48181, ack 1, win 65535, length 1460
2.186894 Acknowledgment RA:00:00:00:00:00:02 
2.187328 IP 10.1.1.1.49153 > 10.1.1.8.9: Flags [.], seq 46721:48181, ack 1, win 65535, length 1460
2.200123 Acknowledgment RA:00:00:00:00:00:05 
2.212773 IP 10.1.1.1.49153 > 10.1.1.8.9: Flags [.], seq 48181:49641, ack 1, win 65535, length 1460
2.212783 Acknowledgment RA:00:00:00:00:00:02 
2.213277 IP 10.1.1.1.49153 > 10.1.1.8.9: Flags [.], seq 48181:49641, ack 1, win 65535, length 1460
2.228676 IP 10.1.1.1.49153 > 10.1.1.8.9: Flags [.], seq 49641:51101, ack 1, win 65535, length 1460
2.228686 Acknowledgment RA:00:00:00:00:00:02 
2.229060 IP 10.1.1.1.49153 > 10.1.1.8.9: Flags [.], seq 48181:49641, ack 1, win 65535, length 1460
2.241855 Acknowledgment RA:00:00:00:00:00:05 
2.242045 IP 10.1.1.1.49153 > 10.1.1.8.9: Flags [.], seq 49641:51101, ack 1, win 65535, length 1460
2.254840 Acknowledgment RA:00:00:00:00:00:05 
2.267430 IP 10.1.1.1.49153 > 10.1.1.8.9: Flags [.], seq 51101:52561, ack 1, win 65535, length 1460
2.267440 Acknowledgment RA:00:00:00:00:00:02 
2.267794 IP 10.1.1.1.49153 > 10.1.1.8.9: Flags [.], seq 51101:52561, ack 1, win 65535, length 1460
2.280589 Acknowledgment RA:00:00:00:00:00:05 
2.293359 IP 10.1.1.1.49153 > 10.1.1.8.9: Flags [.], seq 52561:54021, ack 1, win 65535, length 1460
2.293369 Acknowledgment RA:00:00:00:00:00:02 
2.293723 IP 10.1.1.1.49153 > 10.1.1.8.9: Flags [.], seq 52561:54021, ack 1, win 65535, length 1460
2.306518 Acknowledgment RA:00:00:00:00:00:05 
2.307488 IP 10.1.1.8.9 > 10.1.1.1.49153: Flags [.], ack 51101, win 65535, length 0
2.307498 Acknowledgment RA:00:00:00:00:00:08 
2.309009 IP 10.1.1.8.654 > 10.1.1.255.654:  aodv rreq 24  hops 0 id 0x00000002
	dst 10.1.1.1 seq 1 src 10.1.1.8 seq 2
2.310555 IP 10.1.1.7.654 > 10.1.1.8.654:  aodv rrep 20  prefix 0 hops 3
	dst 10.1.1.1 dseq 1 src 10.1.1.8 3054 ms
2.310870 Acknowledgment RA:00:00:00:00:00:07 
2.311295 IP 10.1.1.7.654 > 10.1.1.5.654:  aodv rrep 20  prefix 0 hops 1
	dst 10.1.1.8 dseq 2 src 10.1.1.1 5519 ms
2.311305 Acknowledgment RA:00:00:00:00:00:07 
2.312480 IP 10.1.1.8.9 > 10.1.1.1.49153: Flags [.], ack 54021, win 65535, length 0
2.312794 Acknowledgment RA:00:00:00:00:00:08 
2.313744 IP 10.1.1.8.9 > 10.1.1.1.49153: Flags [.], ack 54021, win 65535, length 0
2.313754 Acknowledgment RA:00:00:00:00:00:07 
2.319671 IP 10.1.1.6.654 > 10.1.1.8.654:  aodv rrep 20  prefix 0 hops 4
	dst 10.1.1.1 dseq 1 src 10.1.1.8 2974 ms
2.319849 IP 10.1.1.8.9 > 10.1.1.1.49153: Flags [.], ack 51101, win 65535, length 0
2.320964 Acknowledgment RA:00:00:00:00:00:05 
2.321114 IP 10.1.1.5.654 > 10.1.1.8.654:  aodv rrep 20  prefix 0 hops 2
	dst 10.1.1.1 dseq 1 src 10.1.1.8 3133 ms
2.322293 Acknowledgment RA:00:00:00:00:00:05 
2.322343 IP 10.1.1.5.654 > 10.1.1.2.654:  aodv rrep 20  prefix 0 hops 1
	dst 10.1.1.8 dseq 2 src 10.1.1.1 5519 ms
2.323551 IP 10.1.1.6.654 > 10.1.1.8.654:  aodv rrep 20  prefix 0 hops 4
	dst 10.1.1.1 dseq 1 src 10.1.1.8 2974 ms
2.323866 Acknowledgment RA:00:00:00:00:00:06 
2.336622 IP 10.1.1.1.49153 > 10.1.1.8.9: Flags [.], seq 54021:55481, ack 1, win 65535, length 1460
2.336632 Acknowledgment RA:00:00:00:00:00:02 
2.337006 IP 10.1.1.5.654 > 10.1.1.2.654:  aodv rrep 20  prefix 0 hops 1
	dst 10.1.1.8 dseq 2 src 10.1.1.1 5519 ms
2.338185 Acknowledgment RA:00:00:00:00:00:05 
2.338255 IP 10.1.1.5.654 > 10.1.1.2.654:  aodv rrep 20  prefix 0 hops 2
	dst 10.1.1.8 dseq 2 src 10.1.1.1 5519 ms
2.339434 Acknowledgment RA:00:00:00:00:00:05 
2.340368 IP 10.1.1.6.654 > 10.1.1.7.654:  aodv rrep 20  prefix 0 hops 1
	dst 10.1.1.8 dseq 2 src 10.1.1.1 5519 ms
2.340683 Acknowledgment RA:00:00:00:00:00:06 
2.341597 IP 10.1.1.7.654 > 10.1.1.5.654:  aodv rrep 20  prefix 0 hops 2
	dst 10.1.1.8 dseq 2 src 10.1.1.1 5519 ms
2.341607 Acknowledgment RA:00:00:00:00:00:07 
2.353269 IP 10.1.1.8.9 > 10.1.1.1.49153: Flags [.], ack 54021, win 65535, length 0
2.354384 Acknowledgment RA:00:00:00:00:00:05 
2.354514 IP 10.1.1.1.49153 > 10.1.1.8.9: Flags [.], seq 54021:55481, ack 1, win 65535, length 1460
2.367309 Acknowledgment RA:00:00:00:00:00:05 
2.367519 IP 10.1.1.5.654 > 10.1.1.2.654:  aodv rrep 20  prefix 0 hops 3
	dst 10.1.1.8 dseq 2 src 10.1.1.1 5519 ms
2.368698 Acknowledgment RA:00:00:00:00:00:05 
2.381548 IP 10.1.1.1.49153 > 10.1.1.8.9: Flags [.], seq 55481:56941, ack 1, win 65535, length 1460
2.381558 Acknowledgment RA:00:00:00:00:00:02 
2.381912 IP 10.1.1.1.49153 > 10.1.1.8.9: Flags [.], seq 55481:56941, ack 1, win 65535, length 1460
2.394707 Acknowledgment RA:00:00:00:00:00:05 
2.395557 IP 10.1.1.8.9 > 10.1.1.1.49153: Flags [.], ack 56941, win 65535, length 0
2.395567 Acknowledgment RA:00:00:00:00:00:08 
2.407407 IP 10.1.1.8.9 > 10.1.1.1.49153: Flags [.], ack 56941, win 65535, length 0
2.408522 Acknowledgment RA:00:00:00:00:00:05 
2.421612 IP 10.1.1.1.49153 > 10.1.1.8.9: Flags [.], seq 56941:58401, ack 1, win 65535, length 1460
2.421622 Acknowledgment RA:00:00:00:00:00:02 
2.421976 IP 10.1.1.1.49153 > 10.1.1.8.9: Flags [.], seq 56941:58401, ack 1, win 65535, length 1460
2.434771 Acknowledgment RA:00:00:00:00:00:05 
2.447601 IP 10.1.1.1.49153 > 10.1.1.8.9: Flags [.], seq 58401:59861, ack 1, win 65535, length 1460
2.447611 Acknowledgment RA:00:00:00:00:00:02 
2.447965 IP 10.1.1.1.49153 > 10.1.1.8.9: Flags [.], seq 58401:59861, ack 1, win 65535, length 1460
2.460760 Acknowledgment RA:00:00:00:00:00:05 
2.461610 IP 10.1.1.8.9 > 10.1.1.1.49153: Flags [.], ack 59861, win 65535, length 0
2.461620 Acknowledgment RA:00:00:00:00:00:08 
2.462359 IP 10.1.1.8.9 > 10.1.1.1.49153: Flags [.], ack 59861, win 65535, length 0
2.463474 Acknowledgment RA:00:00:00:00:00:05 
2.464428 IP 10.1.1.2.654 > 10.1.1.1.654:  aodv rrep 20  prefix 0 hops 3
	dst 10.1.1.8 dseq 1 src 10.1.1.1 5519 ms
2.465832 IP 10.1.1.8.9 > 10.1.1.1.49153: Flags [.], ack 42341, win 65535, length 0
2.469287 IP 10.1.1.2.654 > 10.1.1.1.654:  aodv rrep 20  prefix 0 hops 4
	dst 10.1.1.8 dseq 1 src 10.1.1.1 5519 ms
2.471248 IP 10.1.1.2.654 > 10.1.1.1.654:  aodv rrep 20  prefix 0 hops 2
	dst 10.1.1.8 dseq 2 src 10.1.1.1 5519 ms
2.472536 IP 10.1.1.2.654 > 10.1.1.1.654:  aodv rrep 20  prefix 0 hops 3
	dst 10.1.1.8 dseq 2 src 10.1.1.1 5519 ms
2.473900 IP 10.1.1.8.9 > 10.1.1.1.49153: Flags [.], ack 54021, win 65535, length 0
2.475169 IP 10.1.1.2.654 > 10.1.1.1.654:  aodv rrep 20  prefix 0 hops 4
	dst 10.1.1.8 dseq 2 src 10.1.1.1 5519 ms
2.476513 IP 10.1.1.8.9 > 10.1.1.1.49153: Flags [.], ack 56941, win 65535, length 0
2.477723 IP 10.1.1.8.9 > 10.1.1.1.49153: Flags [.], ack 56941, win 65535, length 0
2.479047 IP 10.1.1.8.9 > 10.1.1.1.49153: Flags [.], ack 59861, win 65535, length 0
2.494072 IP 10.1.1.1.49153 > 10.1.1.8.9: Flags [.], seq 59861:61321, ack 1, win 65535, length 1460
2.494082 Acknowledgment RA:00:00:00:00:00:02 
2.494436 IP 10.1.1.1.49153 > 10.1.1.8.9: Flags [.], seq 59861:61321, ack 1, win 65535, length 1460
2.498179 IP 10.1.1.1.49153 > 10.1.1.8.9: Flags [.], seq 59861:61321, ack 1, win 65535, length 1460
2.510974 Acknowledgment RA:00:00:00:00:00:05 
2.524843 IP 10.1.1.1.49153 > 10.1.1.8.9: Flags [.], seq 61321:62781, ack 1, win 65535, length 1460
2.524853 Acknowledgment RA:00:00:00:00:00:02 
2.540150 IP 10.1.1.1.49153 > 10.1.1.8.9: Flags [.], seq 61321:62781, ack 1, win 65535, length 1460
2.552945 Acknowledgment RA:00:00:00:00:00:05 
2.553795 IP 10.1.1.8.9 > 10.1.1.1.49153: Flags [.], ack 62781, win 65535, length 0
2.553805 Acknowledgment RA:00:00:00:00:00:08 
2.554415 IP 10.1.1.8.9 > 10.1.1.1.49153: Flags [.], ack 62781, win 65535, length 0
2.555530 Acknowledgment RA:00:00:00:00:00:05 
2.572560 IP 10.1.1.1.49153 > 10.1.1.8.9: Flags [.], seq 62781:64241, ack 1, win 65535, length 1460
2.572570 Acknowledgment RA:00:00:00:00:00:02 
2.572924 IP 10.1.1.1.49153 > 10.1.1.8.9: Flags [.], seq 62781:64241, ack 1, win 65535, length 1460
2.585719 Acknowledgment RA:00:00:00:00:00:05 
2.600449 IP 10.1.1.1.49153 > 10.1.1.8.9: Flags [.], seq 64241:65701, ack 1, win 65535, length 1460
2.600459 Acknowledgment RA:00:00:00:00:00:02 
2.600813 IP 10.1.1.1.49153 > 10.1.1.8.9: Flags [.], seq 64241:65701, ack 1, win 65535, length 1460
2.613608 Acknowledgment RA:00:00:00:00:00:05 
2.614458 IP 10.1.1.8.9 > 10.1.1.1.49153: Flags [.], ack 65701, win 65535, length 0
2.614468 Acknowledgment RA:00:00:00:00:00:08 
2.626588 IP 10.1.1.8.9 > 10.1.1.1.49153: Flags [.], ack 65701, win 65535, length 0
2.627601 IP 10.1.1.8.9 > 10.1.1.1.49153: Flags [.], ack 65701, win 65535, length 0
2.628716 Acknowledgment RA:00:00:00:00:00:05 
2.641326 IP 10.1.1.1.49153 > 10.1.1.8.9: Flags [.], seq 65701:67161, ack 1, win 65535, length 1460
2.641336 Acknowledgment RA:00:00:00:00:00:02 
2.641710 IP 10.1.1.1.49153 > 10.1.1.8.9: Flags [.], seq 65701:67161, ack 1, win 65535, length 1460
2.654505 Acknowledgment RA:00:00:00:00:00:05 
2.667275 IP 10.1.1.1.49153 > 10.1.1.8.9: Flags [.], seq 67161:68621, ack 1, win 65535, length 1460
2.667285 Acknowledgment RA:00:00:00:00:00:02 
2.667699 IP 10.1.1.1.49153 > 10.1.1.8.9: Flags [.], seq 67161:68621, ack 1, win 65535, length 1460
2.680494 Acknowledgment RA:00:00:00:00:00:05 
2.681344 IP 10.1.1.8.9 > 10.1.1.1.49153: Flags [.], ack 68621, win 65535, length 0
2.681354 Acknowledgment RA:00:00:00:00:00:08 
2.693214 IP 10.1.1.8.9 > 10.1.1.1.49153: Flags [.], ack 68621, win 65535, length 0
2.694329 Acknowledgment RA:00:00:00:00:00:05 
2.707479 IP 10.1.1.1.49153 > 10.1.1.8.9: Flags [.], seq 68621:70081, ack 1, win 65535, length 1460
2.707489 Acknowledgment RA:00:00:00:00:00:02 
2.707843 IP 10.1.1.1.49153 > 10.1.1.8.9: Flags [.], seq 68621:70081, ack 1, win 65535, length 1460
2.720638 Acknowledgment RA:00:00:00:00:00:05 
2.733368 IP 10.1.1.1.49153 > 10.1.1.8.9: Flags [.], seq 70081:71541, ack 1, win 65535, length 1460
2.733378 Acknowledgment RA:00:00:00:00:00:02 
2.746213 IP 10.1.1.1.49153 > 10.1.1.8.9: Flags [.], seq 71541:73001, ack 1, win 65535, length 1460
2.746223 Acknowledgment RA:00:00:00:00:00:02 
2.746597 IP 10.1.1.1.49153 > 10.1.1.8.9: Flags [.], seq 70081:71541, ack 1, win 65535, length 1460
2.759392 Acknowledgment RA:00:00:00:00:00:05 
2.772042 IP 10.1.1.1.49153 > 10.1.1.8.9: Flags [.], seq 73001:74461, ack 1, win 65535, length 1460
2.772052 Acknowledgment RA:00:00:00:00:00:02 
2.784947 IP 10.1.1.1.49153 > 10.1.1.8.9: Flags [.], seq 74461:75921, ack 1, win 65535, length 1460
2.784957 Acknowledgment RA:00:00:00:00:00:02 
2.785371 IP 10.1.1.1.49153 > 10.1.1.8.9: Flags [.], seq 71541:73001, ack 1, win 65535, length 1460
2.798166 Acknowledgment RA:00:00:00:00:00:05 
2.798356 IP 10.1.1.1.49153 > 10.1.1.8.9: Flags [.], seq 73001:74461, ack 1, win 65535, length 1460
2.811151 Acknowledgment RA:00:00:00:00:00:05 
2.823701 IP 10.1.1.1.49153 > 10.1.1.8.9: Flags [.], seq 75921:77381, ack 1, win 65535, length 1460
2.823711 Acknowledgment RA:00:00:00:00:00:02 
2.824325 IP 10.1.1.1.49153 > 10.1.1.8.9: Flags [.], seq 74461:75921, ack 1, win 65535, length 1460
2.849670 IP 10.1.1.1.49153 > 10.1.1.8.9: Flags [.], seq 77381:78841, ack 1, win 65535, length 1460
2.849680 Acknowledgment RA:00:00:00:00:00:02 
2.862555 IP 10.1.1.1.49153 > 10.1.1.8.9: Flags [.], seq 78841:80301, ack 1, win 65535, length 1460
2.862565 Acknowledgment RA:00:00:00:00:00:02 
2.876496 IP 10.1.1.1.49153 > 10.1.1.8.9: Flags [.], seq 80301:81761, ack 1, win 65535, length 1460
2.876506 Acknowledgment RA:00:00:00:00:00:02 
2.876980 IP 10.1.1.1.49153 > 10.1.1.8.9: Flags [.], seq 74461:75921, ack 1, win 65535, length 1460
2.889775 Acknowledgment RA:00:00:00:00:00:05 
2.902869 IP 10.1.1.1.49153 > 10.1.1.8.9: Flags [.], seq 75921:77381, ack 1, win 65535, length 1460
2.915664 Acknowledgment RA:00:00:00:00:00:05 
2.916610 IP 10.1.1.8.654 > 10.1.1.255.654:  aodv rreq 24  hops 0 id 0x00000003
	dst 10.1.1.1 seq 1 src 10.1.1.8 seq 3
2.917289 Acknowledgment RA:00:00:00:00:00:07 
2.918319 IP 10.1.1.8.9 > 10.1.1.1.49153: Flags [.], ack 77381, win 65535, length 0
2.918633 Acknowledgment RA:00:00:00:00:00:08 
2.919098 IP 10.1.1.7.654 > 10.1.1.5.654:  aodv rrep 20  prefix 0 hops 1
	dst 10.1.1.8 dseq 3 src 10.1.1.1 5519 ms
2.919108 Acknowledgment RA:00:00:00:00:00:07 
2.921476 IP 10.1.1.8.9 > 10.1.1.1.49153: Flags [.], ack 77381, win 65535, length 0
2.921486 Acknowledgment RA:00:00:00:00:00:07 
2.928390 IP 10.1.1.6.654 > 10.1.1.8.654:  aodv rrep 20  prefix 0 hops 4
	dst 10.1.1.1 dseq 1 src 10.1.1.8 2367 ms
2.941124 IP 10.1.1.1.49153 > 10.1.1.8.9: Flags [.], seq 81761:83221, ack 1, win 65535, length 1460
2.941134 Acknowledgment RA:00:00:00:00:00:02 
2.941628 IP 10.1.1.1.49153 > 10.1.1.8.9: Flags [.], seq 77381:78841, ack 1, win 65535, length 1460
2.942272 IP 10.1.1.1.49153 > 10.1.1.8.9: Flags [.], seq 77381:78841, ack 1, win 65535, length 1460
2.955067 Acknowledgment RA:00:00:00:00:00:05 
2.967637 IP 10.1.1.1.49153 > 10.1.1.8.9: Flags [.], seq 83221:84681, ack 1, win 65535, length 1460
2.967647 Acknowledgment RA:00:00:00:00:00:02 
2.969005 IP 10.1.1.6.654 > 10.1.1.8.654:  aodv rrep 20  prefix 0 hops 4
	dst 10.1.1.1 dseq 1 src 10.1.1.8 2367 ms
2.969320 Acknowledgment RA:00:00:00:00:00:06 
2.981826 IP 10.1.1.1.49153 > 10.1.1.8.9: Flags [.], seq 78841:80301, ack 1, win 65535, length 1460
2.994621 Acknowledgment RA:00:00:00:00:00:05 
2.995471 IP 10.1.1.8.9 > 10.1.1.1.49153: Flags [.], ack 80301, win 65535, length 0
2.995785 Acknowledgment RA:00:00:00:00:00:08 
2.996138 IP 10.1.1.8.9 > 10.1.1.1.49153: Flags [.], ack 80301, win 65535, length 0
2.996148 Acknowledgment RA:00:00:00:00:00:07 
3.007941 IP 10.1.1.1.49153 > 10.1.1.8.9: Flags [.], seq 80301:81761, ack 1, win 65535, length 1460
3.020736 Acknowledgment RA:00:00:00:00:00:05 
3.020912 IP 10.1.1.6.654 > 10.1.1.7.654:  aodv rrep 20  prefix 0 hops 1
	dst 10.1.1.8 dseq 3 src 10.1.1.1 5519 ms
3.021326 IP 10.1.1.7.654 > 10.1.1.5.654:  aodv rrep 20  prefix 0 hops 2
	dst 10.1.1.8 dseq 3 src 10.1.1.1 5519 ms
3.021336 Acknowledgment RA:00:00:00:00:00:07 
3.022654 IP 10.1.1.4.654 > 10.1.1.255.654:  aodv rrep 20  prefix 0 hops 0
	dst 10.1.1.4 dseq 0 src 10.1.1.4 2000 ms
3.035245 IP 10.1.1.1.49153 > 10.1.1.8.9: Flags [.], seq 84681:86141, ack 1, win 65535, length 1460
3.035255 Acknowledgment RA:00:00:00:00:00:02 
3.048090 IP 10.1.1.1.49153 > 10.1.1.8.9: Flags [.], seq 86141:87601, ack 1, win 65535, length 1460
3.048100 Acknowledgment RA:00:00:00:00:00:02 
3.048494 IP 10.1.1.5.654 > 10.1.1.8.654:  aodv rrep 20  prefix 0 hops 2
	dst 10.1.1.1 dseq 1 src 10.1.1.8 2959 ms
3.049673 Acknowledgment RA:00:00:00:00:00:05 
3.050583 IP 10.1.1.8.9 > 10.1.1.1.49153: Flags [.], ack 62781, win 65535, length 0
3.053299 IP 10.1.1.8.9 > 10.1.1.1.49153: Flags [.], ack 65701, win 65535, length 0
3.053743 IP 10.1.1.5.654 > 10.1.1.2.654:  aodv rrep 20  prefix 0 hops 1
	dst 10.1.1.8 dseq 3 src 10.1.1.1 5519 ms
3.054922 Acknowledgment RA:00:00:00:00:00:05 
3.055112 IP 10.1.1.5.654 > 10.1.1.2.654:  aodv rrep 20  prefix 0 hops 2
	dst 10.1.1.8 dseq 3 src 10.1.1.1 5519 ms
3.056291 Acknowledgment RA:00:00:00:00:00:05 
3.057305 IP 10.1.1.8.654 > 10.1.1.255.654:  aodv rrep 20  prefix 0 hops 0
	dst 10.1.1.8 dseq 3 src 10.1.1.8 2000 ms
3.063454 IP 10.1.1.7.654 > 10.1.1.255.654:  aodv rrep 20  prefix 0 hops 0
	dst 10.1.1.7 dseq 0 src 10.1.1.7 2000 ms
3.069156 Acknowledgment RA:00:00:00:00:00:01 
3.070110 IP 10.1.1.3.654 > 10.1.1.255.654:  aodv rrep 20  prefix 0 hops 0
	dst 10.1.1.3 dseq 0 src 10.1.1.3 2000 ms
3.071274 IP 10.1.1.8.9 > 10.1.1.1.49153: Flags [.], ack 77381, win 65535, length 0
3.072389 Acknowledgment RA:00:00:00:00:00:05 
3.072439 IP 10.1.1.1.49153 > 10.1.1.8.9: Flags [.], seq 81761:83221, ack 1, win 65535, length 1460
3.085234 Acknowledgment RA:00:00:00:00:00:05 
3.086084 IP 10.1.1.8.9 > 10.1.1.1.49153: Flags [.], ack 83221, win 65535, length 0
3.086094 Acknowledgment RA:00:00:00:00:00:08 
3.087353 IP 10.1.1.6.654 > 10.1.1.255.654:  aodv rrep 20  prefix 0 hops 0
	dst 10.1.1.6 dseq 0 src 10.1.1.6 2000 ms
3.087463 IP 10.1.1.1.49153 > 10.1.1.8.9: Flags [.], seq 83221:84681, ack 1, win 65535, length 1460
3.100258 Acknowledgment RA:00:00:00:00:00:05 
3.100348 IP 10.1.1.8.9 > 10.1.1.1.49153: Flags [.], ack 80301, win 65535, length 0
3.101463 Acknowledgment RA:00:00:00:00:00:05 
3.114387 Acknowledgment RA:00:00:00:00:00:01 
3.114557 IP 10.1.1.5.654 > 10.1.1.2.654:  aodv rrep 20  prefix 0 hops 3
	dst 10.1.1.8 dseq 3 src 10.1.1.1 5519 ms
3.115736 Acknowledgment RA:00:00:00:00:00:05 
3.116606 IP 10.1.1.8.9 > 10.1.1.1.49153: Flags [.], ack 68621, win 65535, length 0
3.116990 IP 10.1.1.5.654 > 10.1.1.255.654:  aodv rrep 20  prefix 0 hops 0
	dst 10.1.1.5 dseq 0 src 10.1.1.5 2000 ms
3.130759 Acknowledgment RA:00:00:00:00:00:01 
3.130849 IP 10.1.1.1.49153 > 10.1.1.8.9: Flags [.], seq 84681:86141, ack 1, win 65535, length 1460
3.133327 IP 10.1.1.8.9 > 10.1.1.1.49153: Flags [.], ack 68621, win 65535, length 0
3.134595 IP 10.1.1.2.654 > 10.1.1.255.654:  aodv rrep 20  prefix 0 hops 0
	dst 10.1.1.2 dseq 0 src 10.1.1.2 2000 ms
3.147185 IP 10.1.1.1.49153 > 10.1.1.8.9: Flags [.], seq 87601:89061, ack 1, win 65535, length 1460
3.147195 Acknowledgment RA:00:00:00:00:00:02 
3.150865 IP 10.1.1.1.49153 > 10.1.1.8.9: Flags [.], seq 84681:86141, ack 1, win 65535, length 1460
3.163660 Acknowledgment RA:00:00:00:00:00:05 
3.164510 IP 10.1.1.8.9 > 10.1.1.1.49153: Flags [.], ack 86141, win 65535, length 0
3.164520 Acknowledgment RA:00:00:00:00:00:08 
3.176660 IP 10.1.1.1.49153 > 10.1.1.8.9: Flags [.], seq 86141:87601, ack 1, win 65535, length 1460
3.189455 Acknowledgment RA:00:00:00:00:00:05 
3.189505 IP 10.1.1.8.9 > 10.1.1.1.49153: Flags [.], ack 83221, win 65535, length 0
3.190620 Acknowledgment RA:00:00:00:00:00:05 
3.190710 IP 10.1.1.1.49153 > 10.1.1.8.9: Flags [.], seq 87601:89061, ack 1, win 65535, length 1460
