reading from file aufgabeEins-0-0.pcap, link-type IEEE802_11 (802.11)
0.000250 IP 10.1.1.1.654 > 10.1.1.255.654:  aodv rreq 24  hops 0 id 0x00000001
	dst 10.1.1.8 seq 0 src 10.1.1.1 seq 1
0.002092 IP 10.1.1.2.654 > 10.1.1.255.654:  aodv rreq 24  hops 1 id 0x00000001
	dst 10.1.1.8 seq 0 src 10.1.1.1 seq 1
0.003038 IP 10.1.1.3.654 > 10.1.1.255.654:  aodv rreq 24  hops 1 id 0x00000001
	dst 10.1.1.8 seq 0 src 10.1.1.1 seq 1
0.005897 IP 10.1.1.4.654 > 10.1.1.255.654:  aodv rreq 24  hops 1 id 0x00000001
	dst 10.1.1.8 seq 0 src 10.1.1.1 seq 1
0.014864 IP 10.1.1.2.654 > 10.1.1.255.654:  aodv rrep 20  prefix 0 hops 0
	dst 10.1.1.2 dseq 0 src 10.1.1.2 2000 ms
0.022864 IP 10.1.1.4.654 > 10.1.1.255.654:  aodv rrep 20  prefix 0 hops 0
	dst 10.1.1.4 dseq 0 src 10.1.1.4 2000 ms
0.053000 IP 10.1.1.1.654 > 10.1.1.255.654:  aodv rrep 20  prefix 0 hops 0
	dst 10.1.1.1 dseq 1 src 10.1.1.1 2000 ms
0.057864 IP 10.1.1.3.654 > 10.1.1.255.654:  aodv rrep 20  prefix 0 hops 0
	dst 10.1.1.3 dseq 0 src 10.1.1.3 2000 ms
1.008419 ARP, Reply 10.1.1.2 is-at 00:00:00:00:00:02, length 32
1.009793 ARP, Reply 10.1.1.2 is-at 00:00:00:00:00:02, length 32
1.011812 Acknowledgment RA:00:00:00:00:00:05 
1.012746 ARP, Request who-has 10.1.1.1 (ff:ff:ff:ff:ff:ff) tell 10.1.1.2, length 32
1.012796 ARP, Reply 10.1.1.1 is-at 00:00:00:00:00:01, length 32
1.012918 Acknowledgment RA:00:00:00:00:00:01 
1.013214 IP 10.1.1.2.654 > 10.1.1.1.654:  aodv rrep 20  prefix 0 hops 2
	dst 10.1.1.8 dseq 0 src 10.1.1.1 11199 ms
1.013224 Acknowledgment RA:00:00:00:00:00:02 
1.013332 ARP, Request who-has 10.1.1.2 (ff:ff:ff:ff:ff:ff) tell 10.1.1.1, length 32
1.015190 IP 10.1.1.2.654 > 10.1.1.255.654:  aodv rrep 20  prefix 0 hops 0
	dst 10.1.1.2 dseq 0 src 10.1.1.2 2000 ms
1.016024 ARP, Reply 10.1.1.2 is-at 00:00:00:00:00:02, length 32
1.016034 Acknowledgment RA:00:00:00:00:00:02 
1.016388 IP 10.1.1.1.49153 > 10.1.1.8.9: Flags [S], seq 0, win 65535, length 0
1.016499 Acknowledgment RA:00:00:00:00:00:01 
1.017333 ARP, Request who-has 10.1.1.5 (ff:ff:ff:ff:ff:ff) tell 10.1.1.2, length 32
1.019720 Acknowledgment RA:00:00:00:00:00:05 
1.020570 IP 10.1.1.1.49153 > 10.1.1.8.9: Flags [S], seq 0, win 65535, length 0
1.023882 IP 10.1.1.4.654 > 10.1.1.255.654:  aodv rrep 20  prefix 0 hops 0
	dst 10.1.1.4 dseq 0 src 10.1.1.4 2000 ms
1.028126 Acknowledgment RA:00:00:00:00:00:05 
1.028976 IP 10.1.1.8.9 > 10.1.1.1.49153: Flags [S.], seq 0, ack 1, win 65535, length 0
1.028986 Acknowledgment RA:00:00:00:00:00:02 
1.029340 IP 10.1.1.1.49153 > 10.1.1.8.9: Flags [.], ack 1, win 65535, length 0
1.030454 Acknowledgment RA:00:00:00:00:00:01 
1.031404 IP 10.1.1.1.49153 > 10.1.1.8.9: Flags [.], ack 1, win 65535, length 0
1.032495 IP 10.1.1.1.49153 > 10.1.1.8.9: Flags [.], seq 1:1461, ack 1, win 65535, length 1460
1.045290 Acknowledgment RA:00:00:00:00:00:01 
1.057920 IP 10.1.1.1.49153 > 10.1.1.8.9: Flags [.], seq 1:1461, ack 1, win 65535, length 1460
1.059149 IP 10.1.1.3.654 > 10.1.1.255.654:  aodv rrep 20  prefix 0 hops 0
	dst 10.1.1.3 dseq 0 src 10.1.1.3 2000 ms
1.059239 IP 10.1.1.1.654 > 10.1.1.255.654:  aodv rrep 20  prefix 0 hops 0
	dst 10.1.1.1 dseq 1 src 10.1.1.1 2000 ms
1.075477 Acknowledgment RA:00:00:00:00:00:05 
1.076327 IP 10.1.1.8.9 > 10.1.1.1.49153: Flags [.], ack 1461, win 65535, length 0
1.076337 Acknowledgment RA:00:00:00:00:00:02 
1.076691 IP 10.1.1.1.49153 > 10.1.1.8.9: Flags [.], seq 1461:2921, ack 1, win 65535, length 1460
1.089485 Acknowledgment RA:00:00:00:00:00:01 
1.089575 IP 10.1.1.1.49153 > 10.1.1.8.9: Flags [.], seq 2921:4381, ack 1, win 65535, length 1460
1.102370 Acknowledgment RA:00:00:00:00:00:01 
1.108996 IP 10.1.1.1.49153 > 10.1.1.8.9: Flags [.], seq 1461:2921, ack 1, win 65535, length 1460
1.110540 IP 10.1.1.1.49153 > 10.1.1.8.9: Flags [.], seq 1461:2921, ack 1, win 65535, length 1460
1.112104 IP 10.1.1.1.49153 > 10.1.1.8.9: Flags [.], seq 1461:2921, ack 1, win 65535, length 1460
1.126474 IP 10.1.1.1.49153 > 10.1.1.8.9: Flags [.], seq 1461:2921, ack 1, win 65535, length 1460
1.134853 IP 10.1.1.1.49153 > 10.1.1.8.9: Flags [.], seq 2921:4381, ack 1, win 65535, length 1460
1.147743 IP 10.1.1.1.49153 > 10.1.1.8.9: Flags [.], seq 2921:4381, ack 1, win 65535, length 1460
1.182878 Acknowledgment RA:00:00:00:00:00:05 
1.183424 IP 10.1.1.8.9 > 10.1.1.1.49153: Flags [.], ack 4381, win 65535, length 0
1.183434 Acknowledgment RA:00:00:00:00:00:02 
1.183788 IP 10.1.1.1.49153 > 10.1.1.8.9: Flags [.], seq 4381:5841, ack 1, win 65535, length 1460
1.184546 Acknowledgment RA:00:00:00:00:00:01 
1.184656 IP 10.1.1.1.49153 > 10.1.1.8.9: Flags [.], seq 5841:7301, ack 1, win 65535, length 1460
1.185414 Acknowledgment RA:00:00:00:00:00:01 
1.186758 IP 10.1.1.1.49153 > 10.1.1.8.9: Flags [.], seq 4381:5841, ack 1, win 65535, length 1460
1.186916 IP 10.1.1.1.49153 > 10.1.1.8.9: Flags [.], seq 7301:8761, ack 1, win 65535, length 1460
1.187675 Acknowledgment RA:00:00:00:00:00:01 
1.200305 IP 10.1.1.1.49153 > 10.1.1.8.9: Flags [.], seq 4381:5841, ack 1, win 65535, length 1460
1.201864 IP 10.1.1.1.49153 > 10.1.1.8.9: Flags [.], seq 5841:7301, ack 1, win 65535, length 1460
1.221589 IP 10.1.1.1.49153 > 10.1.1.8.9: Flags [.], seq 5841:7301, ack 1, win 65535, length 1460
1.223108 IP 10.1.1.1.49153 > 10.1.1.8.9: Flags [.], seq 7301:8761, ack 1, win 65535, length 1460
1.254219 IP 10.1.1.1.49153 > 10.1.1.8.9: Flags [.], seq 7301:8761, ack 1, win 65535, length 1460
1.284198 Acknowledgment RA:00:00:00:00:00:05 
1.285048 IP 10.1.1.8.9 > 10.1.1.1.49153: Flags [.], ack 7301, win 65535, length 0
1.285058 Acknowledgment RA:00:00:00:00:00:02 
1.285412 IP 10.1.1.1.49153 > 10.1.1.8.9: Flags [.], seq 8761:10221, ack 1, win 65535, length 1460
1.286170 Acknowledgment RA:00:00:00:00:00:01 
1.286260 IP 10.1.1.1.49153 > 10.1.1.8.9: Flags [.], seq 10221:11681, ack 1, win 65535, length 1460
1.287018 Acknowledgment RA:00:00:00:00:00:01 
1.287108 IP 10.1.1.1.49153 > 10.1.1.8.9: Flags [.], seq 11681:13141, ack 1, win 65535, length 1460
1.287867 Acknowledgment RA:00:00:00:00:00:01 
1.294373 IP 10.1.1.1.49153 > 10.1.1.8.9: Flags [.], seq 8761:10221, ack 1, win 65535, length 1460
1.307343 IP 10.1.1.1.49153 > 10.1.1.8.9: Flags [.], seq 8761:10221, ack 1, win 65535, length 1460
1.327108 IP 10.1.1.1.49153 > 10.1.1.8.9: Flags [.], seq 10221:11681, ack 1, win 65535, length 1460
1.328413 Acknowledgment RA:00:00:00:00:00:05 
1.341223 IP 10.1.1.1.49153 > 10.1.1.8.9: Flags [.], seq 10221:11681, ack 1, win 65535, length 1460
1.345789 IP 10.1.1.1.49153 > 10.1.1.8.9: Flags [.], seq 11681:13141, ack 1, win 65535, length 1460
1.359079 IP 10.1.1.1.49153 > 10.1.1.8.9: Flags [.], seq 11681:13141, ack 1, win 65535, length 1460
1.373148 IP 10.1.1.8.9 > 10.1.1.1.49153: Flags [.], ack 10221, win 65535, length 0
1.373158 Acknowledgment RA:00:00:00:00:00:02 
1.373512 IP 10.1.1.1.49153 > 10.1.1.8.9: Flags [.], seq 13141:14601, ack 1, win 65535, length 1460
1.374270 Acknowledgment RA:00:00:00:00:00:01 
1.374320 IP 10.1.1.1.49153 > 10.1.1.8.9: Flags [.], seq 14601:16061, ack 1, win 65535, length 1460
1.375078 Acknowledgment RA:00:00:00:00:00:01 
1.387668 IP 10.1.1.1.49153 > 10.1.1.8.9: Flags [.], seq 13141:14601, ack 1, win 65535, length 1460
1.388153 IP 10.1.1.1.49153 > 10.1.1.8.9: Flags [.], seq 16061:17521, ack 1, win 65535, length 1460
1.388912 Acknowledgment RA:00:00:00:00:00:01 
1.401482 IP 10.1.1.1.49153 > 10.1.1.8.9: Flags [.], seq 14601:16061, ack 1, win 65535, length 1460
1.427211 IP 10.1.1.1.49153 > 10.1.1.8.9: Flags [.], seq 16061:17521, ack 1, win 65535, length 1460
1.465771 IP 10.1.1.1.49153 > 10.1.1.8.9: Flags [.], seq 16061:17521, ack 1, win 65535, length 1460
1.467116 Acknowledgment RA:00:00:00:00:00:05 
1.468501 Acknowledgment RA:00:00:00:00:00:05 
1.482051 IP 10.1.1.1.49153 > 10.1.1.8.9: Flags [.], seq 16061:17521, ack 1, win 65535, length 1460
1.496200 IP 10.1.1.8.9 > 10.1.1.1.49153: Flags [.], ack 13141, win 65535, length 0
1.496210 Acknowledgment RA:00:00:00:00:00:02 
1.496564 IP 10.1.1.1.49153 > 10.1.1.8.9: Flags [.], seq 17521:18981, ack 1, win 65535, length 1460
1.497322 Acknowledgment RA:00:00:00:00:00:01 
1.497412 IP 10.1.1.1.49153 > 10.1.1.8.9: Flags [.], seq 18981:20441, ack 1, win 65535, length 1460
1.498170 Acknowledgment RA:00:00:00:00:00:01 
1.499080 IP 10.1.1.8.9 > 10.1.1.1.49153: Flags [.], ack 16061, win 65535, length 0
1.499090 Acknowledgment RA:00:00:00:00:00:02 
1.499504 IP 10.1.1.1.49153 > 10.1.1.8.9: Flags [.], seq 20441:21901, ack 1, win 65535, length 1460
1.500263 Acknowledgment RA:00:00:00:00:00:01 
1.512973 IP 10.1.1.1.49153 > 10.1.1.8.9: Flags [.], seq 17521:18981, ack 1, win 65535, length 1460
1.525948 IP 10.1.1.1.49153 > 10.1.1.8.9: Flags [.], seq 21901:23361, ack 1, win 65535, length 1460
1.526706 Acknowledgment RA:00:00:00:00:00:01 
1.526956 IP 10.1.1.1.49153 > 10.1.1.8.9: Flags [.], seq 23361:24821, ack 1, win 65535, length 1460
1.527714 Acknowledgment RA:00:00:00:00:00:01 
1.540344 IP 10.1.1.1.49153 > 10.1.1.8.9: Flags [.], seq 18981:20441, ack 1, win 65535, length 1460
1.553289 IP 10.1.1.1.49153 > 10.1.1.8.9: Flags [.], seq 20441:21901, ack 1, win 65535, length 1460
1.566214 IP 10.1.1.1.49153 > 10.1.1.8.9: Flags [.], seq 21901:23361, ack 1, win 65535, length 1460
1.566639 IP 10.1.1.1.49153 > 10.1.1.8.9: Flags [.], seq 24821:26281, ack 1, win 65535, length 1460
1.567398 Acknowledgment RA:00:00:00:00:00:01 
1.580168 IP 10.1.1.1.49153 > 10.1.1.8.9: Flags [.], seq 23361:24821, ack 1, win 65535, length 1460
1.593013 IP 10.1.1.1.49153 > 10.1.1.8.9: Flags [.], seq 24821:26281, ack 1, win 65535, length 1460
1.594552 Acknowledgment RA:00:00:00:00:00:05 
1.595462 IP 10.1.1.8.9 > 10.1.1.1.49153: Flags [.], ack 18981, win 65535, length 0
1.595472 Acknowledgment RA:00:00:00:00:00:02 
1.595826 IP 10.1.1.1.49153 > 10.1.1.8.9: Flags [.], seq 26281:27741, ack 1, win 65535, length 1460
1.596584 Acknowledgment RA:00:00:00:00:00:01 
1.596694 IP 10.1.1.1.49153 > 10.1.1.8.9: Flags [.], seq 27741:29201, ack 1, win 65535, length 1460
1.597452 Acknowledgment RA:00:00:00:00:00:01 
1.597582 IP 10.1.1.1.49153 > 10.1.1.8.9: Flags [.], seq 29201:30661, ack 1, win 65535, length 1460
1.598341 Acknowledgment RA:00:00:00:00:00:01 
1.610891 IP 10.1.1.1.49153 > 10.1.1.8.9: Flags [.], seq 26281:27741, ack 1, win 65535, length 1460
1.623736 IP 10.1.1.1.49153 > 10.1.1.8.9: Flags [.], seq 27741:29201, ack 1, win 65535, length 1460
1.651380 IP 10.1.1.1.49153 > 10.1.1.8.9: Flags [.], seq 29201:30661, ack 1, win 65535, length 1460
1.677215 IP 10.1.1.1.49153 > 10.1.1.8.9: Flags [.], seq 29201:30661, ack 1, win 65535, length 1460
1.735260 Acknowledgment RA:00:00:00:00:00:05 
1.735613 IP 10.1.1.8.9 > 10.1.1.1.49153: Flags [.], ack 21901, win 65535, length 0
1.735623 Acknowledgment RA:00:00:00:00:00:02 
1.735977 IP 10.1.1.1.49153 > 10.1.1.8.9: Flags [.], seq 30661:32121, ack 1, win 65535, length 1460
1.736735 Acknowledgment RA:00:00:00:00:00:01 
1.749345 IP 10.1.1.1.49153 > 10.1.1.8.9: Flags [.], seq 30661:32121, ack 1, win 65535, length 1460
1.749810 IP 10.1.1.1.49153 > 10.1.1.8.9: Flags [.], seq 32121:33581, ack 1, win 65535, length 1460
1.750568 Acknowledgment RA:00:00:00:00:00:01 
1.763198 IP 10.1.1.1.49153 > 10.1.1.8.9: Flags [.], seq 32121:33581, ack 1, win 65535, length 1460
1.763663 IP 10.1.1.1.49153 > 10.1.1.8.9: Flags [.], seq 33581:35041, ack 1, win 65535, length 1460
1.764422 Acknowledgment RA:00:00:00:00:00:01 
1.777092 IP 10.1.1.1.49153 > 10.1.1.8.9: Flags [.], seq 33581:35041, ack 1, win 65535, length 1460
1.792700 Acknowledgment RA:00:00:00:00:00:05 
1.793550 IP 10.1.1.8.9 > 10.1.1.1.49153: Flags [.], ack 24821, win 65535, length 0
1.793560 Acknowledgment RA:00:00:00:00:00:02 
1.793914 IP 10.1.1.1.49153 > 10.1.1.8.9: Flags [.], seq 35041:36501, ack 1, win 65535, length 1460
1.794672 Acknowledgment RA:00:00:00:00:00:01 
1.797349 IP 10.1.1.1.49153 > 10.1.1.8.9: Flags [.], seq 35041:36501, ack 1, win 65535, length 1460
1.797753 IP 10.1.1.1.49153 > 10.1.1.8.9: Flags [.], seq 36501:37961, ack 1, win 65535, length 1460
1.798339 Acknowledgment RA:00:00:00:00:00:01 
1.798649 IP 10.1.1.1.49153 > 10.1.1.8.9: Flags [.], seq 37961:39421, ack 1, win 65535, length 1460
1.799408 Acknowledgment RA:00:00:00:00:00:01 
1.811958 IP 10.1.1.1.49153 > 10.1.1.8.9: Flags [.], seq 35041:36501, ack 1, win 65535, length 1460
1.813617 Acknowledgment RA:00:00:00:00:00:05 
1.816114 IP 10.1.1.1.49153 > 10.1.1.8.9: Flags [.], seq 36501:37961, ack 1, win 65535, length 1460
1.829124 IP 10.1.1.1.49153 > 10.1.1.8.9: Flags [.], seq 36501:37961, ack 1, win 65535, length 1460
1.831996 IP 10.1.1.1.49153 > 10.1.1.8.9: Flags [.], seq 37961:39421, ack 1, win 65535, length 1460
1.870750 IP 10.1.1.1.49153 > 10.1.1.8.9: Flags [.], seq 37961:39421, ack 1, win 65535, length 1460
1.871935 IP 10.1.1.8.9 > 10.1.1.1.49153: Flags [.], ack 27741, win 65535, length 0
1.871945 Acknowledgment RA:00:00:00:00:00:02 
1.872299 IP 10.1.1.1.49153 > 10.1.1.8.9: Flags [.], seq 39421:40881, ack 1, win 65535, length 1460
1.872885 Acknowledgment RA:00:00:00:00:00:01 
1.875033 IP 10.1.1.1.49153 > 10.1.1.8.9: Flags [.], seq 39421:40881, ack 1, win 65535, length 1460
1.875323 IP 10.1.1.1.49153 > 10.1.1.8.9: Flags [.], seq 40881:42341, ack 1, win 65535, length 1460
1.875909 Acknowledgment RA:00:00:00:00:00:01 
1.876019 IP 10.1.1.1.49153 > 10.1.1.8.9: Flags [.], seq 42341:43801, ack 1, win 65535, length 1460
1.876606 Acknowledgment RA:00:00:00:00:00:01 
1.879103 IP 10.1.1.1.49153 > 10.1.1.8.9: Flags [.], seq 39421:40881, ack 1, win 65535, length 1460
1.893927 Acknowledgment RA:00:00:00:00:00:05 
1.935559 IP 10.1.1.1.49153 > 10.1.1.8.9: Flags [.], seq 39421:40881, ack 1, win 65535, length 1460
1.950469 IP 10.1.1.1.49153 > 10.1.1.8.9: Flags [.], seq 39421:40881, ack 1, win 65535, length 1460
1.965252 IP 10.1.1.1.49153 > 10.1.1.8.9: Flags [.], seq 40881:42341, ack 1, win 65535, length 1460
1.979702 Acknowledgment RA:00:00:00:00:00:05 
1.992292 IP 10.1.1.1.49153 > 10.1.1.8.9: Flags [.], seq 40881:42341, ack 1, win 65535, length 1460
2.005297 IP 10.1.1.1.49153 > 10.1.1.8.9: Flags [.], seq 42341:43801, ack 1, win 65535, length 1460
2.006856 Acknowledgment RA:00:00:00:00:00:05 
2.007826 IP 10.1.1.8.9 > 10.1.1.1.49153: Flags [.], ack 30661, win 65535, length 0
2.007836 Acknowledgment RA:00:00:00:00:00:02 
2.008190 IP 10.1.1.1.49153 > 10.1.1.8.9: Flags [.], seq 43801:45261, ack 1, win 65535, length 1460
2.008776 Acknowledgment RA:00:00:00:00:00:01 
2.008886 IP 10.1.1.1.49153 > 10.1.1.8.9: Flags [.], seq 45261:46721, ack 1, win 65535, length 1460
2.009472 Acknowledgment RA:00:00:00:00:00:01 
2.009622 IP 10.1.1.1.49153 > 10.1.1.8.9: Flags [.], seq 46721:48181, ack 1, win 65535, length 1460
2.010209 Acknowledgment RA:00:00:00:00:00:01 
2.011099 IP 10.1.1.8.9 > 10.1.1.1.49153: Flags [.], ack 36501, win 65535, length 0
2.011109 Acknowledgment RA:00:00:00:00:00:02 
2.011463 IP 10.1.1.1.49153 > 10.1.1.8.9: Flags [.], seq 48181:49641, ack 1, win 65535, length 1460
2.012049 Acknowledgment RA:00:00:00:00:00:01 
2.013019 IP 10.1.1.8.9 > 10.1.1.1.49153: Flags [.], ack 39421, win 65535, length 0
2.013029 Acknowledgment RA:00:00:00:00:00:02 
2.013403 IP 10.1.1.1.49153 > 10.1.1.8.9: Flags [.], seq 49641:51101, ack 1, win 65535, length 1460
2.013989 Acknowledgment RA:00:00:00:00:00:01 
2.014159 IP 10.1.1.1.49153 > 10.1.1.8.9: Flags [.], seq 51101:52561, ack 1, win 65535, length 1460
2.014746 Acknowledgment RA:00:00:00:00:00:01 
2.027376 IP 10.1.1.1.49153 > 10.1.1.8.9: Flags [.], seq 43801:45261, ack 1, win 65535, length 1460
2.040451 IP 10.1.1.1.49153 > 10.1.1.8.9: Flags [.], seq 52561:54021, ack 1, win 65535, length 1460
2.041037 Acknowledgment RA:00:00:00:00:00:01 
2.041107 IP 10.1.1.1.49153 > 10.1.1.8.9: Flags [.], seq 54021:55481, ack 1, win 65535, length 1460
2.041693 Acknowledgment RA:00:00:00:00:00:01 
2.054383 IP 10.1.1.1.49153 > 10.1.1.8.9: Flags [.], seq 45261:46721, ack 1, win 65535, length 1460
2.054827 IP 10.1.1.1.49153 > 10.1.1.8.9: Flags [.], seq 55481:56941, ack 1, win 65535, length 1460
2.056484 IP 10.1.1.4.654 > 10.1.1.255.654:  aodv rrep 20  prefix 0 hops 0
	dst 10.1.1.4 dseq 0 src 10.1.1.4 2000 ms
2.056614 IP 10.1.1.1.49153 > 10.1.1.8.9: Flags [.], seq 55481:56941, ack 1, win 65535, length 1460
2.069409 Acknowledgment RA:00:00:00:00:00:01 
2.070363 IP 10.1.1.3.654 > 10.1.1.255.654:  aodv rrep 20  prefix 0 hops 0
	dst 10.1.1.3 dseq 0 src 10.1.1.3 2000 ms
2.070433 IP 10.1.1.1.49153 > 10.1.1.8.9: Flags [.], seq 56941:58401, ack 1, win 65535, length 1460
2.083956 IP 10.1.1.1.49153 > 10.1.1.8.9: Flags [.], seq 56941:58401, ack 1, win 65535, length 1460
2.096751 Acknowledgment RA:00:00:00:00:00:01 
2.110416 IP 10.1.1.1.49153 > 10.1.1.8.9: Flags [.], seq 45261:46721, ack 1, win 65535, length 1460
2.110880 IP 10.1.1.1.49153 > 10.1.1.8.9: Flags [.], seq 58401:59861, ack 1, win 65535, length 1460
2.111466 Acknowledgment RA:00:00:00:00:00:01 
2.111656 IP 10.1.1.1.654 > 10.1.1.255.654:  aodv rrep 20  prefix 0 hops 0
	dst 10.1.1.1 dseq 1 src 10.1.1.1 2000 ms
2.115058 Acknowledgment RA:00:00:00:00:00:05 
2.129801 IP 10.1.1.1.49153 > 10.1.1.8.9: Flags [.], seq 45261:46721, ack 1, win 65535, length 1460
2.143782 IP 10.1.1.1.49153 > 10.1.1.8.9: Flags [.], seq 45261:46721, ack 1, win 65535, length 1460
2.145111 Acknowledgment RA:00:00:00:00:00:05 
2.146516 Acknowledgment RA:00:00:00:00:00:05 
2.148045 Acknowledgment RA:00:00:00:00:00:05 
2.161135 IP 10.1.1.1.49153 > 10.1.1.8.9: Flags [.], seq 45261:46721, ack 1, win 65535, length 1460
2.186884 IP 10.1.1.1.49153 > 10.1.1.8.9: Flags [.], seq 46721:48181, ack 1, win 65535, length 1460
2.212773 IP 10.1.1.1.49153 > 10.1.1.8.9: Flags [.], seq 48181:49641, ack 1, win 65535, length 1460
2.214142 IP 10.1.1.2.654 > 10.1.1.255.654:  aodv rrep 20  prefix 0 hops 0
	dst 10.1.1.2 dseq 0 src 10.1.1.2 2000 ms
2.215626 IP 10.1.1.1.49153 > 10.1.1.8.9: Flags [.], seq 49641:51101, ack 1, win 65535, length 1460
2.228676 IP 10.1.1.1.49153 > 10.1.1.8.9: Flags [.], seq 49641:51101, ack 1, win 65535, length 1460
2.267430 IP 10.1.1.1.49153 > 10.1.1.8.9: Flags [.], seq 51101:52561, ack 1, win 65535, length 1460
2.293359 IP 10.1.1.1.49153 > 10.1.1.8.9: Flags [.], seq 52561:54021, ack 1, win 65535, length 1460
2.306204 IP 10.1.1.1.49153 > 10.1.1.8.9: Flags [.], seq 54021:55481, ack 1, win 65535, length 1460
2.319534 IP 10.1.1.1.49153 > 10.1.1.8.9: Flags [.], seq 54021:55481, ack 1, win 65535, length 1460
2.320963 Acknowledgment RA:00:00:00:00:00:05 
2.336622 IP 10.1.1.1.49153 > 10.1.1.8.9: Flags [.], seq 54021:55481, ack 1, win 65535, length 1460
2.338185 Acknowledgment RA:00:00:00:00:00:05 
2.339434 Acknowledgment RA:00:00:00:00:00:05 
2.353039 IP 10.1.1.1.49153 > 10.1.1.8.9: Flags [.], seq 55481:56941, ack 1, win 65535, length 1460
2.354384 Acknowledgment RA:00:00:00:00:00:05 
2.368698 Acknowledgment RA:00:00:00:00:00:05 
2.381548 IP 10.1.1.1.49153 > 10.1.1.8.9: Flags [.], seq 55481:56941, ack 1, win 65535, length 1460
2.407297 IP 10.1.1.1.49153 > 10.1.1.8.9: Flags [.], seq 56941:58401, ack 1, win 65535, length 1460
2.408522 Acknowledgment RA:00:00:00:00:00:05 
2.421612 IP 10.1.1.1.49153 > 10.1.1.8.9: Flags [.], seq 56941:58401, ack 1, win 65535, length 1460
2.447601 IP 10.1.1.1.49153 > 10.1.1.8.9: Flags [.], seq 58401:59861, ack 1, win 65535, length 1460
2.461774 IP 10.1.1.2.654 > 10.1.1.1.654:  aodv rrep 20  prefix 0 hops 2
	dst 10.1.1.8 dseq 1 src 10.1.1.1 5519 ms
2.461784 Acknowledgment RA:00:00:00:00:00:02 
2.463473 Acknowledgment RA:00:00:00:00:00:05 
2.464427 IP 10.1.1.2.654 > 10.1.1.1.654:  aodv rrep 20  prefix 0 hops 3
	dst 10.1.1.8 dseq 1 src 10.1.1.1 5519 ms
2.464437 Acknowledgment RA:00:00:00:00:00:02 
2.465832 IP 10.1.1.8.9 > 10.1.1.1.49153: Flags [.], ack 42341, win 65535, length 0
2.465842 Acknowledgment RA:00:00:00:00:00:02 
2.466196 IP 10.1.1.1.49153 > 10.1.1.8.9: Flags [.], seq 59861:61321, ack 1, win 65535, length 1460
2.466782 Acknowledgment RA:00:00:00:00:00:01 
2.466872 IP 10.1.1.1.49153 > 10.1.1.8.9: Flags [.], seq 61321:62781, ack 1, win 65535, length 1460
2.467458 Acknowledgment RA:00:00:00:00:00:01 
2.467628 IP 10.1.1.1.49153 > 10.1.1.8.9: Flags [.], seq 62781:64241, ack 1, win 65535, length 1460
2.469287 IP 10.1.1.2.654 > 10.1.1.1.654:  aodv rrep 20  prefix 0 hops 4
	dst 10.1.1.8 dseq 1 src 10.1.1.1 5519 ms
2.469297 Acknowledgment RA:00:00:00:00:00:02 
2.469939 IP 10.1.1.8.9 > 10.1.1.1.49153: Flags [.], ack 51101, win 65535, length 0
2.469949 Acknowledgment RA:00:00:00:00:00:02 
2.471247 IP 10.1.1.2.654 > 10.1.1.1.654:  aodv rrep 20  prefix 0 hops 2
	dst 10.1.1.8 dseq 2 src 10.1.1.1 5519 ms
2.471257 Acknowledgment RA:00:00:00:00:00:02 
2.472536 IP 10.1.1.2.654 > 10.1.1.1.654:  aodv rrep 20  prefix 0 hops 3
	dst 10.1.1.8 dseq 2 src 10.1.1.1 5519 ms
2.472546 Acknowledgment RA:00:00:00:00:00:02 
2.473900 IP 10.1.1.8.9 > 10.1.1.1.49153: Flags [.], ack 54021, win 65535, length 0
2.473910 Acknowledgment RA:00:00:00:00:00:02 
2.475168 IP 10.1.1.2.654 > 10.1.1.1.654:  aodv rrep 20  prefix 0 hops 4
	dst 10.1.1.8 dseq 2 src 10.1.1.1 5519 ms
2.475178 Acknowledgment RA:00:00:00:00:00:02 
2.475712 IP 10.1.1.1.49153 > 10.1.1.8.9: Flags [.], seq 62781:64241, ack 1, win 65535, length 1460
2.477723 IP 10.1.1.8.9 > 10.1.1.1.49153: Flags [.], ack 56941, win 65535, length 0
2.477733 Acknowledgment RA:00:00:00:00:00:02 
2.479047 IP 10.1.1.8.9 > 10.1.1.1.49153: Flags [.], ack 59861, win 65535, length 0
2.479057 Acknowledgment RA:00:00:00:00:00:02 
2.480901 IP 10.1.1.1.49153 > 10.1.1.8.9: Flags [.], seq 59861:61321, ack 1, win 65535, length 1460
2.494071 IP 10.1.1.1.49153 > 10.1.1.8.9: Flags [.], seq 59861:61321, ack 1, win 65535, length 1460
2.495092 IP 10.1.1.1.49153 > 10.1.1.8.9: Flags [.], seq 62781:64241, ack 1, win 65535, length 1460
2.495679 Acknowledgment RA:00:00:00:00:00:01 
2.495789 IP 10.1.1.1.49153 > 10.1.1.8.9: Flags [.], seq 64241:65701, ack 1, win 65535, length 1460
2.496375 Acknowledgment RA:00:00:00:00:00:01 
2.497795 IP 10.1.1.1.49153 > 10.1.1.8.9: Flags [.], seq 61321:62781, ack 1, win 65535, length 1460
2.510870 IP 10.1.1.1.49153 > 10.1.1.8.9: Flags [.], seq 65701:67161, ack 1, win 65535, length 1460
2.511456 Acknowledgment RA:00:00:00:00:00:01 
2.511646 IP 10.1.1.1.49153 > 10.1.1.8.9: Flags [.], seq 67161:68621, ack 1, win 65535, length 1460
2.512233 Acknowledgment RA:00:00:00:00:00:01 
2.524843 IP 10.1.1.1.49153 > 10.1.1.8.9: Flags [.], seq 61321:62781, ack 1, win 65535, length 1460
2.525268 IP 10.1.1.1.49153 > 10.1.1.8.9: Flags [.], seq 68621:70081, ack 1, win 65535, length 1460
2.525854 Acknowledgment RA:00:00:00:00:00:01 
2.526654 IP 10.1.1.1.49153 > 10.1.1.8.9: Flags [.], seq 62781:64241, ack 1, win 65535, length 1460
2.527012 IP 10.1.1.1.49153 > 10.1.1.8.9: Flags [.], seq 70081:71541, ack 1, win 65535, length 1460
2.527598 Acknowledgment RA:00:00:00:00:00:01 
2.527788 IP 10.1.1.1.49153 > 10.1.1.8.9: Flags [.], seq 71541:73001, ack 1, win 65535, length 1460
2.528375 Acknowledgment RA:00:00:00:00:00:01 
2.528565 IP 10.1.1.1.49153 > 10.1.1.8.9: Flags [.], seq 73001:74461, ack 1, win 65535, length 1460
2.529151 Acknowledgment RA:00:00:00:00:00:01 
2.530631 IP 10.1.1.1.49153 > 10.1.1.8.9: Flags [.], seq 62781:64241, ack 1, win 65535, length 1460
2.531055 IP 10.1.1.1.49153 > 10.1.1.8.9: Flags [.], seq 74461:75921, ack 1, win 65535, length 1460
2.531641 Acknowledgment RA:00:00:00:00:00:01 
2.531711 IP 10.1.1.1.49153 > 10.1.1.8.9: Flags [.], seq 75921:77381, ack 1, win 65535, length 1460
2.532298 Acknowledgment RA:00:00:00:00:00:01 
2.532468 IP 10.1.1.1.49153 > 10.1.1.8.9: Flags [.], seq 77381:78841, ack 1, win 65535, length 1460
2.533054 Acknowledgment RA:00:00:00:00:00:01 
2.533384 IP 10.1.1.1.49153 > 10.1.1.8.9: Flags [.], seq 78841:80301, ack 1, win 65535, length 1460
2.533970 Acknowledgment RA:00:00:00:00:00:01 
2.534180 IP 10.1.1.1.49153 > 10.1.1.8.9: Flags [.], seq 80301:81761, ack 1, win 65535, length 1460
2.534767 Acknowledgment RA:00:00:00:00:00:01 
2.534977 IP 10.1.1.1.49153 > 10.1.1.8.9: Flags [.], seq 81761:83221, ack 1, win 65535, length 1460
2.535563 Acknowledgment RA:00:00:00:00:00:01 
2.535753 IP 10.1.1.1.49153 > 10.1.1.8.9: Flags [.], seq 83221:84681, ack 1, win 65535, length 1460
2.536339 Acknowledgment RA:00:00:00:00:00:01 
2.536569 IP 10.1.1.1.49153 > 10.1.1.8.9: Flags [.], seq 84681:86141, ack 1, win 65535, length 1460
2.537156 Acknowledgment RA:00:00:00:00:00:01 
2.538656 IP 10.1.1.1.49153 > 10.1.1.8.9: Flags [.], seq 62781:64241, ack 1, win 65535, length 1460
2.539080 IP 10.1.1.1.49153 > 10.1.1.8.9: Flags [.], seq 86141:87601, ack 1, win 65535, length 1460
2.539666 Acknowledgment RA:00:00:00:00:00:01 
2.554365 IP 10.1.1.1.49153 > 10.1.1.8.9: Flags [.], seq 62781:64241, ack 1, win 65535, length 1460
2.555530 Acknowledgment RA:00:00:00:00:00:05 
2.572560 IP 10.1.1.1.49153 > 10.1.1.8.9: Flags [.], seq 62781:64241, ack 1, win 65535, length 1460
2.587259 IP 10.1.1.1.49153 > 10.1.1.8.9: Flags [.], seq 64241:65701, ack 1, win 65535, length 1460
2.600449 IP 10.1.1.1.49153 > 10.1.1.8.9: Flags [.], seq 64241:65701, ack 1, win 65535, length 1460
2.626338 IP 10.1.1.1.49153 > 10.1.1.8.9: Flags [.], seq 65701:67161, ack 1, win 65535, length 1460
2.628716 Acknowledgment RA:00:00:00:00:00:05 
2.641326 IP 10.1.1.1.49153 > 10.1.1.8.9: Flags [.], seq 65701:67161, ack 1, win 65535, length 1460
2.667275 IP 10.1.1.1.49153 > 10.1.1.8.9: Flags [.], seq 67161:68621, ack 1, win 65535, length 1460
2.693124 IP 10.1.1.1.49153 > 10.1.1.8.9: Flags [.], seq 68621:70081, ack 1, win 65535, length 1460
2.694329 Acknowledgment RA:00:00:00:00:00:05 
2.707479 IP 10.1.1.1.49153 > 10.1.1.8.9: Flags [.], seq 68621:70081, ack 1, win 65535, length 1460
2.733368 IP 10.1.1.1.49153 > 10.1.1.8.9: Flags [.], seq 70081:71541, ack 1, win 65535, length 1460
2.746213 IP 10.1.1.1.49153 > 10.1.1.8.9: Flags [.], seq 71541:73001, ack 1, win 65535, length 1460
2.772042 IP 10.1.1.1.49153 > 10.1.1.8.9: Flags [.], seq 73001:74461, ack 1, win 65535, length 1460
2.784947 IP 10.1.1.1.49153 > 10.1.1.8.9: Flags [.], seq 74461:75921, ack 1, win 65535, length 1460
2.823701 IP 10.1.1.1.49153 > 10.1.1.8.9: Flags [.], seq 75921:77381, ack 1, win 65535, length 1460
2.849670 IP 10.1.1.1.49153 > 10.1.1.8.9: Flags [.], seq 77381:78841, ack 1, win 65535, length 1460
2.862555 IP 10.1.1.1.49153 > 10.1.1.8.9: Flags [.], seq 78841:80301, ack 1, win 65535, length 1460
2.876496 IP 10.1.1.1.49153 > 10.1.1.8.9: Flags [.], seq 80301:81761, ack 1, win 65535, length 1460
2.902445 IP 10.1.1.1.49153 > 10.1.1.8.9: Flags [.], seq 81761:83221, ack 1, win 65535, length 1460
2.928254 IP 10.1.1.1.49153 > 10.1.1.8.9: Flags [.], seq 81761:83221, ack 1, win 65535, length 1460
2.941124 IP 10.1.1.1.49153 > 10.1.1.8.9: Flags [.], seq 81761:83221, ack 1, win 65535, length 1460
2.967637 IP 10.1.1.1.49153 > 10.1.1.8.9: Flags [.], seq 83221:84681, ack 1, win 65535, length 1460
2.981676 IP 10.1.1.1.49153 > 10.1.1.8.9: Flags [.], seq 84681:86141, ack 1, win 65535, length 1460
3.007751 IP 10.1.1.1.49153 > 10.1.1.8.9: Flags [.], seq 84681:86141, ack 1, win 65535, length 1460
3.022654 IP 10.1.1.4.654 > 10.1.1.255.654:  aodv rrep 20  prefix 0 hops 0
	dst 10.1.1.4 dseq 0 src 10.1.1.4 2000 ms
3.035244 IP 10.1.1.1.49153 > 10.1.1.8.9: Flags [.], seq 84681:86141, ack 1, win 65535, length 1460
3.048089 IP 10.1.1.1.49153 > 10.1.1.8.9: Flags [.], seq 86141:87601, ack 1, win 65535, length 1460
3.050582 IP 10.1.1.8.9 > 10.1.1.1.49153: Flags [.], ack 62781, win 65535, length 0
3.050592 Acknowledgment RA:00:00:00:00:00:02 
3.050946 IP 10.1.1.1.49153 > 10.1.1.8.9: Flags [.], seq 87601:89061, ack 1, win 65535, length 1460
3.051533 Acknowledgment RA:00:00:00:00:00:01 
3.051783 IP 10.1.1.1.49153 > 10.1.1.8.9: Flags [.], seq 89061:90521, ack 1, win 65535, length 1460
3.052369 Acknowledgment RA:00:00:00:00:00:01 
3.052499 IP 10.1.1.1.49153 > 10.1.1.8.9: Flags [.], seq 90521:91981, ack 1, win 65535, length 1460
3.054922 Acknowledgment RA:00:00:00:00:00:05 
3.056291 Acknowledgment RA:00:00:00:00:00:05 
3.056361 IP 10.1.1.1.49153 > 10.1.1.8.9: Flags [.], seq 90521:91981, ack 1, win 65535, length 1460
3.069155 Acknowledgment RA:00:00:00:00:00:01 
3.070110 IP 10.1.1.3.654 > 10.1.1.255.654:  aodv rrep 20  prefix 0 hops 0
	dst 10.1.1.3 dseq 0 src 10.1.1.3 2000 ms
3.070220 IP 10.1.1.1.654 > 10.1.1.255.654:  aodv rrep 20  prefix 0 hops 0
	dst 10.1.1.1 dseq 1 src 10.1.1.1 2000 ms
3.072389 Acknowledgment RA:00:00:00:00:00:05 
3.086184 IP 10.1.1.8.9 > 10.1.1.1.49153: Flags [.], ack 65701, win 65535, length 0
3.086194 Acknowledgment RA:00:00:00:00:00:02 
3.086548 IP 10.1.1.1.49153 > 10.1.1.8.9: Flags [.], seq 91981:93441, ack 1, win 65535, length 1460
3.101462 Acknowledgment RA:00:00:00:00:00:05 
3.101592 IP 10.1.1.1.49153 > 10.1.1.8.9: Flags [.], seq 91981:93441, ack 1, win 65535, length 1460
3.114387 Acknowledgment RA:00:00:00:00:00:01 
3.115736 Acknowledgment RA:00:00:00:00:00:05 
3.115806 IP 10.1.1.1.49153 > 10.1.1.8.9: Flags [.], seq 93441:94901, ack 1, win 65535, length 1460
3.117965 IP 10.1.1.1.49153 > 10.1.1.8.9: Flags [.], seq 93441:94901, ack 1, win 65535, length 1460
3.130759 Acknowledgment RA:00:00:00:00:00:01 
3.131770 IP 10.1.1.1.49153 > 10.1.1.8.9: Flags [.], seq 94901:96361, ack 1, win 65535, length 1460
3.132356 Acknowledgment RA:00:00:00:00:00:01 
3.133326 IP 10.1.1.8.9 > 10.1.1.1.49153: Flags [.], ack 68621, win 65535, length 0
3.133336 Acknowledgment RA:00:00:00:00:00:02 
3.134595 IP 10.1.1.2.654 > 10.1.1.255.654:  aodv rrep 20  prefix 0 hops 0
	dst 10.1.1.2 dseq 0 src 10.1.1.2 2000 ms
3.147185 IP 10.1.1.1.49153 > 10.1.1.8.9: Flags [.], seq 87601:89061, ack 1, win 65535, length 1460
3.147630 IP 10.1.1.1.49153 > 10.1.1.8.9: Flags [.], seq 96361:97821, ack 1, win 65535, length 1460
3.148216 Acknowledgment RA:00:00:00:00:00:01 
3.148286 IP 10.1.1.1.49153 > 10.1.1.8.9: Flags [.], seq 97821:99281, ack 1, win 65535, length 1460
3.148872 Acknowledgment RA:00:00:00:00:00:01 
3.149022 IP 10.1.1.1.49153 > 10.1.1.8.9: Flags [.], seq 99281:100741, ack 1, win 65535, length 1460
3.149609 Acknowledgment RA:00:00:00:00:00:01 
3.150301 IP 10.1.1.1.49153 > 10.1.1.8.9: Flags [.], seq 89061:90521, ack 1, win 65535, length 1460
3.176390 IP 10.1.1.1.49153 > 10.1.1.8.9: Flags [.], seq 89061:90521, ack 1, win 65535, length 1460
3.190620 Acknowledgment RA:00:00:00:00:00:05 
3.216395 IP 10.1.1.1.49153 > 10.1.1.8.9: Flags [.], seq 89061:90521, ack 1, win 65535, length 1460
3.217640 Acknowledgment RA:00:00:00:00:00:05 
3.218965 Acknowledgment RA:00:00:00:00:00:05 
3.231935 IP 10.1.1.1.49153 > 10.1.1.8.9: Flags [.], seq 89061:90521, ack 1, win 65535, length 1460
3.245466 IP 10.1.1.2.654 > 10.1.1.1.654:  aodv rrep 20  prefix 0 hops 2
	dst 10.1.1.8 dseq 3 src 10.1.1.1 5519 ms
3.245476 Acknowledgment RA:00:00:00:00:00:02 
3.246560 IP 10.1.1.2.654 > 10.1.1.1.654:  aodv rrep 20  prefix 0 hops 3
	dst 10.1.1.8 dseq 3 src 10.1.1.1 5519 ms
3.246570 Acknowledgment RA:00:00:00:00:00:02 
3.249182 IP 10.1.1.1.49153 > 10.1.1.8.9: Flags [.], seq 90521:91981, ack 1, win 65535, length 1460
3.262372 IP 10.1.1.1.49153 > 10.1.1.8.9: Flags [.], seq 90521:91981, ack 1, win 65535, length 1460
3.276641 IP 10.1.1.8.9 > 10.1.1.1.49153: Flags [.], ack 77381, win 65535, length 0
3.276651 Acknowledgment RA:00:00:00:00:00:02 
3.277005 IP 10.1.1.1.49153 > 10.1.1.8.9: Flags [.], seq 100741:102201, ack 1, win 65535, length 1460
3.277937 IP 10.1.1.1.49153 > 10.1.1.8.9: Flags [.], seq 100741:102201, ack 1, win 65535, length 1460
3.290732 Acknowledgment RA:00:00:00:00:00:01 
3.291602 IP 10.1.1.8.9 > 10.1.1.1.49153: Flags [.], ack 80301, win 65535, length 0
3.291612 Acknowledgment RA:00:00:00:00:00:02 
3.294044 IP 10.1.1.1.49153 > 10.1.1.8.9: Flags [.], seq 91981:93441, ack 1, win 65535, length 1460
3.294314 IP 10.1.1.1.49153 > 10.1.1.8.9: Flags [.], seq 102201:103661, ack 1, win 65535, length 1460
3.295785 Acknowledgment RA:00:00:00:00:00:05 
3.295955 IP 10.1.1.1.49153 > 10.1.1.8.9: Flags [.], seq 102201:103661, ack 1, win 65535, length 1460
3.296542 Acknowledgment RA:00:00:00:00:00:01 
3.296672 IP 10.1.1.1.49153 > 10.1.1.8.9: Flags [.], seq 103661:105121, ack 1, win 65535, length 1460
3.297258 Acknowledgment RA:00:00:00:00:00:01 
3.297448 IP 10.1.1.1.49153 > 10.1.1.8.9: Flags [.], seq 105121:106581, ack 1, win 65535, length 1460
3.298034 Acknowledgment RA:00:00:00:00:00:01 
3.298284 IP 10.1.1.1.49153 > 10.1.1.8.9: Flags [.], seq 106581:108041, ack 1, win 65535, length 1460
3.298871 Acknowledgment RA:00:00:00:00:00:01 
3.311481 IP 10.1.1.1.49153 > 10.1.1.8.9: Flags [.], seq 91981:93441, ack 1, win 65535, length 1460
3.324436 IP 10.1.1.1.49153 > 10.1.1.8.9: Flags [.], seq 108041:109501, ack 1, win 65535, length 1460
3.325022 Acknowledgment RA:00:00:00:00:00:01 
3.326156 IP 10.1.1.2.654 > 10.1.1.1.654:  aodv rrep 20  prefix 0 hops 4
	dst 10.1.1.8 dseq 3 src 10.1.1.1 5519 ms
3.326166 Acknowledgment RA:00:00:00:00:00:02 
3.326580 IP 10.1.1.1.49153 > 10.1.1.8.9: Flags [.], seq 109501:110961, ack 1, win 65535, length 1460
3.327166 Acknowledgment RA:00:00:00:00:00:01 
3.329354 IP 10.1.1.1.49153 > 10.1.1.8.9: Flags [.], seq 93441:94901, ack 1, win 65535, length 1460
3.329624 IP 10.1.1.1.49153 > 10.1.1.8.9: Flags [.], seq 110961:112421, ack 1, win 65535, length 1460
3.330211 Acknowledgment RA:00:00:00:00:00:01 
3.330481 IP 10.1.1.1.49153 > 10.1.1.8.9: Flags [.], seq 112421:113881, ack 1, win 65535, length 1460
3.331067 Acknowledgment RA:00:00:00:00:00:01 
3.331197 IP 10.1.1.1.49153 > 10.1.1.8.9: Flags [.], seq 113881:115341, ack 1, win 65535, length 1460
3.331783 Acknowledgment RA:00:00:00:00:00:01 
3.344433 IP 10.1.1.1.49153 > 10.1.1.8.9: Flags [.], seq 93441:94901, ack 1, win 65535, length 1460
3.359940 IP 10.1.1.1.49153 > 10.1.1.8.9: Flags [.], seq 94901:96361, ack 1, win 65535, length 1460
3.361265 Acknowledgment RA:00:00:00:00:00:05 
3.373855 IP 10.1.1.1.49153 > 10.1.1.8.9: Flags [.], seq 94901:96361, ack 1, win 65535, length 1460
3.399584 IP 10.1.1.1.49153 > 10.1.1.8.9: Flags [.], seq 96361:97821, ack 1, win 65535, length 1460
3.412449 IP 10.1.1.1.49153 > 10.1.1.8.9: Flags [.], seq 97821:99281, ack 1, win 65535, length 1460
3.425379 IP 10.1.1.1.49153 > 10.1.1.8.9: Flags [.], seq 97821:99281, ack 1, win 65535, length 1460
3.426584 Acknowledgment RA:00:00:00:00:00:05 
3.439754 IP 10.1.1.1.49153 > 10.1.1.8.9: Flags [.], seq 97821:99281, ack 1, win 65535, length 1460
3.454333 IP 10.1.1.1.49153 > 10.1.1.8.9: Flags [.], seq 99281:100741, ack 1, win 65535, length 1460
3.455658 IP 10.1.1.8.9 > 10.1.1.1.49153: Flags [.], ack 83221, win 65535, length 0
3.455668 Acknowledgment RA:00:00:00:00:00:02 
3.456022 IP 10.1.1.1.49153 > 10.1.1.8.9: Flags [.], seq 115341:116801, ack 1, win 65535, length 1460
3.469398 IP 10.1.1.1.49153 > 10.1.1.8.9: Flags [.], seq 115341:116801, ack 1, win 65535, length 1460
3.469984 Acknowledgment RA:00:00:00:00:00:01 
3.470934 IP 10.1.1.8.9 > 10.1.1.1.49153: Flags [.], ack 86141, win 65535, length 0
3.470944 Acknowledgment RA:00:00:00:00:00:02 
3.471458 IP 10.1.1.1.49153 > 10.1.1.8.9: Flags [.], seq 116801:118261, ack 1, win 65535, length 1460
3.472044 Acknowledgment RA:00:00:00:00:00:01 
3.472134 IP 10.1.1.1.49153 > 10.1.1.8.9: Flags [.], seq 118261:119721, ack 1, win 65535, length 1460
3.485358 IP 10.1.1.1.49153 > 10.1.1.8.9: Flags [.], seq 118261:119721, ack 1, win 65535, length 1460
3.498152 Acknowledgment RA:00:00:00:00:00:01 
3.498631 IP 10.1.1.1.49153 > 10.1.1.8.9: Flags [.], seq 119721:121181, ack 1, win 65535, length 1460
3.499217 Acknowledgment RA:00:00:00:00:00:01 
3.499447 IP 10.1.1.1.49153 > 10.1.1.8.9: Flags [.], seq 121181:122641, ack 1, win 65535, length 1460
3.500034 Acknowledgment RA:00:00:00:00:00:01 
3.500144 IP 10.1.1.1.49153 > 10.1.1.8.9: Flags [.], seq 122641:124101, ack 1, win 65535, length 1460
3.500730 Acknowledgment RA:00:00:00:00:00:01 
3.501840 IP 10.1.1.8.9 > 10.1.1.1.49153: Flags [.], ack 89061, win 65535, length 0
3.501850 Acknowledgment RA:00:00:00:00:00:02 
3.502224 IP 10.1.1.1.49153 > 10.1.1.8.9: Flags [.], seq 124101:125561, ack 1, win 65535, length 1460
3.502810 Acknowledgment RA:00:00:00:00:00:01 
3.502880 IP 10.1.1.1.49153 > 10.1.1.8.9: Flags [.], seq 125561:127021, ack 1, win 65535, length 1460
3.503467 Acknowledgment RA:00:00:00:00:00:01 
3.516137 IP 10.1.1.1.49153 > 10.1.1.8.9: Flags [.], seq 100741:102201, ack 1, win 65535, length 1460
3.516542 IP 10.1.1.1.49153 > 10.1.1.8.9: Flags [.], seq 127021:128481, ack 1, win 65535, length 1460
3.518846 Acknowledgment RA:00:00:00:00:00:05 
3.519796 IP 10.1.1.8.9 > 10.1.1.1.49153: Flags [.], ack 91981, win 65535, length 0
3.519806 Acknowledgment RA:00:00:00:00:00:02 
3.521074 IP 10.1.1.1.49153 > 10.1.1.8.9: Flags [.], seq 127021:128481, ack 1, win 65535, length 1460
3.533868 Acknowledgment RA:00:00:00:00:00:01 
3.534058 IP 10.1.1.1.49153 > 10.1.1.8.9: Flags [.], seq 128481:129941, ack 1, win 65535, length 1460
3.534645 Acknowledgment RA:00:00:00:00:00:01 
3.534735 IP 10.1.1.1.49153 > 10.1.1.8.9: Flags [.], seq 129941:131401, ack 1, win 65535, length 1460
3.535321 Acknowledgment RA:00:00:00:00:00:01 
3.535411 IP 10.1.1.1.49153 > 10.1.1.8.9: Flags [.], seq 131401:132861, ack 1, win 65535, length 1460
3.535997 Acknowledgment RA:00:00:00:00:00:01 
3.548747 IP 10.1.1.1.49153 > 10.1.1.8.9: Flags [.], seq 102201:103661, ack 1, win 65535, length 1460
3.587581 IP 10.1.1.1.49153 > 10.1.1.8.9: Flags [.], seq 103661:105121, ack 1, win 65535, length 1460
3.588826 Acknowledgment RA:00:00:00:00:00:05 
3.601556 IP 10.1.1.1.49153 > 10.1.1.8.9: Flags [.], seq 103661:105121, ack 1, win 65535, length 1460
3.627545 IP 10.1.1.1.49153 > 10.1.1.8.9: Flags [.], seq 105121:106581, ack 1, win 65535, length 1460
3.653274 IP 10.1.1.1.49153 > 10.1.1.8.9: Flags [.], seq 106581:108041, ack 1, win 65535, length 1460
3.654739 Acknowledgment RA:00:00:00:00:00:05 
3.667369 IP 10.1.1.1.49153 > 10.1.1.8.9: Flags [.], seq 106581:108041, ack 1, win 65535, length 1460
3.693258 IP 10.1.1.1.49153 > 10.1.1.8.9: Flags [.], seq 108041:109501, ack 1, win 65535, length 1460
3.706143 IP 10.1.1.1.49153 > 10.1.1.8.9: Flags [.], seq 109501:110961, ack 1, win 65535, length 1460
3.731872 IP 10.1.1.1.49153 > 10.1.1.8.9: Flags [.], seq 110961:112421, ack 1, win 65535, length 1460
3.745982 Acknowledgment RA:00:00:00:00:00:05 
3.758752 IP 10.1.1.1.49153 > 10.1.1.8.9: Flags [.], seq 110961:112421, ack 1, win 65535, length 1460
3.778577 IP 10.1.1.1.49153 > 10.1.1.8.9: Flags [.], seq 112421:113881, ack 1, win 65535, length 1460
3.804506 IP 10.1.1.1.49153 > 10.1.1.8.9: Flags [.], seq 113881:115341, ack 1, win 65535, length 1460
3.818756 Acknowledgment RA:00:00:00:00:00:05 
3.831806 IP 10.1.1.1.49153 > 10.1.1.8.9: Flags [.], seq 113881:115341, ack 1, win 65535, length 1460
3.846095 IP 10.1.1.8.9 > 10.1.1.1.49153: Flags [.], ack 94901, win 65535, length 0
3.846105 Acknowledgment RA:00:00:00:00:00:02 
3.846459 IP 10.1.1.1.49153 > 10.1.1.8.9: Flags [.], seq 132861:134321, ack 1, win 65535, length 1460
3.847046 Acknowledgment RA:00:00:00:00:00:01 
3.848116 IP 10.1.1.8.9 > 10.1.1.1.49153: Flags [.], ack 97821, win 65535, length 0
3.848126 Acknowledgment RA:00:00:00:00:00:02 
3.848520 IP 10.1.1.1.49153 > 10.1.1.8.9: Flags [.], seq 134321:135781, ack 1, win 65535, length 1460
3.849106 Acknowledgment RA:00:00:00:00:00:01 
3.849336 IP 10.1.1.1.49153 > 10.1.1.8.9: Flags [.], seq 135781:137241, ack 1, win 65535, length 1460
3.850428 IP 10.1.1.1.49153 > 10.1.1.8.9: Flags [.], seq 135781:137241, ack 1, win 65535, length 1460
3.863222 Acknowledgment RA:00:00:00:00:00:01 
3.863512 IP 10.1.1.1.49153 > 10.1.1.8.9: Flags [.], seq 137241:138701, ack 1, win 65535, length 1460
3.864099 Acknowledgment RA:00:00:00:00:00:01 
3.864269 IP 10.1.1.1.49153 > 10.1.1.8.9: Flags [.], seq 138701:140161, ack 1, win 65535, length 1460
3.866256 Acknowledgment RA:00:00:00:00:00:05 
3.866346 IP 10.1.1.1.49153 > 10.1.1.8.9: Flags [.], seq 138701:140161, ack 1, win 65535, length 1460
3.879140 Acknowledgment RA:00:00:00:00:00:01 
3.879270 IP 10.1.1.1.49153 > 10.1.1.8.9: Flags [.], seq 140161:141621, ack 1, win 65535, length 1460
3.879857 Acknowledgment RA:00:00:00:00:00:01 
3.892407 IP 10.1.1.1.49153 > 10.1.1.8.9: Flags [.], seq 115341:116801, ack 1, win 65535, length 1460
