reading from file aufgabeEins-2-0.pcap, link-type IEEE802_11 (802.11)
0.001146 IP 10.1.1.1.654 > 10.1.1.255.654:  aodv rreq 24  hops 0 id 0x00000001
	dst 10.1.1.8 seq 0 src 10.1.1.1 seq 1
0.002092 IP 10.1.1.2.654 > 10.1.1.255.654:  aodv rreq 24  hops 1 id 0x00000001
	dst 10.1.1.8 seq 0 src 10.1.1.1 seq 1
0.002142 IP 10.1.1.3.654 > 10.1.1.255.654:  aodv rreq 24  hops 1 id 0x00000001
	dst 10.1.1.8 seq 0 src 10.1.1.1 seq 1
0.004931 IP 10.1.1.6.654 > 10.1.1.255.654:  aodv rreq 24  hops 4 id 0x00000001
	dst 10.1.1.8 seq 0 src 10.1.1.1 seq 1
0.005897 IP 10.1.1.4.654 > 10.1.1.255.654:  aodv rreq 24  hops 1 id 0x00000001
	dst 10.1.1.8 seq 0 src 10.1.1.1 seq 1
0.014864 IP 10.1.1.2.654 > 10.1.1.255.654:  aodv rrep 20  prefix 0 hops 0
	dst 10.1.1.2 dseq 0 src 10.1.1.2 2000 ms
0.022864 IP 10.1.1.4.654 > 10.1.1.255.654:  aodv rrep 20  prefix 0 hops 0
	dst 10.1.1.4 dseq 0 src 10.1.1.4 2000 ms
0.024864 IP 10.1.1.5.654 > 10.1.1.255.654:  aodv rrep 20  prefix 0 hops 0
	dst 10.1.1.5 dseq 0 src 10.1.1.5 2000 ms
0.053864 IP 10.1.1.1.654 > 10.1.1.255.654:  aodv rrep 20  prefix 0 hops 0
	dst 10.1.1.1 dseq 1 src 10.1.1.1 2000 ms
0.057000 IP 10.1.1.3.654 > 10.1.1.255.654:  aodv rrep 20  prefix 0 hops 0
	dst 10.1.1.3 dseq 0 src 10.1.1.3 2000 ms
0.075864 IP 10.1.1.6.654 > 10.1.1.255.654:  aodv rrep 20  prefix 0 hops 0
	dst 10.1.1.6 dseq 0 src 10.1.1.6 2000 ms
1.005381 ARP, Reply 10.1.1.5 is-at 00:00:00:00:00:05, length 32
1.007400 Acknowledgment RA:00:00:00:00:00:08 
1.008294 ARP, Request who-has 10.1.1.2 (ff:ff:ff:ff:ff:ff) tell 10.1.1.5, length 32
1.008419 ARP, Reply 10.1.1.2 is-at 00:00:00:00:00:02, length 32
1.009793 ARP, Reply 10.1.1.2 is-at 00:00:00:00:00:02, length 32
1.010107 Acknowledgment RA:00:00:00:00:00:02 
1.011497 IP 10.1.1.5.654 > 10.1.1.2.654:  aodv rrep 20  prefix 0 hops 1
	dst 10.1.1.8 dseq 0 src 10.1.1.1 11199 ms
1.011812 Acknowledgment RA:00:00:00:00:00:05 
1.012746 ARP, Request who-has 10.1.1.1 (ff:ff:ff:ff:ff:ff) tell 10.1.1.2, length 32
1.012918 Acknowledgment RA:00:00:00:00:00:01 
1.013214 IP 10.1.1.2.654 > 10.1.1.1.654:  aodv rrep 20  prefix 0 hops 2
	dst 10.1.1.8 dseq 0 src 10.1.1.1 11199 ms
1.014036 ARP, Request who-has 10.1.1.2 (ff:ff:ff:ff:ff:ff) tell 10.1.1.1, length 32
1.015190 IP 10.1.1.2.654 > 10.1.1.255.654:  aodv rrep 20  prefix 0 hops 0
	dst 10.1.1.2 dseq 0 src 10.1.1.2 2000 ms
1.016024 ARP, Reply 10.1.1.2 is-at 00:00:00:00:00:02, length 32
1.016339 Acknowledgment RA:00:00:00:00:00:02 
1.016499 Acknowledgment RA:00:00:00:00:00:01 
1.017333 ARP, Request who-has 10.1.1.5 (ff:ff:ff:ff:ff:ff) tell 10.1.1.2, length 32
1.017831 ARP, Reply 10.1.1.5 is-at 00:00:00:00:00:05, length 32
1.019405 ARP, Reply 10.1.1.5 is-at 00:00:00:00:00:05, length 32
1.019720 Acknowledgment RA:00:00:00:00:00:05 
1.020570 IP 10.1.1.1.49153 > 10.1.1.8.9: Flags [S], seq 0, win 65535, length 0
1.020884 Acknowledgment RA:00:00:00:00:00:02 
1.021798 ARP, Request who-has 10.1.1.8 (ff:ff:ff:ff:ff:ff) tell 10.1.1.5, length 32
1.022867 Acknowledgment RA:00:00:00:00:00:08 
1.023881 IP 10.1.1.4.654 > 10.1.1.255.654:  aodv rrep 20  prefix 0 hops 0
	dst 10.1.1.4 dseq 0 src 10.1.1.4 2000 ms
1.024812 IP 10.1.1.1.49153 > 10.1.1.8.9: Flags [S], seq 0, win 65535, length 0
1.026061 IP 10.1.1.5.654 > 10.1.1.255.654:  aodv rrep 20  prefix 0 hops 0
	dst 10.1.1.5 dseq 0 src 10.1.1.5 2000 ms
1.026962 Acknowledgment RA:00:00:00:00:00:08 
1.027812 IP 10.1.1.8.9 > 10.1.1.1.49153: Flags [S.], seq 0, ack 1, win 65535, length 0
1.028126 Acknowledgment RA:00:00:00:00:00:05 
1.028976 IP 10.1.1.8.9 > 10.1.1.1.49153: Flags [S.], seq 0, ack 1, win 65535, length 0
1.029290 Acknowledgment RA:00:00:00:00:00:02 
1.030140 IP 10.1.1.1.49153 > 10.1.1.8.9: Flags [.], ack 1, win 65535, length 0
1.030454 Acknowledgment RA:00:00:00:00:00:01 
1.031404 IP 10.1.1.1.49153 > 10.1.1.8.9: Flags [.], ack 1, win 65535, length 0
1.031719 Acknowledgment RA:00:00:00:00:00:02 
1.032385 IP 10.1.1.1.49153 > 10.1.1.8.9: Flags [.], ack 1, win 65535, length 0
1.044976 IP 10.1.1.1.49153 > 10.1.1.8.9: Flags [.], seq 1:1461, ack 1, win 65535, length 1460
1.045290 Acknowledgment RA:00:00:00:00:00:01 
1.057920 IP 10.1.1.1.49153 > 10.1.1.8.9: Flags [.], seq 1:1461, ack 1, win 65535, length 1460
1.058234 Acknowledgment RA:00:00:00:00:00:02 
1.058284 IP 10.1.1.3.654 > 10.1.1.255.654:  aodv rrep 20  prefix 0 hops 0
	dst 10.1.1.3 dseq 0 src 10.1.1.3 2000 ms
1.060103 IP 10.1.1.1.654 > 10.1.1.255.654:  aodv rrep 20  prefix 0 hops 0
	dst 10.1.1.1 dseq 1 src 10.1.1.1 2000 ms
1.072754 IP 10.1.1.1.49153 > 10.1.1.8.9: Flags [.], seq 1:1461, ack 1, win 65535, length 1460
1.074233 Acknowledgment RA:00:00:00:00:00:08 
1.075163 IP 10.1.1.8.9 > 10.1.1.1.49153: Flags [.], ack 1461, win 65535, length 0
1.075477 Acknowledgment RA:00:00:00:00:00:05 
1.076327 IP 10.1.1.8.9 > 10.1.1.1.49153: Flags [.], ack 1461, win 65535, length 0
1.076641 Acknowledgment RA:00:00:00:00:00:02 
1.089171 IP 10.1.1.1.49153 > 10.1.1.8.9: Flags [.], seq 1461:2921, ack 1, win 65535, length 1460
1.089485 Acknowledgment RA:00:00:00:00:00:01 
1.102056 IP 10.1.1.1.49153 > 10.1.1.8.9: Flags [.], seq 2921:4381, ack 1, win 65535, length 1460
1.102370 Acknowledgment RA:00:00:00:00:00:01 
1.108996 IP 10.1.1.1.49153 > 10.1.1.8.9: Flags [.], seq 1461:2921, ack 1, win 65535, length 1460
1.110540 IP 10.1.1.1.49153 > 10.1.1.8.9: Flags [.], seq 1461:2921, ack 1, win 65535, length 1460
1.112104 IP 10.1.1.1.49153 > 10.1.1.8.9: Flags [.], seq 1461:2921, ack 1, win 65535, length 1460
1.126474 IP 10.1.1.1.49153 > 10.1.1.8.9: Flags [.], seq 1461:2921, ack 1, win 65535, length 1460
1.126788 Acknowledgment RA:00:00:00:00:00:02 
1.133174 IP 10.1.1.1.49153 > 10.1.1.8.9: Flags [.], seq 1461:2921, ack 1, win 65535, length 1460
1.134853 IP 10.1.1.1.49153 > 10.1.1.8.9: Flags [.], seq 2921:4381, ack 1, win 65535, length 1460
1.147743 IP 10.1.1.1.49153 > 10.1.1.8.9: Flags [.], seq 2921:4381, ack 1, win 65535, length 1460
1.148057 Acknowledgment RA:00:00:00:00:00:02 
1.160707 IP 10.1.1.1.49153 > 10.1.1.8.9: Flags [.], seq 1461:2921, ack 1, win 65535, length 1460
1.167408 IP 10.1.1.1.49153 > 10.1.1.8.9: Flags [.], seq 2921:4381, ack 1, win 65535, length 1460
1.180358 IP 10.1.1.1.49153 > 10.1.1.8.9: Flags [.], seq 2921:4381, ack 1, win 65535, length 1460
1.181533 Acknowledgment RA:00:00:00:00:00:08 
1.182563 IP 10.1.1.8.9 > 10.1.1.1.49153: Flags [.], ack 4381, win 65535, length 0
1.182878 Acknowledgment RA:00:00:00:00:00:05 
1.183424 IP 10.1.1.8.9 > 10.1.1.1.49153: Flags [.], ack 4381, win 65535, length 0
1.183738 Acknowledgment RA:00:00:00:00:00:02 
1.184546 Acknowledgment RA:00:00:00:00:00:01 
1.185414 Acknowledgment RA:00:00:00:00:00:01 
1.186758 IP 10.1.1.1.49153 > 10.1.1.8.9: Flags [.], seq 4381:5841, ack 1, win 65535, length 1460
1.187675 Acknowledgment RA:00:00:00:00:00:01 
1.200305 IP 10.1.1.1.49153 > 10.1.1.8.9: Flags [.], seq 4381:5841, ack 1, win 65535, length 1460
1.200619 Acknowledgment RA:00:00:00:00:00:02 
1.201864 IP 10.1.1.1.49153 > 10.1.1.8.9: Flags [.], seq 5841:7301, ack 1, win 65535, length 1460
1.208644 IP 10.1.1.1.49153 > 10.1.1.8.9: Flags [.], seq 4381:5841, ack 1, win 65535, length 1460
1.221589 IP 10.1.1.1.49153 > 10.1.1.8.9: Flags [.], seq 5841:7301, ack 1, win 65535, length 1460
1.221903 Acknowledgment RA:00:00:00:00:00:02 
1.241314 IP 10.1.1.1.49153 > 10.1.1.8.9: Flags [.], seq 5841:7301, ack 1, win 65535, length 1460
1.254219 IP 10.1.1.1.49153 > 10.1.1.8.9: Flags [.], seq 7301:8761, ack 1, win 65535, length 1460
1.254533 Acknowledgment RA:00:00:00:00:00:02 
1.267503 IP 10.1.1.1.49153 > 10.1.1.8.9: Flags [.], seq 5841:7301, ack 1, win 65535, length 1460
1.269908 Acknowledgment RA:00:00:00:00:00:08 
1.282638 IP 10.1.1.1.49153 > 10.1.1.8.9: Flags [.], seq 7301:8761, ack 1, win 65535, length 1460
1.283883 IP 10.1.1.8.9 > 10.1.1.1.49153: Flags [.], ack 7301, win 65535, length 0
1.284198 Acknowledgment RA:00:00:00:00:00:05 
1.285048 IP 10.1.1.8.9 > 10.1.1.1.49153: Flags [.], ack 7301, win 65535, length 0
1.285362 Acknowledgment RA:00:00:00:00:00:02 
1.286170 Acknowledgment RA:00:00:00:00:00:01 
1.287018 Acknowledgment RA:00:00:00:00:00:01 
1.287867 Acknowledgment RA:00:00:00:00:00:01 
1.294373 IP 10.1.1.1.49153 > 10.1.1.8.9: Flags [.], seq 8761:10221, ack 1, win 65535, length 1460
1.307343 IP 10.1.1.1.49153 > 10.1.1.8.9: Flags [.], seq 8761:10221, ack 1, win 65535, length 1460
1.307657 Acknowledgment RA:00:00:00:00:00:02 
1.320327 IP 10.1.1.1.49153 > 10.1.1.8.9: Flags [.], seq 8761:10221, ack 1, win 65535, length 1460
1.327108 IP 10.1.1.1.49153 > 10.1.1.8.9: Flags [.], seq 10221:11681, ack 1, win 65535, length 1460
1.328098 IP 10.1.1.8.9 > 10.1.1.1.49153: Flags [.], ack 10221, win 65535, length 0
1.328413 Acknowledgment RA:00:00:00:00:00:05 
1.341223 IP 10.1.1.1.49153 > 10.1.1.8.9: Flags [.], seq 10221:11681, ack 1, win 65535, length 1460
1.341537 Acknowledgment RA:00:00:00:00:00:02 
1.345789 IP 10.1.1.1.49153 > 10.1.1.8.9: Flags [.], seq 11681:13141, ack 1, win 65535, length 1460
1.359079 IP 10.1.1.1.49153 > 10.1.1.8.9: Flags [.], seq 11681:13141, ack 1, win 65535, length 1460
1.359393 Acknowledgment RA:00:00:00:00:00:02 
1.371943 IP 10.1.1.1.49153 > 10.1.1.8.9: Flags [.], seq 10221:11681, ack 1, win 65535, length 1460
1.373148 IP 10.1.1.8.9 > 10.1.1.1.49153: Flags [.], ack 10221, win 65535, length 0
1.373462 Acknowledgment RA:00:00:00:00:00:02 
1.374270 Acknowledgment RA:00:00:00:00:00:01 
1.375078 Acknowledgment RA:00:00:00:00:00:01 
1.387668 IP 10.1.1.1.49153 > 10.1.1.8.9: Flags [.], seq 13141:14601, ack 1, win 65535, length 1460
1.387983 Acknowledgment RA:00:00:00:00:00:02 
1.388912 Acknowledgment RA:00:00:00:00:00:01 
1.401482 IP 10.1.1.1.49153 > 10.1.1.8.9: Flags [.], seq 14601:16061, ack 1, win 65535, length 1460
1.401796 Acknowledgment RA:00:00:00:00:00:02 
1.414346 IP 10.1.1.1.49153 > 10.1.1.8.9: Flags [.], seq 11681:13141, ack 1, win 65535, length 1460
1.427211 IP 10.1.1.1.49153 > 10.1.1.8.9: Flags [.], seq 16061:17521, ack 1, win 65535, length 1460
1.439861 IP 10.1.1.1.49153 > 10.1.1.8.9: Flags [.], seq 13141:14601, ack 1, win 65535, length 1460
1.452806 IP 10.1.1.1.49153 > 10.1.1.8.9: Flags [.], seq 14601:16061, ack 1, win 65535, length 1460
1.465771 IP 10.1.1.1.49153 > 10.1.1.8.9: Flags [.], seq 16061:17521, ack 1, win 65535, length 1460
1.466801 IP 10.1.1.8.9 > 10.1.1.1.49153: Flags [.], ack 13141, win 65535, length 0
1.467116 Acknowledgment RA:00:00:00:00:00:05 
1.468186 IP 10.1.1.8.9 > 10.1.1.1.49153: Flags [.], ack 16061, win 65535, length 0
1.468501 Acknowledgment RA:00:00:00:00:00:05 
1.482051 IP 10.1.1.1.49153 > 10.1.1.8.9: Flags [.], seq 16061:17521, ack 1, win 65535, length 1460
1.482365 Acknowledgment RA:00:00:00:00:00:02 
1.494895 IP 10.1.1.1.49153 > 10.1.1.8.9: Flags [.], seq 16061:17521, ack 1, win 65535, length 1460
1.496200 IP 10.1.1.8.9 > 10.1.1.1.49153: Flags [.], ack 13141, win 65535, length 0
1.496514 Acknowledgment RA:00:00:00:00:00:02 
1.497322 Acknowledgment RA:00:00:00:00:00:01 
1.498170 Acknowledgment RA:00:00:00:00:00:01 
1.499080 IP 10.1.1.8.9 > 10.1.1.1.49153: Flags [.], ack 16061, win 65535, length 0
1.499395 Acknowledgment RA:00:00:00:00:00:02 
1.500263 Acknowledgment RA:00:00:00:00:00:01 
1.512973 IP 10.1.1.1.49153 > 10.1.1.8.9: Flags [.], seq 17521:18981, ack 1, win 65535, length 1460
1.513287 Acknowledgment RA:00:00:00:00:00:02 
1.525817 IP 10.1.1.1.49153 > 10.1.1.8.9: Flags [.], seq 17521:18981, ack 1, win 65535, length 1460
1.526706 Acknowledgment RA:00:00:00:00:00:01 
1.527714 Acknowledgment RA:00:00:00:00:00:01 
1.540344 IP 10.1.1.1.49153 > 10.1.1.8.9: Flags [.], seq 18981:20441, ack 1, win 65535, length 1460
1.540659 Acknowledgment RA:00:00:00:00:00:02 
1.553289 IP 10.1.1.1.49153 > 10.1.1.8.9: Flags [.], seq 20441:21901, ack 1, win 65535, length 1460
1.553604 Acknowledgment RA:00:00:00:00:00:02 
1.566214 IP 10.1.1.1.49153 > 10.1.1.8.9: Flags [.], seq 21901:23361, ack 1, win 65535, length 1460
1.566529 Acknowledgment RA:00:00:00:00:00:02 
1.567398 Acknowledgment RA:00:00:00:00:00:01 
1.580168 IP 10.1.1.1.49153 > 10.1.1.8.9: Flags [.], seq 23361:24821, ack 1, win 65535, length 1460
1.580482 Acknowledgment RA:00:00:00:00:00:02 
1.593013 IP 10.1.1.1.49153 > 10.1.1.8.9: Flags [.], seq 24821:26281, ack 1, win 65535, length 1460
1.593327 Acknowledgment RA:00:00:00:00:00:02 
1.594237 IP 10.1.1.8.9 > 10.1.1.1.49153: Flags [.], ack 18981, win 65535, length 0
1.594552 Acknowledgment RA:00:00:00:00:00:05 
1.595462 IP 10.1.1.8.9 > 10.1.1.1.49153: Flags [.], ack 18981, win 65535, length 0
1.595776 Acknowledgment RA:00:00:00:00:00:02 
1.596584 Acknowledgment RA:00:00:00:00:00:01 
1.597452 Acknowledgment RA:00:00:00:00:00:01 
1.598341 Acknowledgment RA:00:00:00:00:00:01 
1.610891 IP 10.1.1.1.49153 > 10.1.1.8.9: Flags [.], seq 26281:27741, ack 1, win 65535, length 1460
1.611205 Acknowledgment RA:00:00:00:00:00:02 
1.623736 IP 10.1.1.1.49153 > 10.1.1.8.9: Flags [.], seq 27741:29201, ack 1, win 65535, length 1460
1.624050 Acknowledgment RA:00:00:00:00:00:02 
1.636680 IP 10.1.1.1.49153 > 10.1.1.8.9: Flags [.], seq 18981:20441, ack 1, win 65535, length 1460
1.649685 IP 10.1.1.1.49153 > 10.1.1.8.9: Flags [.], seq 20441:21901, ack 1, win 65535, length 1460
1.651380 IP 10.1.1.1.49153 > 10.1.1.8.9: Flags [.], seq 29201:30661, ack 1, win 65535, length 1460
1.664190 IP 10.1.1.1.49153 > 10.1.1.8.9: Flags [.], seq 21901:23361, ack 1, win 65535, length 1460
1.677215 IP 10.1.1.1.49153 > 10.1.1.8.9: Flags [.], seq 29201:30661, ack 1, win 65535, length 1460
1.677529 Acknowledgment RA:00:00:00:00:00:02 
1.690099 IP 10.1.1.1.49153 > 10.1.1.8.9: Flags [.], seq 23361:24821, ack 1, win 65535, length 1460
1.691578 Acknowledgment RA:00:00:00:00:00:08 
1.705628 IP 10.1.1.1.49153 > 10.1.1.8.9: Flags [.], seq 24821:26281, ack 1, win 65535, length 1460
1.718573 IP 10.1.1.1.49153 > 10.1.1.8.9: Flags [.], seq 26281:27741, ack 1, win 65535, length 1460
1.720052 Acknowledgment RA:00:00:00:00:00:08 
1.732642 IP 10.1.1.1.49153 > 10.1.1.8.9: Flags [.], seq 27741:29201, ack 1, win 65535, length 1460
1.733415 IP 10.1.1.8.9 > 10.1.1.1.49153: Flags [.], ack 21901, win 65535, length 0
1.734945 IP 10.1.1.8.9 > 10.1.1.1.49153: Flags [.], ack 21901, win 65535, length 0
1.735260 Acknowledgment RA:00:00:00:00:00:05 
1.735613 IP 10.1.1.8.9 > 10.1.1.1.49153: Flags [.], ack 21901, win 65535, length 0
1.735927 Acknowledgment RA:00:00:00:00:00:02 
1.736735 Acknowledgment RA:00:00:00:00:00:01 
1.749345 IP 10.1.1.1.49153 > 10.1.1.8.9: Flags [.], seq 30661:32121, ack 1, win 65535, length 1460
1.749660 Acknowledgment RA:00:00:00:00:00:02 
1.750568 Acknowledgment RA:00:00:00:00:00:01 
1.763198 IP 10.1.1.1.49153 > 10.1.1.8.9: Flags [.], seq 32121:33581, ack 1, win 65535, length 1460
1.763513 Acknowledgment RA:00:00:00:00:00:02 
1.764422 Acknowledgment RA:00:00:00:00:00:01 
1.777092 IP 10.1.1.1.49153 > 10.1.1.8.9: Flags [.], seq 33581:35041, ack 1, win 65535, length 1460
1.777406 Acknowledgment RA:00:00:00:00:00:02 
1.790016 IP 10.1.1.1.49153 > 10.1.1.8.9: Flags [.], seq 29201:30661, ack 1, win 65535, length 1460
1.791495 Acknowledgment RA:00:00:00:00:00:08 
1.792385 IP 10.1.1.8.9 > 10.1.1.1.49153: Flags [.], ack 24821, win 65535, length 0
1.792700 Acknowledgment RA:00:00:00:00:00:05 
1.793550 IP 10.1.1.8.9 > 10.1.1.1.49153: Flags [.], ack 24821, win 65535, length 0
1.793864 Acknowledgment RA:00:00:00:00:00:02 
1.794672 Acknowledgment RA:00:00:00:00:00:01 
1.797349 IP 10.1.1.1.49153 > 10.1.1.8.9: Flags [.], seq 35041:36501, ack 1, win 65535, length 1460
1.798339 Acknowledgment RA:00:00:00:00:00:01 
1.799408 Acknowledgment RA:00:00:00:00:00:01 
1.811958 IP 10.1.1.1.49153 > 10.1.1.8.9: Flags [.], seq 35041:36501, ack 1, win 65535, length 1460
1.812272 Acknowledgment RA:00:00:00:00:00:02 
1.813302 IP 10.1.1.8.9 > 10.1.1.1.49153: Flags [.], ack 27741, win 65535, length 0
1.813617 Acknowledgment RA:00:00:00:00:00:05 
1.816114 IP 10.1.1.1.49153 > 10.1.1.8.9: Flags [.], seq 36501:37961, ack 1, win 65535, length 1460
1.829124 IP 10.1.1.1.49153 > 10.1.1.8.9: Flags [.], seq 36501:37961, ack 1, win 65535, length 1460
1.829438 Acknowledgment RA:00:00:00:00:00:02 
1.831996 IP 10.1.1.1.49153 > 10.1.1.8.9: Flags [.], seq 37961:39421, ack 1, win 65535, length 1460
1.844880 IP 10.1.1.1.49153 > 10.1.1.8.9: Flags [.], seq 30661:32121, ack 1, win 65535, length 1460
1.857725 IP 10.1.1.1.49153 > 10.1.1.8.9: Flags [.], seq 32121:33581, ack 1, win 65535, length 1460
1.870750 IP 10.1.1.1.49153 > 10.1.1.8.9: Flags [.], seq 37961:39421, ack 1, win 65535, length 1460
1.871064 Acknowledgment RA:00:00:00:00:00:02 
1.871935 IP 10.1.1.8.9 > 10.1.1.1.49153: Flags [.], ack 27741, win 65535, length 0
1.872249 Acknowledgment RA:00:00:00:00:00:02 
1.872885 Acknowledgment RA:00:00:00:00:00:01 
1.875033 IP 10.1.1.1.49153 > 10.1.1.8.9: Flags [.], seq 39421:40881, ack 1, win 65535, length 1460
1.875909 Acknowledgment RA:00:00:00:00:00:01 
1.876606 Acknowledgment RA:00:00:00:00:00:01 
1.879103 IP 10.1.1.1.49153 > 10.1.1.8.9: Flags [.], seq 39421:40881, ack 1, win 65535, length 1460
1.892147 IP 10.1.1.1.49153 > 10.1.1.8.9: Flags [.], seq 33581:35041, ack 1, win 65535, length 1460
1.893612 IP 10.1.1.8.9 > 10.1.1.1.49153: Flags [.], ack 30661, win 65535, length 0
1.893927 Acknowledgment RA:00:00:00:00:00:05 
1.906757 IP 10.1.1.1.49153 > 10.1.1.8.9: Flags [.], seq 35041:36501, ack 1, win 65535, length 1460
1.919762 IP 10.1.1.1.49153 > 10.1.1.8.9: Flags [.], seq 36501:37961, ack 1, win 65535, length 1460
1.932607 IP 10.1.1.1.49153 > 10.1.1.8.9: Flags [.], seq 37961:39421, ack 1, win 65535, length 1460
1.935559 IP 10.1.1.1.49153 > 10.1.1.8.9: Flags [.], seq 39421:40881, ack 1, win 65535, length 1460
1.950469 IP 10.1.1.1.49153 > 10.1.1.8.9: Flags [.], seq 39421:40881, ack 1, win 65535, length 1460
1.950783 Acknowledgment RA:00:00:00:00:00:02 
1.965252 IP 10.1.1.1.49153 > 10.1.1.8.9: Flags [.], seq 40881:42341, ack 1, win 65535, length 1460
1.978142 IP 10.1.1.1.49153 > 10.1.1.8.9: Flags [.], seq 39421:40881, ack 1, win 65535, length 1460
1.979387 IP 10.1.1.8.9 > 10.1.1.1.49153: Flags [.], ack 36501, win 65535, length 0
1.979702 Acknowledgment RA:00:00:00:00:00:05 
1.992292 IP 10.1.1.1.49153 > 10.1.1.8.9: Flags [.], seq 40881:42341, ack 1, win 65535, length 1460
1.992606 Acknowledgment RA:00:00:00:00:00:02 
2.005297 IP 10.1.1.1.49153 > 10.1.1.8.9: Flags [.], seq 42341:43801, ack 1, win 65535, length 1460
2.005611 Acknowledgment RA:00:00:00:00:00:02 
2.006541 IP 10.1.1.8.9 > 10.1.1.1.49153: Flags [.], ack 39421, win 65535, length 0
2.006856 Acknowledgment RA:00:00:00:00:00:05 
2.007826 IP 10.1.1.8.9 > 10.1.1.1.49153: Flags [.], ack 30661, win 65535, length 0
2.008140 Acknowledgment RA:00:00:00:00:00:02 
2.008776 Acknowledgment RA:00:00:00:00:00:01 
2.009472 Acknowledgment RA:00:00:00:00:00:01 
2.010209 Acknowledgment RA:00:00:00:00:00:01 
2.011099 IP 10.1.1.8.9 > 10.1.1.1.49153: Flags [.], ack 36501, win 65535, length 0
2.011413 Acknowledgment RA:00:00:00:00:00:02 
2.012049 Acknowledgment RA:00:00:00:00:00:01 
2.013019 IP 10.1.1.8.9 > 10.1.1.1.49153: Flags [.], ack 39421, win 65535, length 0
2.013333 Acknowledgment RA:00:00:00:00:00:02 
2.013989 Acknowledgment RA:00:00:00:00:00:01 
2.014746 Acknowledgment RA:00:00:00:00:00:01 
2.027376 IP 10.1.1.1.49153 > 10.1.1.8.9: Flags [.], seq 43801:45261, ack 1, win 65535, length 1460
2.027690 Acknowledgment RA:00:00:00:00:00:02 
2.040280 IP 10.1.1.1.49153 > 10.1.1.8.9: Flags [.], seq 40881:42341, ack 1, win 65535, length 1460
2.041037 Acknowledgment RA:00:00:00:00:00:01 
2.041693 Acknowledgment RA:00:00:00:00:00:01 
2.054383 IP 10.1.1.1.49153 > 10.1.1.8.9: Flags [.], seq 45261:46721, ack 1, win 65535, length 1460
2.056484 IP 10.1.1.4.654 > 10.1.1.255.654:  aodv rrep 20  prefix 0 hops 0
	dst 10.1.1.4 dseq 0 src 10.1.1.4 2000 ms
2.069095 IP 10.1.1.1.49153 > 10.1.1.8.9: Flags [.], seq 55481:56941, ack 1, win 65535, length 1460
2.069409 Acknowledgment RA:00:00:00:00:00:01 
2.069499 IP 10.1.1.3.654 > 10.1.1.255.654:  aodv rrep 20  prefix 0 hops 0
	dst 10.1.1.3 dseq 0 src 10.1.1.3 2000 ms
2.083586 IP 10.1.1.1.49153 > 10.1.1.8.9: Flags [.], seq 42341:43801, ack 1, win 65535, length 1460
2.096437 IP 10.1.1.1.49153 > 10.1.1.8.9: Flags [.], seq 56941:58401, ack 1, win 65535, length 1460
2.096751 Acknowledgment RA:00:00:00:00:00:01 
2.097865 IP 10.1.1.5.654 > 10.1.1.255.654:  aodv rrep 20  prefix 0 hops 0
	dst 10.1.1.5 dseq 0 src 10.1.1.5 2000 ms
2.111466 Acknowledgment RA:00:00:00:00:00:01 
2.112520 IP 10.1.1.1.654 > 10.1.1.255.654:  aodv rrep 20  prefix 0 hops 0
	dst 10.1.1.1 dseq 1 src 10.1.1.1 2000 ms
2.113455 IP 10.1.1.5.654 > 10.1.1.8.654:  aodv rrep 20  prefix 0 hops 2
	dst 10.1.1.1 dseq 1 src 10.1.1.8 3400 ms
2.114744 IP 10.1.1.5.654 > 10.1.1.2.654:  aodv rrep 20  prefix 0 hops 1
	dst 10.1.1.8 dseq 1 src 10.1.1.1 5519 ms
2.115058 Acknowledgment RA:00:00:00:00:00:05 
2.116477 ARP, Reply 10.1.1.5 is-at 00:00:00:00:00:05, length 32
2.129801 IP 10.1.1.1.49153 > 10.1.1.8.9: Flags [.], seq 45261:46721, ack 1, win 65535, length 1460
2.131012 Acknowledgment RA:00:00:00:00:00:07 
2.143782 IP 10.1.1.1.49153 > 10.1.1.8.9: Flags [.], seq 45261:46721, ack 1, win 65535, length 1460
2.144797 IP 10.1.1.5.654 > 10.1.1.2.654:  aodv rrep 20  prefix 0 hops 2
	dst 10.1.1.8 dseq 1 src 10.1.1.1 5519 ms
2.145111 Acknowledgment RA:00:00:00:00:00:05 
2.146202 IP 10.1.1.8.9 > 10.1.1.1.49153: Flags [.], ack 42341, win 65535, length 0
2.146516 Acknowledgment RA:00:00:00:00:00:05 
2.147731 IP 10.1.1.5.654 > 10.1.1.2.654:  aodv rrep 20  prefix 0 hops 3
	dst 10.1.1.8 dseq 1 src 10.1.1.1 5519 ms
2.148045 Acknowledgment RA:00:00:00:00:00:05 
2.161135 IP 10.1.1.1.49153 > 10.1.1.8.9: Flags [.], seq 45261:46721, ack 1, win 65535, length 1460
2.161450 Acknowledgment RA:00:00:00:00:00:02 
2.173980 IP 10.1.1.1.49153 > 10.1.1.8.9: Flags [.], seq 45261:46721, ack 1, win 65535, length 1460
2.186884 IP 10.1.1.1.49153 > 10.1.1.8.9: Flags [.], seq 46721:48181, ack 1, win 65535, length 1460
2.187199 Acknowledgment RA:00:00:00:00:00:02 
2.199809 IP 10.1.1.1.49153 > 10.1.1.8.9: Flags [.], seq 46721:48181, ack 1, win 65535, length 1460
2.212773 IP 10.1.1.1.49153 > 10.1.1.8.9: Flags [.], seq 48181:49641, ack 1, win 65535, length 1460
2.213088 Acknowledgment RA:00:00:00:00:00:02 
2.215626 IP 10.1.1.1.49153 > 10.1.1.8.9: Flags [.], seq 49641:51101, ack 1, win 65535, length 1460
2.228676 IP 10.1.1.1.49153 > 10.1.1.8.9: Flags [.], seq 49641:51101, ack 1, win 65535, length 1460
2.228991 Acknowledgment RA:00:00:00:00:00:02 
2.241541 IP 10.1.1.1.49153 > 10.1.1.8.9: Flags [.], seq 48181:49641, ack 1, win 65535, length 1460
2.254526 IP 10.1.1.1.49153 > 10.1.1.8.9: Flags [.], seq 49641:51101, ack 1, win 65535, length 1460
2.267430 IP 10.1.1.1.49153 > 10.1.1.8.9: Flags [.], seq 51101:52561, ack 1, win 65535, length 1460
2.267745 Acknowledgment RA:00:00:00:00:00:02 
2.280275 IP 10.1.1.1.49153 > 10.1.1.8.9: Flags [.], seq 51101:52561, ack 1, win 65535, length 1460
2.293359 IP 10.1.1.1.49153 > 10.1.1.8.9: Flags [.], seq 52561:54021, ack 1, win 65535, length 1460
2.293674 Acknowledgment RA:00:00:00:00:00:02 
2.319534 IP 10.1.1.1.49153 > 10.1.1.8.9: Flags [.], seq 54021:55481, ack 1, win 65535, length 1460
2.320649 IP 10.1.1.8.9 > 10.1.1.1.49153: Flags [.], ack 51101, win 65535, length 0
2.320963 Acknowledgment RA:00:00:00:00:00:05 
2.321978 IP 10.1.1.5.654 > 10.1.1.8.654:  aodv rrep 20  prefix 0 hops 2
	dst 10.1.1.1 dseq 1 src 10.1.1.8 3133 ms
2.323551 IP 10.1.1.6.654 > 10.1.1.8.654:  aodv rrep 20  prefix 0 hops 4
	dst 10.1.1.1 dseq 1 src 10.1.1.8 2974 ms
2.336622 IP 10.1.1.1.49153 > 10.1.1.8.9: Flags [.], seq 54021:55481, ack 1, win 65535, length 1460
2.336936 Acknowledgment RA:00:00:00:00:00:02 
2.337870 IP 10.1.1.5.654 > 10.1.1.2.654:  aodv rrep 20  prefix 0 hops 1
	dst 10.1.1.8 dseq 2 src 10.1.1.1 5519 ms
2.338185 Acknowledgment RA:00:00:00:00:00:05 
2.339119 IP 10.1.1.5.654 > 10.1.1.2.654:  aodv rrep 20  prefix 0 hops 2
	dst 10.1.1.8 dseq 2 src 10.1.1.1 5519 ms
2.339434 Acknowledgment RA:00:00:00:00:00:05 
2.340369 IP 10.1.1.6.654 > 10.1.1.7.654:  aodv rrep 20  prefix 0 hops 1
	dst 10.1.1.8 dseq 2 src 10.1.1.1 5519 ms
2.353039 IP 10.1.1.1.49153 > 10.1.1.8.9: Flags [.], seq 55481:56941, ack 1, win 65535, length 1460
2.354070 IP 10.1.1.8.9 > 10.1.1.1.49153: Flags [.], ack 54021, win 65535, length 0
2.354384 Acknowledgment RA:00:00:00:00:00:05 
2.366995 IP 10.1.1.1.49153 > 10.1.1.8.9: Flags [.], seq 54021:55481, ack 1, win 65535, length 1460
2.368384 IP 10.1.1.5.654 > 10.1.1.2.654:  aodv rrep 20  prefix 0 hops 3
	dst 10.1.1.8 dseq 2 src 10.1.1.1 5519 ms
2.368698 Acknowledgment RA:00:00:00:00:00:05 
2.381548 IP 10.1.1.1.49153 > 10.1.1.8.9: Flags [.], seq 55481:56941, ack 1, win 65535, length 1460
2.381863 Acknowledgment RA:00:00:00:00:00:02 
2.394393 IP 10.1.1.1.49153 > 10.1.1.8.9: Flags [.], seq 55481:56941, ack 1, win 65535, length 1460
2.407297 IP 10.1.1.1.49153 > 10.1.1.8.9: Flags [.], seq 56941:58401, ack 1, win 65535, length 1460
2.408208 IP 10.1.1.8.9 > 10.1.1.1.49153: Flags [.], ack 56941, win 65535, length 0
2.408522 Acknowledgment RA:00:00:00:00:00:05 
2.421612 IP 10.1.1.1.49153 > 10.1.1.8.9: Flags [.], seq 56941:58401, ack 1, win 65535, length 1460
2.421927 Acknowledgment RA:00:00:00:00:00:02 
2.434457 IP 10.1.1.1.49153 > 10.1.1.8.9: Flags [.], seq 56941:58401, ack 1, win 65535, length 1460
2.447601 IP 10.1.1.1.49153 > 10.1.1.8.9: Flags [.], seq 58401:59861, ack 1, win 65535, length 1460
2.447916 Acknowledgment RA:00:00:00:00:00:02 
2.460446 IP 10.1.1.1.49153 > 10.1.1.8.9: Flags [.], seq 58401:59861, ack 1, win 65535, length 1460
2.461774 IP 10.1.1.2.654 > 10.1.1.1.654:  aodv rrep 20  prefix 0 hops 2
	dst 10.1.1.8 dseq 1 src 10.1.1.1 5519 ms
2.462088 Acknowledgment RA:00:00:00:00:00:02 
2.463159 IP 10.1.1.8.9 > 10.1.1.1.49153: Flags [.], ack 59861, win 65535, length 0
2.463473 Acknowledgment RA:00:00:00:00:00:05 
2.464427 IP 10.1.1.2.654 > 10.1.1.1.654:  aodv rrep 20  prefix 0 hops 3
	dst 10.1.1.8 dseq 1 src 10.1.1.1 5519 ms
2.464742 Acknowledgment RA:00:00:00:00:00:02 
2.465832 IP 10.1.1.8.9 > 10.1.1.1.49153: Flags [.], ack 42341, win 65535, length 0
2.466146 Acknowledgment RA:00:00:00:00:00:02 
2.466782 Acknowledgment RA:00:00:00:00:00:01 
2.467458 Acknowledgment RA:00:00:00:00:00:01 
2.469287 IP 10.1.1.2.654 > 10.1.1.1.654:  aodv rrep 20  prefix 0 hops 4
	dst 10.1.1.8 dseq 1 src 10.1.1.1 5519 ms
2.469601 Acknowledgment RA:00:00:00:00:00:02 
2.469939 IP 10.1.1.8.9 > 10.1.1.1.49153: Flags [.], ack 51101, win 65535, length 0
2.470253 Acknowledgment RA:00:00:00:00:00:02 
2.471247 IP 10.1.1.2.654 > 10.1.1.1.654:  aodv rrep 20  prefix 0 hops 2
	dst 10.1.1.8 dseq 2 src 10.1.1.1 5519 ms
2.471562 Acknowledgment RA:00:00:00:00:00:02 
2.472536 IP 10.1.1.2.654 > 10.1.1.1.654:  aodv rrep 20  prefix 0 hops 3
	dst 10.1.1.8 dseq 2 src 10.1.1.1 5519 ms
2.472850 Acknowledgment RA:00:00:00:00:00:02 
2.473900 IP 10.1.1.8.9 > 10.1.1.1.49153: Flags [.], ack 54021, win 65535, length 0
2.474214 Acknowledgment RA:00:00:00:00:00:02 
2.475168 IP 10.1.1.2.654 > 10.1.1.1.654:  aodv rrep 20  prefix 0 hops 4
	dst 10.1.1.8 dseq 2 src 10.1.1.1 5519 ms
2.475483 Acknowledgment RA:00:00:00:00:00:02 
2.476513 IP 10.1.1.8.9 > 10.1.1.1.49153: Flags [.], ack 56941, win 65535, length 0
2.477723 IP 10.1.1.8.9 > 10.1.1.1.49153: Flags [.], ack 56941, win 65535, length 0
2.478037 Acknowledgment RA:00:00:00:00:00:02 
2.479047 IP 10.1.1.8.9 > 10.1.1.1.49153: Flags [.], ack 59861, win 65535, length 0
2.479361 Acknowledgment RA:00:00:00:00:00:02 
2.480901 IP 10.1.1.1.49153 > 10.1.1.8.9: Flags [.], seq 59861:61321, ack 1, win 65535, length 1460
2.494071 IP 10.1.1.1.49153 > 10.1.1.8.9: Flags [.], seq 59861:61321, ack 1, win 65535, length 1460
2.494386 Acknowledgment RA:00:00:00:00:00:02 
2.495679 Acknowledgment RA:00:00:00:00:00:01 
2.496375 Acknowledgment RA:00:00:00:00:00:01 
2.497795 IP 10.1.1.1.49153 > 10.1.1.8.9: Flags [.], seq 61321:62781, ack 1, win 65535, length 1460
2.510660 IP 10.1.1.1.49153 > 10.1.1.8.9: Flags [.], seq 59861:61321, ack 1, win 65535, length 1460
2.511456 Acknowledgment RA:00:00:00:00:00:01 
2.512233 Acknowledgment RA:00:00:00:00:00:01 
2.524843 IP 10.1.1.1.49153 > 10.1.1.8.9: Flags [.], seq 61321:62781, ack 1, win 65535, length 1460
2.525157 Acknowledgment RA:00:00:00:00:00:02 
2.525854 Acknowledgment RA:00:00:00:00:00:01 
2.526654 IP 10.1.1.1.49153 > 10.1.1.8.9: Flags [.], seq 62781:64241, ack 1, win 65535, length 1460
2.527598 Acknowledgment RA:00:00:00:00:00:01 
2.528375 Acknowledgment RA:00:00:00:00:00:01 
2.529151 Acknowledgment RA:00:00:00:00:00:01 
2.530631 IP 10.1.1.1.49153 > 10.1.1.8.9: Flags [.], seq 62781:64241, ack 1, win 65535, length 1460
2.531641 Acknowledgment RA:00:00:00:00:00:01 
2.532298 Acknowledgment RA:00:00:00:00:00:01 
2.533054 Acknowledgment RA:00:00:00:00:00:01 
2.533970 Acknowledgment RA:00:00:00:00:00:01 
2.534767 Acknowledgment RA:00:00:00:00:00:01 
2.535563 Acknowledgment RA:00:00:00:00:00:01 
2.536339 Acknowledgment RA:00:00:00:00:00:01 
2.537156 Acknowledgment RA:00:00:00:00:00:01 
2.538656 IP 10.1.1.1.49153 > 10.1.1.8.9: Flags [.], seq 62781:64241, ack 1, win 65535, length 1460
2.539666 Acknowledgment RA:00:00:00:00:00:01 
2.552631 IP 10.1.1.1.49153 > 10.1.1.8.9: Flags [.], seq 61321:62781, ack 1, win 65535, length 1460
2.554365 IP 10.1.1.1.49153 > 10.1.1.8.9: Flags [.], seq 62781:64241, ack 1, win 65535, length 1460
2.555216 IP 10.1.1.8.9 > 10.1.1.1.49153: Flags [.], ack 62781, win 65535, length 0
2.555530 Acknowledgment RA:00:00:00:00:00:05 
2.572560 IP 10.1.1.1.49153 > 10.1.1.8.9: Flags [.], seq 62781:64241, ack 1, win 65535, length 1460
2.572875 Acknowledgment RA:00:00:00:00:00:02 
2.585405 IP 10.1.1.1.49153 > 10.1.1.8.9: Flags [.], seq 62781:64241, ack 1, win 65535, length 1460
2.587259 IP 10.1.1.1.49153 > 10.1.1.8.9: Flags [.], seq 64241:65701, ack 1, win 65535, length 1460
2.600449 IP 10.1.1.1.49153 > 10.1.1.8.9: Flags [.], seq 64241:65701, ack 1, win 65535, length 1460
2.600764 Acknowledgment RA:00:00:00:00:00:02 
2.613294 IP 10.1.1.1.49153 > 10.1.1.8.9: Flags [.], seq 64241:65701, ack 1, win 65535, length 1460
2.626338 IP 10.1.1.1.49153 > 10.1.1.8.9: Flags [.], seq 65701:67161, ack 1, win 65535, length 1460
2.626892 IP 10.1.1.8.9 > 10.1.1.1.49153: Flags [.], ack 65701, win 65535, length 0
2.628402 IP 10.1.1.8.9 > 10.1.1.1.49153: Flags [.], ack 65701, win 65535, length 0
2.628716 Acknowledgment RA:00:00:00:00:00:05 
2.641326 IP 10.1.1.1.49153 > 10.1.1.8.9: Flags [.], seq 65701:67161, ack 1, win 65535, length 1460
2.641641 Acknowledgment RA:00:00:00:00:00:02 
2.654191 IP 10.1.1.1.49153 > 10.1.1.8.9: Flags [.], seq 65701:67161, ack 1, win 65535, length 1460
2.667275 IP 10.1.1.1.49153 > 10.1.1.8.9: Flags [.], seq 67161:68621, ack 1, win 65535, length 1460
2.667590 Acknowledgment RA:00:00:00:00:00:02 
2.680180 IP 10.1.1.1.49153 > 10.1.1.8.9: Flags [.], seq 67161:68621, ack 1, win 65535, length 1460
2.693124 IP 10.1.1.1.49153 > 10.1.1.8.9: Flags [.], seq 68621:70081, ack 1, win 65535, length 1460
2.694015 IP 10.1.1.8.9 > 10.1.1.1.49153: Flags [.], ack 68621, win 65535, length 0
2.694329 Acknowledgment RA:00:00:00:00:00:05 
2.707479 IP 10.1.1.1.49153 > 10.1.1.8.9: Flags [.], seq 68621:70081, ack 1, win 65535, length 1460
2.707794 Acknowledgment RA:00:00:00:00:00:02 
2.720324 IP 10.1.1.1.49153 > 10.1.1.8.9: Flags [.], seq 68621:70081, ack 1, win 65535, length 1460
2.733368 IP 10.1.1.1.49153 > 10.1.1.8.9: Flags [.], seq 70081:71541, ack 1, win 65535, length 1460
2.733683 Acknowledgment RA:00:00:00:00:00:02 
2.746213 IP 10.1.1.1.49153 > 10.1.1.8.9: Flags [.], seq 71541:73001, ack 1, win 65535, length 1460
2.746528 Acknowledgment RA:00:00:00:00:00:02 
2.759078 IP 10.1.1.1.49153 > 10.1.1.8.9: Flags [.], seq 70081:71541, ack 1, win 65535, length 1460
2.772042 IP 10.1.1.1.49153 > 10.1.1.8.9: Flags [.], seq 73001:74461, ack 1, win 65535, length 1460
2.772357 Acknowledgment RA:00:00:00:00:00:02 
2.784947 IP 10.1.1.1.49153 > 10.1.1.8.9: Flags [.], seq 74461:75921, ack 1, win 65535, length 1460
2.785262 Acknowledgment RA:00:00:00:00:00:02 
2.797852 IP 10.1.1.1.49153 > 10.1.1.8.9: Flags [.], seq 71541:73001, ack 1, win 65535, length 1460
2.810837 IP 10.1.1.1.49153 > 10.1.1.8.9: Flags [.], seq 73001:74461, ack 1, win 65535, length 1460
2.823701 IP 10.1.1.1.49153 > 10.1.1.8.9: Flags [.], seq 75921:77381, ack 1, win 65535, length 1460
2.824016 Acknowledgment RA:00:00:00:00:00:02 
2.836806 IP 10.1.1.1.49153 > 10.1.1.8.9: Flags [.], seq 74461:75921, ack 1, win 65535, length 1460
2.849670 IP 10.1.1.1.49153 > 10.1.1.8.9: Flags [.], seq 77381:78841, ack 1, win 65535, length 1460
2.849985 Acknowledgment RA:00:00:00:00:00:02 
2.862555 IP 10.1.1.1.49153 > 10.1.1.8.9: Flags [.], seq 78841:80301, ack 1, win 65535, length 1460
2.862870 Acknowledgment RA:00:00:00:00:00:02 
2.876496 IP 10.1.1.1.49153 > 10.1.1.8.9: Flags [.], seq 80301:81761, ack 1, win 65535, length 1460
2.876811 Acknowledgment RA:00:00:00:00:00:02 
2.889461 IP 10.1.1.1.49153 > 10.1.1.8.9: Flags [.], seq 74461:75921, ack 1, win 65535, length 1460
2.902445 IP 10.1.1.1.49153 > 10.1.1.8.9: Flags [.], seq 81761:83221, ack 1, win 65535, length 1460
2.915350 IP 10.1.1.1.49153 > 10.1.1.8.9: Flags [.], seq 75921:77381, ack 1, win 65535, length 1460
2.928254 IP 10.1.1.1.49153 > 10.1.1.8.9: Flags [.], seq 81761:83221, ack 1, win 65535, length 1460
2.941124 IP 10.1.1.1.49153 > 10.1.1.8.9: Flags [.], seq 81761:83221, ack 1, win 65535, length 1460
2.941438 Acknowledgment RA:00:00:00:00:00:02 
2.954752 IP 10.1.1.1.49153 > 10.1.1.8.9: Flags [.], seq 77381:78841, ack 1, win 65535, length 1460
2.967637 IP 10.1.1.1.49153 > 10.1.1.8.9: Flags [.], seq 83221:84681, ack 1, win 65535, length 1460
2.967951 Acknowledgment RA:00:00:00:00:00:02 
2.969006 IP 10.1.1.6.654 > 10.1.1.8.654:  aodv rrep 20  prefix 0 hops 4
	dst 10.1.1.1 dseq 1 src 10.1.1.8 2367 ms
2.981676 IP 10.1.1.1.49153 > 10.1.1.8.9: Flags [.], seq 84681:86141, ack 1, win 65535, length 1460
2.994307 IP 10.1.1.1.49153 > 10.1.1.8.9: Flags [.], seq 78841:80301, ack 1, win 65535, length 1460
3.007751 IP 10.1.1.1.49153 > 10.1.1.8.9: Flags [.], seq 84681:86141, ack 1, win 65535, length 1460
3.020422 IP 10.1.1.1.49153 > 10.1.1.8.9: Flags [.], seq 80301:81761, ack 1, win 65535, length 1460
3.021640 Acknowledgment RA:00:00:00:00:00:07 
3.022654 IP 10.1.1.4.654 > 10.1.1.255.654:  aodv rrep 20  prefix 0 hops 0
	dst 10.1.1.4 dseq 0 src 10.1.1.4 2000 ms
3.035244 IP 10.1.1.1.49153 > 10.1.1.8.9: Flags [.], seq 84681:86141, ack 1, win 65535, length 1460
3.035559 Acknowledgment RA:00:00:00:00:00:02 
3.048089 IP 10.1.1.1.49153 > 10.1.1.8.9: Flags [.], seq 86141:87601, ack 1, win 65535, length 1460
3.048404 Acknowledgment RA:00:00:00:00:00:02 
3.049358 IP 10.1.1.5.654 > 10.1.1.8.654:  aodv rrep 20  prefix 0 hops 2
	dst 10.1.1.1 dseq 1 src 10.1.1.8 2959 ms
3.050582 IP 10.1.1.8.9 > 10.1.1.1.49153: Flags [.], ack 62781, win 65535, length 0
3.050897 Acknowledgment RA:00:00:00:00:00:02 
3.051533 Acknowledgment RA:00:00:00:00:00:01 
3.052369 Acknowledgment RA:00:00:00:00:00:01 
3.053299 IP 10.1.1.8.9 > 10.1.1.1.49153: Flags [.], ack 65701, win 65535, length 0
3.054608 IP 10.1.1.5.654 > 10.1.1.2.654:  aodv rrep 20  prefix 0 hops 1
	dst 10.1.1.8 dseq 3 src 10.1.1.1 5519 ms
3.054922 Acknowledgment RA:00:00:00:00:00:05 
3.055977 IP 10.1.1.5.654 > 10.1.1.2.654:  aodv rrep 20  prefix 0 hops 2
	dst 10.1.1.8 dseq 3 src 10.1.1.1 5519 ms
3.056291 Acknowledgment RA:00:00:00:00:00:05 
3.068841 IP 10.1.1.1.49153 > 10.1.1.8.9: Flags [.], seq 90521:91981, ack 1, win 65535, length 1460
3.069155 Acknowledgment RA:00:00:00:00:00:01 
3.069245 IP 10.1.1.3.654 > 10.1.1.255.654:  aodv rrep 20  prefix 0 hops 0
	dst 10.1.1.3 dseq 0 src 10.1.1.3 2000 ms
3.071084 IP 10.1.1.1.654 > 10.1.1.255.654:  aodv rrep 20  prefix 0 hops 0
	dst 10.1.1.1 dseq 1 src 10.1.1.1 2000 ms
3.072075 IP 10.1.1.8.9 > 10.1.1.1.49153: Flags [.], ack 77381, win 65535, length 0
3.072389 Acknowledgment RA:00:00:00:00:00:05 
3.084920 IP 10.1.1.1.49153 > 10.1.1.8.9: Flags [.], seq 81761:83221, ack 1, win 65535, length 1460
3.086184 IP 10.1.1.8.9 > 10.1.1.1.49153: Flags [.], ack 65701, win 65535, length 0
3.086498 Acknowledgment RA:00:00:00:00:00:02 
3.099943 IP 10.1.1.1.49153 > 10.1.1.8.9: Flags [.], seq 83221:84681, ack 1, win 65535, length 1460
3.101148 IP 10.1.1.8.9 > 10.1.1.1.49153: Flags [.], ack 80301, win 65535, length 0
3.101462 Acknowledgment RA:00:00:00:00:00:05 
3.114073 IP 10.1.1.1.49153 > 10.1.1.8.9: Flags [.], seq 91981:93441, ack 1, win 65535, length 1460
3.114387 Acknowledgment RA:00:00:00:00:00:01 
3.115421 IP 10.1.1.5.654 > 10.1.1.2.654:  aodv rrep 20  prefix 0 hops 3
	dst 10.1.1.8 dseq 3 src 10.1.1.1 5519 ms
3.115736 Acknowledgment RA:00:00:00:00:00:05 
3.116606 IP 10.1.1.8.9 > 10.1.1.1.49153: Flags [.], ack 68621, win 65535, length 0
3.117854 IP 10.1.1.5.654 > 10.1.1.255.654:  aodv rrep 20  prefix 0 hops 0
	dst 10.1.1.5 dseq 0 src 10.1.1.5 2000 ms
3.130445 IP 10.1.1.1.49153 > 10.1.1.8.9: Flags [.], seq 93441:94901, ack 1, win 65535, length 1460
3.130759 Acknowledgment RA:00:00:00:00:00:01 
3.132356 Acknowledgment RA:00:00:00:00:00:01 
3.133326 IP 10.1.1.8.9 > 10.1.1.1.49153: Flags [.], ack 68621, win 65535, length 0
3.133641 Acknowledgment RA:00:00:00:00:00:02 
3.134595 IP 10.1.1.2.654 > 10.1.1.255.654:  aodv rrep 20  prefix 0 hops 0
	dst 10.1.1.2 dseq 0 src 10.1.1.2 2000 ms
3.147185 IP 10.1.1.1.49153 > 10.1.1.8.9: Flags [.], seq 87601:89061, ack 1, win 65535, length 1460
3.147499 Acknowledgment RA:00:00:00:00:00:02 
3.148216 Acknowledgment RA:00:00:00:00:00:01 
3.148872 Acknowledgment RA:00:00:00:00:00:01 
3.149609 Acknowledgment RA:00:00:00:00:00:01 
3.150301 IP 10.1.1.1.49153 > 10.1.1.8.9: Flags [.], seq 89061:90521, ack 1, win 65535, length 1460
3.163345 IP 10.1.1.1.49153 > 10.1.1.8.9: Flags [.], seq 84681:86141, ack 1, win 65535, length 1460
3.176390 IP 10.1.1.1.49153 > 10.1.1.8.9: Flags [.], seq 89061:90521, ack 1, win 65535, length 1460
3.189140 IP 10.1.1.1.49153 > 10.1.1.8.9: Flags [.], seq 86141:87601, ack 1, win 65535, length 1460
3.190305 IP 10.1.1.8.9 > 10.1.1.1.49153: Flags [.], ack 83221, win 65535, length 0
3.190620 Acknowledgment RA:00:00:00:00:00:05 
3.203190 IP 10.1.1.1.49153 > 10.1.1.8.9: Flags [.], seq 87601:89061, ack 1, win 65535, length 1460
3.216395 IP 10.1.1.1.49153 > 10.1.1.8.9: Flags [.], seq 89061:90521, ack 1, win 65535, length 1460
3.217325 IP 10.1.1.8.9 > 10.1.1.1.49153: Flags [.], ack 86141, win 65535, length 0
3.217640 Acknowledgment RA:00:00:00:00:00:05 
3.218650 IP 10.1.1.8.9 > 10.1.1.1.49153: Flags [.], ack 89061, win 65535, length 0
3.218965 Acknowledgment RA:00:00:00:00:00:05 
3.231935 IP 10.1.1.1.49153 > 10.1.1.8.9: Flags [.], seq 89061:90521, ack 1, win 65535, length 1460
3.232249 Acknowledgment RA:00:00:00:00:00:02 
3.244779 IP 10.1.1.1.49153 > 10.1.1.8.9: Flags [.], seq 89061:90521, ack 1, win 65535, length 1460
3.245466 IP 10.1.1.2.654 > 10.1.1.1.654:  aodv rrep 20  prefix 0 hops 2
	dst 10.1.1.8 dseq 3 src 10.1.1.1 5519 ms
3.245526 Acknowledgment RA:00:00:00:00:00:02 
3.246560 IP 10.1.1.2.654 > 10.1.1.1.654:  aodv rrep 20  prefix 0 hops 3
	dst 10.1.1.8 dseq 3 src 10.1.1.1 5519 ms
3.246874 Acknowledgment RA:00:00:00:00:00:02 
3.249182 IP 10.1.1.1.49153 > 10.1.1.8.9: Flags [.], seq 90521:91981, ack 1, win 65535, length 1460
3.262372 IP 10.1.1.1.49153 > 10.1.1.8.9: Flags [.], seq 90521:91981, ack 1, win 65535, length 1460
3.262687 Acknowledgment RA:00:00:00:00:00:02 
3.275217 IP 10.1.1.1.49153 > 10.1.1.8.9: Flags [.], seq 90521:91981, ack 1, win 65535, length 1460
3.276641 IP 10.1.1.8.9 > 10.1.1.1.49153: Flags [.], ack 77381, win 65535, length 0
3.276956 Acknowledgment RA:00:00:00:00:00:02 
3.290418 IP 10.1.1.1.49153 > 10.1.1.8.9: Flags [.], seq 100741:102201, ack 1, win 65535, length 1460
3.290732 Acknowledgment RA:00:00:00:00:00:01 
3.291602 IP 10.1.1.8.9 > 10.1.1.1.49153: Flags [.], ack 80301, win 65535, length 0
3.291916 Acknowledgment RA:00:00:00:00:00:02 
3.294044 IP 10.1.1.1.49153 > 10.1.1.8.9: Flags [.], seq 91981:93441, ack 1, win 65535, length 1460
3.295471 IP 10.1.1.8.9 > 10.1.1.1.49153: Flags [.], ack 91981, win 65535, length 0
3.295785 Acknowledgment RA:00:00:00:00:00:05 
3.296542 Acknowledgment RA:00:00:00:00:00:01 
3.297258 Acknowledgment RA:00:00:00:00:00:01 
